HS,2020,202001,January 2020,2,0,2,Exports,392,Japan,,0,World,,,,,,,,,51,"Wool, fine or coarse animal hair; horsehair yarn and woven fabric",,,,,,,0,,4625198,,,0
HS,2020,202001,January 2020,2,0,2,Exports,392,Japan,,0,World,,,,,,,,,53,Vegetable textile fibres; paper yarn and woven fabrics of paper yarn,,,,,,,0,,1733790,,,0
HS,2020,202001,January 2020,2,0,2,Exports,392,Japan,,0,World,,,,,,,,,55,Man-made staple fibres,,,,,,,0,,110630560,,,0
HS,2020,202001,January 2020,2,0,2,Exports,392,Japan,,0,World,,,,,,,,,57,Carpets and other textile floor coverings,,,,,,,0,,2253057,,,0
HS,2020,202001,January 2020,2,0,2,Exports,392,Japan,,0,World,,,,,,,,,03,"Fish and crustaceans, molluscs and other aquatic invertebrates",,,,,,,0,,82292997,,,0
HS,2020,202001,January 2020,2,0,2,Exports,392,Japan,,0,World,,,,,,,,,01,Animals; live,,,,,,,,,1948084,,,0
HS,2020,202001,January 2020,2,0,2,Exports,392,Japan,,0,World,,,,,,,,,43,Furskins and artificial fur; manufactures thereof,,,,,,,0,,8235,,,0
HS,2020,202001,January 2020,2,0,2,Exports,392,Japan,,0,World,,,,,,,,,41,Raw hides and skins (other than furskins) and leather,,,,,,,0,,8907814,,,0
HS,2020,202001,January 2020,2,0,2,Exports,392,Japan,,0,World,,,,,,,,,70,Glass and glassware,,,,,,,0,,214963713,,,0
HS,2020,202001,January 2020,2,0,2,Exports,392,Japan,,0,World,,,,,,,,,72,Iron and steel,,,,,,,0,,1915615148,,,0
HS,2020,202001,January 2020,2,0,2,Exports,392,Japan,,0,World,,,,,,,,,74,Copper and articles thereof,,,,,,,,,636279771,,,0
HS,2020,202001,January 2020,2,0,2,Exports,392,Japan,,0,World,,,,,,,,,65,Headgear and parts thereof,,,,,,,0,,11706683,,,0
HS,2020,202001,January 2020,2,0,2,Exports,392,Japan,,0,World,,,,,,,,,67,"Feathers and down, prepared; and articles made of feather or of down; artificial flowers; articles of human hair",,,,,,,0,,319001,,,0
HS,2020,202001,January 2020,2,0,2,Exports,392,Japan,,0,World,,,,,,,,,59,"Textile fabrics; impregnated, coated, covered or laminated; textile articles of a kind suitable for industrial use",,,,,,,0,,55327747,,,0
HS,2020,202001,January 2020,2,0,2,Exports,392,Japan,,0,World,,,,,,,,,60,Fabrics; knitted or crocheted,,,,,,,0,,31538153,,,0
HS,2020,202001,January 2020,2,0,2,Exports,392,Japan,,0,World,,,,,,,,,61,Apparel and clothing accessories; knitted or crocheted,,,,,,,0,,19742546,,,0
HS,2020,202001,January 2020,2,0,2,Exports,392,Japan,,0,World,,,,,,,,,62,Apparel and clothing accessories; not knitted or crocheted,,,,,,,0,,20473617,,,0
HS,2020,202001,January 2020,2,0,2,Exports,392,Japan,,0,World,,,,,,,,,64,Footwear; gaiters and the like; parts of such articles,,,,,,,0,,5352252,,,0
HS,2020,202001,January 2020,2,0,2,Exports,392,Japan,,0,World,,,,,,,,,63,"Textiles, made up articles; sets; worn clothing and worn textile articles; rags",,,,,,,0,,23809139,,,0
HS,2020,202001,January 2020,2,0,2,Exports,392,Japan,,0,World,,,,,,,,,12,"Oil seeds and oleaginous fruits; miscellaneous grains, seeds and fruit, industrial or medicinal plants; straw and fodder",,,,,,,0,,7486372,,,0
HS,2020,202001,January 2020,2,0,2,Exports,392,Japan,,0,World,,,,,,,,,14,Vegetable plaiting materials; vegetable products not elsewhere specified or included,,,,,,,0,,189514,,,0
HS,2020,202001,January 2020,2,0,2,Exports,392,Japan,,0,World,,,,,,,,,16,"Meat, fish or crustaceans, molluscs or other aquatic invertebrates; preparations thereof",,,,,,,0,,31929909,,,0
HS,2020,202001,January 2020,2,0,2,Exports,392,Japan,,0,World,,,,,,,,,19,"Preparations of cereals, flour, starch or milk; pastrycooks' products",,,,,,,0,,42243178,,,0
HS,2020,202001,January 2020,2,0,2,Exports,392,Japan,,0,World,,,,,,,,,20,"Preparations of vegetables, fruit, nuts or other parts of plants",,,,,,,0,,7699586,,,0
HS,2020,202001,January 2020,2,0,2,Exports,392,Japan,,0,World,,,,,,,,,96,Miscellaneous manufactured articles,,,,,,,0,,202970275,,,0
HS,2020,202001,January 2020,2,0,2,Exports,392,Japan,,0,World,,,,,,,,,93,Arms and ammunition; parts and accessories thereof,,,,,,,0,,11498942,,,0
HS,2020,202001,January 2020,2,0,2,Exports,392,Japan,,0,World,,,,,,,,,94,"Furniture; bedding, mattresses, mattress supports, cushions and similar stuffed furnishings; lamps and lighting fittings, n.e.s.; illuminated signs, illuminated name-plates and the like; prefabricated buildings",,,,,,,0,,74250866,,,0
HS,2020,202001,January 2020,2,0,2,Exports,392,Japan,,0,World,,,,,,,,,11,"Products of the milling industry; malt, starches, inulin, wheat gluten",,,,,,,0,,4864893,,,0
HS,2020,202001,January 2020,2,0,2,Exports,392,Japan,,0,World,,,,,,,,,99,Commodities not specified according to kind,,,,,,,0,,2925338153,,,0
HS,2020,202001,January 2020,2,0,2,Exports,392,Japan,,0,World,,,,,,,,,89,"Ships, boats and floating structures",,,,,,,0,,1368545912,,,0
HS,2020,202001,January 2020,2,0,2,Exports,392,Japan,,0,World,,,,,,,,,85,"Electrical machinery and equipment and parts thereof; sound recorders and reproducers; television image and sound recorders and reproducers, parts and accessories of such articles",,,,,,,0,,7340672301,,,0
HS,2020,202001,January 2020,2,0,2,Exports,392,Japan,,0,World,,,,,,,,,75,Nickel and articles thereof,,,,,,,0,,67256877,,,0
HS,2020,202001,January 2020,2,0,2,Exports,392,Japan,,0,World,,,,,,,,,83,Metal; miscellaneous products of base metal,,,,,,,0,,59531084,,,0
HS,2020,202001,January 2020,2,0,2,Exports,392,Japan,,0,World,,,,,,,,,80,Tin; articles thereof,,,,,,,0,,5530035,,,0
HS,2020,202001,January 2020,2,0,2,Exports,392,Japan,,0,World,,,,,,,,,84,"Nuclear reactors, boilers, machinery and mechanical appliances; parts thereof",,,,,,,0,,8708831133,,,0
HS,2020,202007,July 2020,2,0,2,Exports,392,Japan,,0,World,,,,,,,,,85,"Electrical machinery and equipment and parts thereof; sound recorders and reproducers; television image and sound recorders and reproducers, parts and accessories of such articles",,,,,,,,,8284276319,,,0
HS,2020,202007,July 2020,2,0,2,Exports,392,Japan,,0,World,,,,,,,,,84,"Nuclear reactors, boilers, machinery and mechanical appliances; parts thereof",,,,,,,0,,9650614450,,,0
HS,2020,202007,July 2020,2,0,2,Exports,392,Japan,,0,World,,,,,,,,,39,Plastics and articles thereof,,,,,,,0,,1998310858,,,0
HS,2020,202007,July 2020,2,0,2,Exports,392,Japan,,0,World,,,,,,,,,10,Cereals,,,,,,,0,,3366999,,,0
HS,2020,202007,July 2020,2,0,2,Exports,392,Japan,,0,World,,,,,,,,,36,Explosives; pyrotechnic products; matches; pyrophoric alloys; certain combustible preparations,,,,,,,0,,1128378,,,0
HS,2020,202007,July 2020,2,0,2,Exports,392,Japan,,0,World,,,,,,,,,99,Commodities not specified according to kind,,,,,,,0,,3392779507,,,0
HS,2020,202007,July 2020,2,0,2,Exports,392,Japan,,0,World,,,,,,,,,11,"Products of the milling industry; malt, starches, inulin, wheat gluten",,,,,,,0,,6779969,,,0
HS,2020,202007,July 2020,2,0,2,Exports,392,Japan,,0,World,,,,,,,,,07,Vegetables and certain roots and tubers; edible,,,,,,,0,,5090134,,,0
HS,2020,202007,July 2020,2,0,2,Exports,392,Japan,,0,World,,,,,,,,,08,"Fruit and nuts, edible; peel of citrus fruit or melons",,,,,,,0,,12511936,,,0
HS,2020,202007,July 2020,2,0,2,Exports,392,Japan,,0,World,,,,,,,,,06,"Trees and other plants, live; bulbs, roots and the like; cut flowers and ornamental foliage",,,,,,,,,4458150,,,0
HS,2020,202007,July 2020,2,0,2,Exports,392,Japan,,0,World,,,,,,,,,29,Organic chemicals,,,,,,,0,,1130131625,,,0
HS,2020,202007,July 2020,2,0,2,Exports,392,Japan,,0,World,,,,,,,,,95,"Toys, games and sports requisites; parts and accessories thereof",,,,,,,0,,360253526,,,0
HS,2020,202007,July 2020,2,0,2,Exports,392,Japan,,0,World,,,,,,,,,88,"Aircraft, spacecraft and parts thereof",,,,,,,0,,299324963,,,0
HS,2020,202003,March 2020,2,0,2,Exports,392,Japan,,0,World,,,,,,,,,29,Organic chemicals,,,,,,,0,,1351616045,,,0
HS,2020,202003,March 2020,2,0,2,Exports,392,Japan,,0,World,,,,,,,,,10,Cereals,,,,,,,0,,5582661,,,0
HS,2020,202003,March 2020,2,0,2,Exports,392,Japan,,0,World,,,,,,,,,39,Plastics and articles thereof,,,,,,,0,,2233916101,,,0
HS,2020,202003,March 2020,2,0,2,Exports,392,Japan,,0,World,,,,,,,,,07,Vegetables and certain roots and tubers; edible,,,,,,,0,,5190072,,,0
HS,2020,202003,March 2020,2,0,2,Exports,392,Japan,,0,World,,,,,,,,,05,Animal originated products; not elsewhere specified or included,,,,,,,0,,2524491,,,0
HS,2020,202003,March 2020,2,0,2,Exports,392,Japan,,0,World,,,,,,,,,17,Sugars and sugar confectionery,,,,,,,0,,11810566,,,0
HS,2020,202003,March 2020,2,0,2,Exports,392,Japan,,0,World,,,,,,,,,15,Animal or vegetable fats and oils and their cleavage products; prepared animal fats; animal or vegetable waxes,,,,,,,0,,20001498,,,0
HS,2020,202003,March 2020,2,0,2,Exports,392,Japan,,0,World,,,,,,,,,25,"Salt; sulphur; earths, stone; plastering materials, lime and cement",,,,,,,0,,66852998,,,0
HS,2020,202003,March 2020,2,0,2,Exports,392,Japan,,0,World,,,,,,,,,36,Explosives; pyrotechnic products; matches; pyrophoric alloys; certain combustible preparations,,,,,,,0,,706179,,,0
HS,2020,202003,March 2020,2,0,2,Exports,392,Japan,,0,World,,,,,,,,,38,Chemical products n.e.s.,,,,,,,0,,1080203461,,,0
HS,2020,202003,March 2020,2,0,2,Exports,392,Japan,,0,World,,,,,,,,,13,"Lac; gums, resins and other vegetable saps and extracts",,,,,,,0,,3990944,,,0
HS,2020,202003,March 2020,2,0,2,Exports,392,Japan,,0,World,,,,,,,,,02,Meat and edible meat offal,,,,,,,0,,17931678,,,0
HS,2020,202003,March 2020,2,0,2,Exports,392,Japan,,0,World,,,,,,,,,04,"Dairy produce; birds' eggs; natural honey; edible products of animal origin, not elsewhere specified or included",,,,,,,0,,6738078,,,0
HS,2020,202003,March 2020,2,0,2,Exports,392,Japan,,0,World,,,,,,,,,23,"Food industries, residues and wastes thereof; prepared animal fodder",,,,,,,0,,11614187,,,0
HS,2020,202003,March 2020,2,0,2,Exports,392,Japan,,0,World,,,,,,,,,22,"Beverages, spirits and vinegar",,,,,,,0,,83432807,,,0
HS,2020,202003,March 2020,2,0,2,Exports,392,Japan,,0,World,,,,,,,,,33,"Essential oils and resinoids; perfumery, cosmetic or toilet preparations",,,,,,,0,,516389265,,,0
HS,2020,202003,March 2020,2,0,2,Exports,392,Japan,,0,World,,,,,,,,,26,"Ores, slag and ash",,,,,,,,,18397459,,,0
HS,2020,202003,March 2020,2,0,2,Exports,392,Japan,,0,World,,,,,,,,,34,"Soap, organic surface-active agents; washing, lubricating, polishing or scouring preparations; artificial or prepared waxes, candles and similar articles, modelling pastes, ""dental waxes"" and dental preparations with a basis of plaster",,,,,,,0,,273406714,,,0
HS,2020,202003,March 2020,2,0,2,Exports,392,Japan,,0,World,,,,,,,,,06,"Trees and other plants, live; bulbs, roots and the like; cut flowers and ornamental foliage",,,,,,,0,,14979377,,,0
HS,2020,202003,March 2020,2,0,2,Exports,392,Japan,,0,World,,,,,,,,,08,"Fruit and nuts, edible; peel of citrus fruit or melons",,,,,,,0,,11700931,,,0
HS,2020,202003,March 2020,2,0,2,Exports,392,Japan,,0,World,,,,,,,,,18,Cocoa and cocoa preparations,,,,,,,0,,5605682,,,0
HS,2020,202003,March 2020,2,0,2,Exports,392,Japan,,0,World,,,,,,,,,27,"Mineral fuels, mineral oils and products of their distillation; bituminous substances; mineral waxes",,,,,,,0,,1084136163,,,0
HS,2020,202003,March 2020,2,0,2,Exports,392,Japan,,0,World,,,,,,,,,31,Fertilizers,,,,,,,0,,12980550,,,0
HS,2020,202003,March 2020,2,0,2,Exports,392,Japan,,0,World,,,,,,,,,32,"Tanning or dyeing extracts; tannins and their derivatives; dyes, pigments and other colouring matter; paints, varnishes; putty, other mastics; inks",,,,,,,0,,422164851,,,0
HS,2020,202003,March 2020,2,0,2,Exports,392,Japan,,0,World,,,,,,,,,28,"Inorganic chemicals; organic and inorganic compounds of precious metals; of rare earth metals, of radio-active elements and of isotopes",,,,,,,0,,626907114,,,0
HS,2020,202003,March 2020,2,0,2,Exports,392,Japan,,0,World,,,,,,,,,37,Photographic or cinematographic goods,,,,,,,,,430928850,,,0
HS,2020,202003,March 2020,2,0,2,Exports,392,Japan,,0,World,,,,,,,,,35,Albuminoidal substances; modified starches; glues; enzymes,,,,,,,0,,81040198,,,0
HS,2020,202003,March 2020,2,0,2,Exports,392,Japan,,0,World,,,,,,,,,11,"Products of the milling industry; malt, starches, inulin, wheat gluten",,,,,,,0,,6328945,,,0
HS,2020,202003,March 2020,2,0,2,Exports,392,Japan,,0,World,,,,,,,,,19,"Preparations of cereals, flour, starch or milk; pastrycooks' products",,,,,,,0,,63950179,,,0
HS,2020,202003,March 2020,2,0,2,Exports,392,Japan,,0,World,,,,,,,,,20,"Preparations of vegetables, fruit, nuts or other parts of plants",,,,,,,0,,12660482,,,0
HS,2020,202003,March 2020,2,0,2,Exports,392,Japan,,0,World,,,,,,,,,16,"Meat, fish or crustaceans, molluscs or other aquatic invertebrates; preparations thereof",,,,,,,0,,44227581,,,0
HS,2020,202003,March 2020,2,0,2,Exports,392,Japan,,0,World,,,,,,,,,14,Vegetable plaiting materials; vegetable products not elsewhere specified or included,,,,,,,,,274715,,,0
HS,2020,202003,March 2020,2,0,2,Exports,392,Japan,,0,World,,,,,,,,,12,"Oil seeds and oleaginous fruits; miscellaneous grains, seeds and fruit, industrial or medicinal plants; straw and fodder",,,,,,,0,,12869722,,,0
HS,2020,202003,March 2020,2,0,2,Exports,392,Japan,,0,World,,,,,,,,,03,"Fish and crustaceans, molluscs and other aquatic invertebrates",,,,,,,0,,114326553,,,0
HS,2020,202003,March 2020,2,0,2,Exports,392,Japan,,0,World,,,,,,,,,01,Animals; live,,,,,,,0,,1045558,,,0
HS,2020,202003,March 2020,2,0,2,Exports,392,Japan,,0,World,,,,,,,,,09,"Coffee, tea, mate and spices",,,,,,,0,,13937295,,,0
HS,2020,202003,March 2020,2,0,2,Exports,392,Japan,,0,World,,,,,,,,,21,Miscellaneous edible preparations,,,,,,,0,,155169530,,,0
HS,2020,202003,March 2020,2,0,2,Exports,392,Japan,,0,World,,,,,,,,,24,Tobacco and manufactured tobacco substitutes,,,,,,,0,,5486308,,,0
HS,2020,202003,March 2020,2,0,2,Exports,392,Japan,,0,World,,,,,,,,,30,Pharmaceutical products,,,,,,,0,,539346457,,,0
HS,2020,202003,March 2020,2,0,2,Exports,392,Japan,,0,World,,,,,,,,,52,Cotton,,,,,,,0,,31151274,,,0
HS,2020,202003,March 2020,2,0,2,Exports,392,Japan,,0,World,,,,,,,,,79,Zinc and articles thereof,,,,,,,0,,35982264,,,0
HS,2020,202003,March 2020,2,0,2,Exports,392,Japan,,0,World,,,,,,,,,41,Raw hides and skins (other than furskins) and leather,,,,,,,0,,10597736,,,0
HS,2020,202003,March 2020,2,0,2,Exports,392,Japan,,0,World,,,,,,,,,43,Furskins and artificial fur; manufactures thereof,,,,,,,0,,30943,,,0
HS,2020,202003,March 2020,2,0,2,Exports,392,Japan,,0,World,,,,,,,,,57,Carpets and other textile floor coverings,,,,,,,0,,2967493,,,0
HS,2020,202003,March 2020,2,0,2,Exports,392,Japan,,0,World,,,,,,,,,53,Vegetable textile fibres; paper yarn and woven fabrics of paper yarn,,,,,,,0,,1671900,,,0
HS,2020,202003,March 2020,2,0,2,Exports,392,Japan,,0,World,,,,,,,,,55,Man-made staple fibres,,,,,,,0,,105925383,,,0
HS,2020,202003,March 2020,2,0,2,Exports,392,Japan,,0,World,,,,,,,,,51,"Wool, fine or coarse animal hair; horsehair yarn and woven fabric",,,,,,,0,,8996540,,,0
HS,2020,202003,March 2020,2,0,2,Exports,392,Japan,,0,World,,,,,,,,,48,"Paper and paperboard; articles of paper pulp, of paper or paperboard",,,,,,,0,,243046806,,,0
HS,2020,202003,March 2020,2,0,2,Exports,392,Japan,,0,World,,,,,,,,,60,Fabrics; knitted or crocheted,,,,,,,0,,44982067,,,0
HS,2020,202003,March 2020,2,0,2,Exports,392,Japan,,0,World,,,,,,,,,61,Apparel and clothing accessories; knitted or crocheted,,,,,,,0,,15640949,,,0
HS,2020,202003,March 2020,2,0,2,Exports,392,Japan,,0,World,,,,,,,,,80,Tin; articles thereof,,,,,,,0,,7091410,,,0
HS,2020,202003,March 2020,2,0,2,Exports,392,Japan,,0,World,,,,,,,,,42,"Articles of leather; saddlery and harness; travel goods, handbags and similar containers; articles of animal gut (other than silk-worm gut)",,,,,,,0,,6233058,,,0
HS,2020,202003,March 2020,2,0,2,Exports,392,Japan,,0,World,,,,,,,,,56,"Wadding, felt and nonwovens, special yarns; twine, cordage, ropes and cables and articles thereof",,,,,,,0,,104846281,,,0
HS,2020,202003,March 2020,2,0,2,Exports,392,Japan,,0,World,,,,,,,,,50,Silk,,,,,,,0,,4017460,,,0
HS,2020,202003,March 2020,2,0,2,Exports,392,Japan,,0,World,,,,,,,,,47,Pulp of wood or other fibrous cellulosic material; waste and scrap of paper or paperboard,,,,,,,0,,47143803,,,0
HS,2020,202003,March 2020,2,0,2,Exports,392,Japan,,0,World,,,,,,,,,46,"Manufactures of straw, esparto or other plaiting materials; basketware and wickerwork",,,,,,,0,,221590,,,0
HS,2020,202003,March 2020,2,0,2,Exports,392,Japan,,0,World,,,,,,,,,45,Cork and articles of cork,,,,,,,0,,169191,,,0
HS,2020,202003,March 2020,2,0,2,Exports,392,Japan,,0,World,,,,,,,,,87,"Vehicles; other than railway or tramway rolling stock, and parts and accessories thereof",,,,,,,0,,12062968759,,,0
HS,2020,202003,March 2020,2,0,2,Exports,392,Japan,,0,World,,,,,,,,,95,"Toys, games and sports requisites; parts and accessories thereof",,,,,,,0,,256079092,,,0
HS,2020,202003,March 2020,2,0,2,Exports,392,Japan,,0,World,,,,,,,,,49,"Printed books, newspapers, pictures and other products of the printing industry; manuscripts, typescripts and plans",,,,,,,0,,29879709,,,0
HS,2020,202003,March 2020,2,0,2,Exports,392,Japan,,0,World,,,,,,,,,54,Man-made filaments,,,,,,,0,,168626374,,,0
HS,2020,202003,March 2020,2,0,2,Exports,392,Japan,,0,World,,,,,,,,,44,Wood and articles of wood; wood charcoal,,,,,,,0,,24092355,,,0
HS,2020,202003,March 2020,2,0,2,Exports,392,Japan,,0,World,,,,,,,,,40,Rubber and articles thereof,,,,,,,0,,865915311,,,0
HS,2020,202003,March 2020,2,0,2,Exports,392,Japan,,0,World,,,,,,,,,97,Works of art; collectors' pieces and antiques,,,,,,,0,,13252012,,,0
HS,2020,202003,March 2020,2,0,2,Exports,392,Japan,,0,World,,,,,,,,,88,"Aircraft, spacecraft and parts thereof",,,,,,,0,,375535835,,,0
HS,2020,202003,March 2020,2,0,2,Exports,392,Japan,,0,World,,,,,,,,,83,Metal; miscellaneous products of base metal,,,,,,,0,,71052903,,,0
HS,2020,202003,March 2020,2,0,2,Exports,392,Japan,,0,World,,,,,,,,,84,"Nuclear reactors, boilers, machinery and mechanical appliances; parts thereof",,,,,,,0,,11634076465,,,0
HS,2020,202003,March 2020,2,0,2,Exports,392,Japan,,0,World,,,,,,,,,75,Nickel and articles thereof,,,,,,,0,,86838326,,,0
HS,2020,202003,March 2020,2,0,2,Exports,392,Japan,,0,World,,,,,,,,,89,"Ships, boats and floating structures",,,,,,,,,989998119,,,0
HS,2020,202003,March 2020,2,0,2,Exports,392,Japan,,0,World,,,,,,,,,85,"Electrical machinery and equipment and parts thereof; sound recorders and reproducers; television image and sound recorders and reproducers, parts and accessories of such articles",,,,,,,,,8972638738,,,0
HS,2020,202003,March 2020,2,0,2,Exports,392,Japan,,0,World,,,,,,,,,99,Commodities not specified according to kind,,,,,,,0,,3293275231,,,0
HS,2020,202003,March 2020,2,0,2,Exports,392,Japan,,0,World,,,,,,,,,94,"Furniture; bedding, mattresses, mattress supports, cushions and similar stuffed furnishings; lamps and lighting fittings, n.e.s.; illuminated signs, illuminated name-plates and the like; prefabricated buildings",,,,,,,0,,83590777,,,0
HS,2020,202003,March 2020,2,0,2,Exports,392,Japan,,0,World,,,,,,,,,93,Arms and ammunition; parts and accessories thereof,,,,,,,0,,9876813,,,0
HS,2020,202003,March 2020,2,0,2,Exports,392,Japan,,0,World,,,,,,,,,96,Miscellaneous manufactured articles,,,,,,,0,,271608804,,,0
HS,2020,202003,March 2020,2,0,2,Exports,392,Japan,,0,World,,,,,,,,,62,Apparel and clothing accessories; not knitted or crocheted,,,,,,,0,,21007930,,,0
HS,2020,202003,March 2020,2,0,2,Exports,392,Japan,,0,World,,,,,,,,,63,"Textiles, made up articles; sets; worn clothing and worn textile articles; rags",,,,,,,0,,28765059,,,0
HS,2020,202003,March 2020,2,0,2,Exports,392,Japan,,0,World,,,,,,,,,59,"Textile fabrics; impregnated, coated, covered or laminated; textile articles of a kind suitable for industrial use",,,,,,,0,,80494841,,,0
HS,2020,202003,March 2020,2,0,2,Exports,392,Japan,,0,World,,,,,,,,,67,"Feathers and down, prepared; and articles made of feather or of down; artificial flowers; articles of human hair",,,,,,,0,,435537,,,0
HS,2020,202003,March 2020,2,0,2,Exports,392,Japan,,0,World,,,,,,,,,65,Headgear and parts thereof,,,,,,,0,,13063994,,,0
HS,2020,202003,March 2020,2,0,2,Exports,392,Japan,,0,World,,,,,,,,,64,Footwear; gaiters and the like; parts of such articles,,,,,,,0,,5852586,,,0
HS,2020,202003,March 2020,2,0,2,Exports,392,Japan,,0,World,,,,,,,,,72,Iron and steel,,,,,,,0,,2452676345,,,0
HS,2020,202003,March 2020,2,0,2,Exports,392,Japan,,0,World,,,,,,,,,70,Glass and glassware,,,,,,,0,,260203419,,,0
HS,2020,202003,March 2020,2,0,2,Exports,392,Japan,,0,World,,,,,,,,,74,Copper and articles thereof,,,,,,,0,,731035882,,,0
HS,2020,202003,March 2020,2,0,2,Exports,392,Japan,,0,World,,,,,,,,,78,Lead and articles thereof,,,,,,,,,6950916,,,0
HS,2020,202003,March 2020,2,0,2,Exports,392,Japan,,0,World,,,,,,,,,86,"Railway, tramway locomotives, rolling-stock and parts thereof; railway or tramway track fixtures and fittings and parts thereof; mechanical (including electro-mechanical) traffic signalling equipment of all kinds",,,,,,,0,,32405905,,,0
HS,2020,202003,March 2020,2,0,2,Exports,392,Japan,,0,World,,,,,,,,,82,"Tools, implements, cutlery, spoons and forks, of base metal; parts thereof, of base metal",,,,,,,0,,325374004,,,0
HS,2020,202003,March 2020,2,0,2,Exports,392,Japan,,0,World,,,,,,,,,81,"Metals; n.e.s., cermets and articles thereof",,,,,,,0,,113826194,,,0
HS,2020,202003,March 2020,2,0,2,Exports,392,Japan,,0,World,,,,,,,,,69,Ceramic products,,,,,,,0,,140961769,,,0
HS,2020,202003,March 2020,2,0,2,Exports,392,Japan,,0,World,,,,,,,,,68,"Stone, plaster, cement, asbestos, mica or similar materials; articles thereof",,,,,,,0,,203221482,,,0
HS,2020,202003,March 2020,2,0,2,Exports,392,Japan,,0,World,,,,,,,,,76,Aluminium and articles thereof,,,,,,,0,,195607624,,,0
HS,2020,202003,March 2020,2,0,2,Exports,392,Japan,,0,World,,,,,,,,,71,"Natural, cultured pearls; precious, semi-precious stones; precious metals, metals clad with precious metal, and articles thereof; imitation jewellery; coin",,,,,,,0,,912440425,,,0
HS,2020,202003,March 2020,2,0,2,Exports,392,Japan,,0,World,,,,,,,,,73,Iron or steel articles,,,,,,,0,,983239965,,,0
HS,2020,202004,April 2020,2,0,2,Exports,392,Japan,,0,World,,,,,,,,,73,Iron or steel articles,,,,,,,0,,729798013,,,0
HS,2020,202004,April 2020,2,0,2,Exports,392,Japan,,0,World,,,,,,,,,71,"Natural, cultured pearls; precious, semi-precious stones; precious metals, metals clad with precious metal, and articles thereof; imitation jewellery; coin",,,,,,,0,,767054439,,,0
HS,2020,202004,April 2020,2,0,2,Exports,392,Japan,,0,World,,,,,,,,,76,Aluminium and articles thereof,,,,,,,0,,184300846,,,0
HS,2020,202004,April 2020,2,0,2,Exports,392,Japan,,0,World,,,,,,,,,68,"Stone, plaster, cement, asbestos, mica or similar materials; articles thereof",,,,,,,0,,174388361,,,0
HS,2020,202004,April 2020,2,0,2,Exports,392,Japan,,0,World,,,,,,,,,69,Ceramic products,,,,,,,0,,128905255,,,0
HS,2020,202004,April 2020,2,0,2,Exports,392,Japan,,0,World,,,,,,,,,81,"Metals; n.e.s., cermets and articles thereof",,,,,,,0,,82616748,,,0
HS,2020,202004,April 2020,2,0,2,Exports,392,Japan,,0,World,,,,,,,,,82,"Tools, implements, cutlery, spoons and forks, of base metal; parts thereof, of base metal",,,,,,,0,,284856926,,,0
HS,2020,202004,April 2020,2,0,2,Exports,392,Japan,,0,World,,,,,,,,,86,"Railway, tramway locomotives, rolling-stock and parts thereof; railway or tramway track fixtures and fittings and parts thereof; mechanical (including electro-mechanical) traffic signalling equipment of all kinds",,,,,,,0,,46467818,,,0
HS,2020,202004,April 2020,2,0,2,Exports,392,Japan,,0,World,,,,,,,,,78,Lead and articles thereof,,,,,,,0,,5005446,,,0
HS,2020,202004,April 2020,2,0,2,Exports,392,Japan,,0,World,,,,,,,,,79,Zinc and articles thereof,,,,,,,0,,20162586,,,0
HS,2020,202004,April 2020,2,0,2,Exports,392,Japan,,0,World,,,,,,,,,52,Cotton,,,,,,,0,,27466409,,,0
HS,2020,202004,April 2020,2,0,2,Exports,392,Japan,,0,World,,,,,,,,,74,Copper and articles thereof,,,,,,,0,,587494691,,,0
HS,2020,202004,April 2020,2,0,2,Exports,392,Japan,,0,World,,,,,,,,,70,Glass and glassware,,,,,,,0,,246986556,,,0
HS,2020,202004,April 2020,2,0,2,Exports,392,Japan,,0,World,,,,,,,,,72,Iron and steel,,,,,,,0,,2029383851,,,0
HS,2020,202004,April 2020,2,0,2,Exports,392,Japan,,0,World,,,,,,,,,64,Footwear; gaiters and the like; parts of such articles,,,,,,,0,,4836549,,,0
HS,2020,202004,April 2020,2,0,2,Exports,392,Japan,,0,World,,,,,,,,,65,Headgear and parts thereof,,,,,,,0,,13581945,,,0
HS,2020,202004,April 2020,2,0,2,Exports,392,Japan,,0,World,,,,,,,,,67,"Feathers and down, prepared; and articles made of feather or of down; artificial flowers; articles of human hair",,,,,,,0,,427694,,,0
HS,2020,202004,April 2020,2,0,2,Exports,392,Japan,,0,World,,,,,,,,,59,"Textile fabrics; impregnated, coated, covered or laminated; textile articles of a kind suitable for industrial use",,,,,,,0,,74944483,,,0
HS,2020,202004,April 2020,2,0,2,Exports,392,Japan,,0,World,,,,,,,,,60,Fabrics; knitted or crocheted,,,,,,,0,,44641718,,,0
HS,2020,202004,April 2020,2,0,2,Exports,392,Japan,,0,World,,,,,,,,,63,"Textiles, made up articles; sets; worn clothing and worn textile articles; rags",,,,,,,0,,21142258,,,0
HS,2020,202004,April 2020,2,0,2,Exports,392,Japan,,0,World,,,,,,,,,62,Apparel and clothing accessories; not knitted or crocheted,,,,,,,0,,14627900,,,0
HS,2020,202004,April 2020,2,0,2,Exports,392,Japan,,0,World,,,,,,,,,61,Apparel and clothing accessories; knitted or crocheted,,,,,,,0,,14043679,,,0
HS,2020,202004,April 2020,2,0,2,Exports,392,Japan,,0,World,,,,,,,,,48,"Paper and paperboard; articles of paper pulp, of paper or paperboard",,,,,,,0,,207507932,,,0
HS,2020,202004,April 2020,2,0,2,Exports,392,Japan,,0,World,,,,,,,,,51,"Wool, fine or coarse animal hair; horsehair yarn and woven fabric",,,,,,,0,,11641790,,,0
HS,2020,202004,April 2020,2,0,2,Exports,392,Japan,,0,World,,,,,,,,,55,Man-made staple fibres,,,,,,,0,,78125506,,,0
