Classification,Year,Period,Period Desc.,Aggregate Level,Is Leaf Code,Trade Flow Code,Trade Flow,Reporter Code,Reporter,Reporter ISO,Partner Code,Partner,Partner ISO,2nd Partner Code,2nd Partner,2nd Partner ISO,Customs Proc. Code,Customs,Mode of Transport Code,Mode of Transport,Commodity Code,Commodity,Qty Unit Code,Qty Unit,Qty,Alt Qty Unit Code,Alt Qty Unit,Alt Qty,Netweight (kg),Gross weight (kg),Trade Value (US$),CIF Trade Value (US$),FOB Trade Value (US$),Flag
HS,2020,202007,July 2020,2,0,2,Exports,392,Japan,,0,World,,,,,,,,,32,"Tanning or dyeing extracts; tannins and their derivatives; dyes, pigments and other colouring matter; paints, varnishes; putty, other mastics; inks",,,,,,,,,339238571,,,0
HS,2020,202007,July 2020,2,0,2,Exports,392,Japan,,0,World,,,,,,,,,30,Pharmaceutical products,,,,,,,0,,580047861,,,0
HS,2020,202007,July 2020,2,0,2,Exports,392,Japan,,0,World,,,,,,,,,69,Ceramic products,,,,,,,0,,112630331,,,0
HS,2020,202007,July 2020,2,0,2,Exports,392,Japan,,0,World,,,,,,,,,45,Cork and articles of cork,,,,,,,0,,113424,,,0
HS,2020,202007,July 2020,2,0,2,Exports,392,Japan,,0,World,,,,,,,,,19,"Preparations of cereals, flour, starch or milk; pastrycooks' products",,,,,,,0,,63823086,,,0
HS,2020,202007,July 2020,2,0,2,Exports,392,Japan,,0,World,,,,,,,,,89,"Ships, boats and floating structures",,,,,,,,,422008998,,,0
HS,2020,202007,July 2020,2,0,2,Exports,392,Japan,,0,World,,,,,,,,,57,Carpets and other textile floor coverings,,,,,,,0,,1679619,,,0
HS,2020,202007,July 2020,2,0,2,Exports,392,Japan,,0,World,,,,,,,,,71,"Natural, cultured pearls; precious, semi-precious stones; precious metals, metals clad with precious metal, and articles thereof; imitation jewellery; coin",,,,,,,0,,1376933498,,,0
HS,2020,202007,July 2020,2,0,2,Exports,392,Japan,,0,World,,,,,,,,,67,"Feathers and down, prepared; and articles made of feather or of down; artificial flowers; articles of human hair",,,,,,,0,,219621,,,0
HS,2020,202007,July 2020,2,0,2,Exports,392,Japan,,0,World,,,,,,,,,28,"Inorganic chemicals; organic and inorganic compounds of precious metals; of rare earth metals, of radio-active elements and of isotopes",,,,,,,0,,486279639,,,0
HS,2020,202007,July 2020,2,0,2,Exports,392,Japan,,0,World,,,,,,,,,04,"Dairy produce; birds' eggs; natural honey; edible products of animal origin, not elsewhere specified or included",,,,,,,0,,6227697,,,0
HS,2020,202007,July 2020,2,0,2,Exports,392,Japan,,0,World,,,,,,,,,76,Aluminium and articles thereof,,,,,,,0,,177104651,,,0
HS,2020,202006,June 2020,2,0,2,Exports,392,Japan,,0,World,,,,,,,,,24,Tobacco and manufactured tobacco substitutes,,,,,,,0,,7985247,,,0
HS,2020,202006,June 2020,2,0,2,Exports,392,Japan,,0,World,,,,,,,,,21,Miscellaneous edible preparations,,,,,,,0,,163466418,,,0
HS,2020,202006,June 2020,2,0,2,Exports,392,Japan,,0,World,,,,,,,,,09,"Coffee, tea, mate and spices",,,,,,,0,,13396175,,,0
HS,2020,202006,June 2020,2,0,2,Exports,392,Japan,,0,World,,,,,,,,,52,Cotton,,,,,,,0,,22622237,,,0
HS,2020,202006,June 2020,2,0,2,Exports,392,Japan,,0,World,,,,,,,,,69,Ceramic products,,,,,,,0,,114830314,,,0
HS,2020,202006,June 2020,2,0,2,Exports,392,Japan,,0,World,,,,,,,,,79,Zinc and articles thereof,,,,,,,0,,28384828,,,0
HS,2020,202006,June 2020,2,0,2,Exports,392,Japan,,0,World,,,,,,,,,78,Lead and articles thereof,,,,,,,0,,8302610,,,0
HS,2020,202006,June 2020,2,0,2,Exports,392,Japan,,0,World,,,,,,,,,86,"Railway, tramway locomotives, rolling-stock and parts thereof; railway or tramway track fixtures and fittings and parts thereof; mechanical (including electro-mechanical) traffic signalling equipment of all kinds",,,,,,,0,,45785574,,,0
HS,2020,202006,June 2020,2,0,2,Exports,392,Japan,,0,World,,,,,,,,,50,Silk,,,,,,,0,,2886083,,,0
HS,2020,202006,June 2020,2,0,2,Exports,392,Japan,,0,World,,,,,,,,,56,"Wadding, felt and nonwovens, special yarns; twine, cordage, ropes and cables and articles thereof",,,,,,,0,,81265137,,,0
HS,2020,202006,June 2020,2,0,2,Exports,392,Japan,,0,World,,,,,,,,,47,Pulp of wood or other fibrous cellulosic material; waste and scrap of paper or paperboard,,,,,,,0,,44316104,,,0
HS,2020,202006,June 2020,2,0,2,Exports,392,Japan,,0,World,,,,,,,,,42,"Articles of leather; saddlery and harness; travel goods, handbags and similar containers; articles of animal gut (other than silk-worm gut)",,,,,,,0,,10805531,,,0
HS,2020,202006,June 2020,2,0,2,Exports,392,Japan,,0,World,,,,,,,,,40,Rubber and articles thereof,,,,,,,0,,587986936,,,0
HS,2020,202006,June 2020,2,0,2,Exports,392,Japan,,0,World,,,,,,,,,95,"Toys, games and sports requisites; parts and accessories thereof",,,,,,,0,,267016719,,,0
HS,2020,202006,June 2020,2,0,2,Exports,392,Japan,,0,World,,,,,,,,,46,"Manufactures of straw, esparto or other plaiting materials; basketware and wickerwork",,,,,,,0,,235368,,,0
HS,2020,202006,June 2020,2,0,2,Exports,392,Japan,,0,World,,,,,,,,,18,Cocoa and cocoa preparations,,,,,,,0,,3752979,,,0
HS,2020,202006,June 2020,2,0,2,Exports,392,Japan,,0,World,,,,,,,,,08,"Fruit and nuts, edible; peel of citrus fruit or melons",,,,,,,0,,7039378,,,0
HS,2020,202006,June 2020,2,0,2,Exports,392,Japan,,0,World,,,,,,,,,97,Works of art; collectors' pieces and antiques,,,,,,,0,,12557015,,,0
HS,2020,202006,June 2020,2,0,2,Exports,392,Japan,,0,World,,,,,,,,,05,Animal originated products; not elsewhere specified or included,,,,,,,0,,6987451,,,0
HS,2020,202006,June 2020,2,0,2,Exports,392,Japan,,0,World,,,,,,,,,33,"Essential oils and resinoids; perfumery, cosmetic or toilet preparations",,,,,,,0,,506746614,,,0
HS,2020,202006,June 2020,2,0,2,Exports,392,Japan,,0,World,,,,,,,,,22,"Beverages, spirits and vinegar",,,,,,,0,,82904148,,,0
HS,2020,202006,June 2020,2,0,2,Exports,392,Japan,,0,World,,,,,,,,,02,Meat and edible meat offal,,,,,,,0,,26024456,,,0
HS,2020,202006,June 2020,2,0,2,Exports,392,Japan,,0,World,,,,,,,,,04,"Dairy produce; birds' eggs; natural honey; edible products of animal origin, not elsewhere specified or included",,,,,,,0,,5472953,,,0
HS,2020,202006,June 2020,2,0,2,Exports,392,Japan,,0,World,,,,,,,,,36,Explosives; pyrotechnic products; matches; pyrophoric alloys; certain combustible preparations,,,,,,,0,,838705,,,0
HS,2020,202006,June 2020,2,0,2,Exports,392,Japan,,0,World,,,,,,,,,13,"Lac; gums, resins and other vegetable saps and extracts",,,,,,,0,,3109997,,,0
HS,2020,202006,June 2020,2,0,2,Exports,392,Japan,,0,World,,,,,,,,,51,"Wool, fine or coarse animal hair; horsehair yarn and woven fabric",,,,,,,0,,14107671,,,0
HS,2020,202006,June 2020,2,0,2,Exports,392,Japan,,0,World,,,,,,,,,57,Carpets and other textile floor coverings,,,,,,,0,,1832558,,,0
HS,2020,202006,June 2020,2,0,2,Exports,392,Japan,,0,World,,,,,,,,,53,Vegetable textile fibres; paper yarn and woven fabrics of paper yarn,,,,,,,0,,544093,,,0
HS,2020,202006,June 2020,2,0,2,Exports,392,Japan,,0,World,,,,,,,,,41,Raw hides and skins (other than furskins) and leather,,,,,,,0,,7745407,,,0
HS,2020,202006,June 2020,2,0,2,Exports,392,Japan,,0,World,,,,,,,,,43,Furskins and artificial fur; manufactures thereof,,,,,,,0,,8535,,,0
HS,2020,202006,June 2020,2,0,2,Exports,392,Japan,,0,World,,,,,,,,,01,Animals; live,,,,,,,0,,658714,,,0
HS,2020,202006,June 2020,2,0,2,Exports,392,Japan,,0,World,,,,,,,,,03,"Fish and crustaceans, molluscs and other aquatic invertebrates",,,,,,,0,,137953179,,,0
HS,2020,202006,June 2020,2,0,2,Exports,392,Japan,,0,World,,,,,,,,,67,"Feathers and down, prepared; and articles made of feather or of down; artificial flowers; articles of human hair",,,,,,,0,,295932,,,0
HS,2020,202006,June 2020,2,0,2,Exports,392,Japan,,0,World,,,,,,,,,65,Headgear and parts thereof,,,,,,,0,,14763893,,,0
HS,2020,202006,June 2020,2,0,2,Exports,392,Japan,,0,World,,,,,,,,,63,"Textiles, made up articles; sets; worn clothing and worn textile articles; rags",,,,,,,0,,20552368,,,0
HS,2020,202006,June 2020,2,0,2,Exports,392,Japan,,0,World,,,,,,,,,62,Apparel and clothing accessories; not knitted or crocheted,,,,,,,0,,19797267,,,0
HS,2020,202006,June 2020,2,0,2,Exports,392,Japan,,0,World,,,,,,,,,61,Apparel and clothing accessories; knitted or crocheted,,,,,,,0,,20839467,,,0
HS,2020,202006,June 2020,2,0,2,Exports,392,Japan,,0,World,,,,,,,,,60,Fabrics; knitted or crocheted,,,,,,,0,,32562156,,,0
HS,2020,202006,June 2020,2,0,2,Exports,392,Japan,,0,World,,,,,,,,,20,"Preparations of vegetables, fruit, nuts or other parts of plants",,,,,,,0,,12482523,,,0
HS,2020,202006,June 2020,2,0,2,Exports,392,Japan,,0,World,,,,,,,,,19,"Preparations of cereals, flour, starch or milk; pastrycooks' products",,,,,,,0,,61372347,,,0
HS,2020,202006,June 2020,2,0,2,Exports,392,Japan,,0,World,,,,,,,,,16,"Meat, fish or crustaceans, molluscs or other aquatic invertebrates; preparations thereof",,,,,,,0,,42219616,,,0
HS,2020,202006,June 2020,2,0,2,Exports,392,Japan,,0,World,,,,,,,,,14,Vegetable plaiting materials; vegetable products not elsewhere specified or included,,,,,,,0,,198717,,,0
HS,2020,202006,June 2020,2,0,2,Exports,392,Japan,,0,World,,,,,,,,,94,"Furniture; bedding, mattresses, mattress supports, cushions and similar stuffed furnishings; lamps and lighting fittings, n.e.s.; illuminated signs, illuminated name-plates and the like; prefabricated buildings",,,,,,,0,,47844909,,,0
HS,2020,202006,June 2020,2,0,2,Exports,392,Japan,,0,World,,,,,,,,,93,Arms and ammunition; parts and accessories thereof,,,,,,,0,,15927260,,,0
HS,2020,202006,June 2020,2,0,2,Exports,392,Japan,,0,World,,,,,,,,,99,Commodities not specified according to kind,,,,,,,0,,2831886341,,,0
HS,2020,202006,June 2020,2,0,2,Exports,392,Japan,,0,World,,,,,,,,,84,"Nuclear reactors, boilers, machinery and mechanical appliances; parts thereof",,,,,,,0,,9243249735,,,0
HS,2020,202006,June 2020,2,0,2,Exports,392,Japan,,0,World,,,,,,,,,80,Tin; articles thereof,,,,,,,0,,6797753,,,0
HS,2020,202006,June 2020,2,0,2,Exports,392,Japan,,0,World,,,,,,,,,83,Metal; miscellaneous products of base metal,,,,,,,0,,41344892,,,0
HS,2020,202006,June 2020,2,0,2,Exports,392,Japan,,0,World,,,,,,,,,75,Nickel and articles thereof,,,,,,,0,,50243224,,,0
HS,2020,202006,June 2020,2,0,2,Exports,392,Japan,,0,World,,,,,,,,,85,"Electrical machinery and equipment and parts thereof; sound recorders and reproducers; television image and sound recorders and reproducers, parts and accessories of such articles",,,,,,,,,7159643890,,,0
HS,2020,202006,June 2020,2,0,2,Exports,392,Japan,,0,World,,,,,,,,,89,"Ships, boats and floating structures",,,,,,,,,1692846310,,,0
HS,2020,202006,June 2020,2,0,2,Exports,392,Japan,,0,World,,,,,,,,,11,"Products of the milling industry; malt, starches, inulin, wheat gluten",,,,,,,0,,7178711,,,0
HS,2020,202006,June 2020,2,0,2,Exports,392,Japan,,0,World,,,,,,,,,96,Miscellaneous manufactured articles,,,,,,,0,,214915851,,,0
HS,2020,202006,June 2020,2,0,2,Exports,392,Japan,,0,World,,,,,,,,,12,"Oil seeds and oleaginous fruits; miscellaneous grains, seeds and fruit, industrial or medicinal plants; straw and fodder",,,,,,,0,,15665357,,,0
HS,2020,202006,June 2020,2,0,2,Exports,392,Japan,,0,World,,,,,,,,,59,"Textile fabrics; impregnated, coated, covered or laminated; textile articles of a kind suitable for industrial use",,,,,,,0,,58697923,,,0
HS,2020,202006,June 2020,2,0,2,Exports,392,Japan,,0,World,,,,,,,,,64,Footwear; gaiters and the like; parts of such articles,,,,,,,0,,6044641,,,0
HS,2020,202006,June 2020,2,0,2,Exports,392,Japan,,0,World,,,,,,,,,74,Copper and articles thereof,,,,,,,0,,712653009,,,0
HS,2020,202006,June 2020,2,0,2,Exports,392,Japan,,0,World,,,,,,,,,72,Iron and steel,,,,,,,0,,1679538397,,,0
HS,2020,202006,June 2020,2,0,2,Exports,392,Japan,,0,World,,,,,,,,,70,Glass and glassware,,,,,,,,,234480465,,,0
HS,2020,202006,June 2020,2,0,2,Exports,392,Japan,,0,World,,,,,,,,,55,Man-made staple fibres,,,,,,,0,,71926426,,,0
HS,2020,202006,June 2020,2,0,2,Exports,392,Japan,,0,World,,,,,,,,,48,"Paper and paperboard; articles of paper pulp, of paper or paperboard",,,,,,,0,,163981122,,,0
HS,2020,202006,June 2020,2,0,2,Exports,392,Japan,,0,World,,,,,,,,,38,Chemical products n.e.s.,,,,,,,0,,923221684,,,0
HS,2020,202006,June 2020,2,0,2,Exports,392,Japan,,0,World,,,,,,,,,23,"Food industries, residues and wastes thereof; prepared animal fodder",,,,,,,0,,12250037,,,0
HS,2020,202006,June 2020,2,0,2,Exports,392,Japan,,0,World,,,,,,,,,26,"Ores, slag and ash",,,,,,,0,,13586171,,,0
HS,2020,202006,June 2020,2,0,2,Exports,392,Japan,,0,World,,,,,,,,,34,"Soap, organic surface-active agents; washing, lubricating, polishing or scouring preparations; artificial or prepared waxes, candles and similar articles, modelling pastes, ""dental waxes"" and dental preparations with a basis of plaster",,,,,,,,,231401020,,,0
HS,2020,202006,June 2020,2,0,2,Exports,392,Japan,,0,World,,,,,,,,,07,Vegetables and certain roots and tubers; edible,,,,,,,0,,3950059,,,0
HS,2020,202006,June 2020,2,0,2,Exports,392,Japan,,0,World,,,,,,,,,17,Sugars and sugar confectionery,,,,,,,0,,8867120,,,0
HS,2020,202006,June 2020,2,0,2,Exports,392,Japan,,0,World,,,,,,,,,25,"Salt; sulphur; earths, stone; plastering materials, lime and cement",,,,,,,0,,47650265,,,0
HS,2020,202006,June 2020,2,0,2,Exports,392,Japan,,0,World,,,,,,,,,15,Animal or vegetable fats and oils and their cleavage products; prepared animal fats; animal or vegetable waxes,,,,,,,0,,15730560,,,0
HS,2020,202006,June 2020,2,0,2,Exports,392,Japan,,0,World,,,,,,,,,39,Plastics and articles thereof,,,,,,,0,,1812918598,,,0
HS,2020,202006,June 2020,2,0,2,Exports,392,Japan,,0,World,,,,,,,,,88,"Aircraft, spacecraft and parts thereof",,,,,,,0,,238854279,,,0
HS,2020,202006,June 2020,2,0,2,Exports,392,Japan,,0,World,,,,,,,,,29,Organic chemicals,,,,,,,0,,1075655868,,,0
HS,2020,202006,June 2020,2,0,2,Exports,392,Japan,,0,World,,,,,,,,,10,Cereals,,,,,,,0,,3580509,,,0
HS,2020,202006,June 2020,2,0,2,Exports,392,Japan,,0,World,,,,,,,,,27,"Mineral fuels, mineral oils and products of their distillation; bituminous substances; mineral waxes",,,,,,,0,,468163869,,,0
HS,2020,202006,June 2020,2,0,2,Exports,392,Japan,,0,World,,,,,,,,,32,"Tanning or dyeing extracts; tannins and their derivatives; dyes, pigments and other colouring matter; paints, varnishes; putty, other mastics; inks",,,,,,,0,,313611831,,,0
HS,2020,202006,June 2020,2,0,2,Exports,392,Japan,,0,World,,,,,,,,,31,Fertilizers,,,,,,,0,,9088318,,,0
HS,2020,202006,June 2020,2,0,2,Exports,392,Japan,,0,World,,,,,,,,,28,"Inorganic chemicals; organic and inorganic compounds of precious metals; of rare earth metals, of radio-active elements and of isotopes",,,,,,,0,,451901907,,,0
HS,2020,202006,June 2020,2,0,2,Exports,392,Japan,,0,World,,,,,,,,,45,Cork and articles of cork,,,,,,,0,,89647,,,0
HS,2020,202006,June 2020,2,0,2,Exports,392,Japan,,0,World,,,,,,,,,87,"Vehicles; other than railway or tramway rolling stock, and parts and accessories thereof",,,,,,,,,6440299985,,,0
HS,2020,202006,June 2020,2,0,2,Exports,392,Japan,,0,World,,,,,,,,,06,"Trees and other plants, live; bulbs, roots and the like; cut flowers and ornamental foliage",,,,,,,0,,8217174,,,0
HS,2020,202006,June 2020,2,0,2,Exports,392,Japan,,0,World,,,,,,,,,44,Wood and articles of wood; wood charcoal,,,,,,,0,,30627325,,,0
HS,2020,202006,June 2020,2,0,2,Exports,392,Japan,,0,World,,,,,,,,,37,Photographic or cinematographic goods,,,,,,,0,,344347909,,,0
HS,2020,202006,June 2020,2,0,2,Exports,392,Japan,,0,World,,,,,,,,,35,Albuminoidal substances; modified starches; glues; enzymes,,,,,,,0,,64570048,,,0
HS,2020,202006,June 2020,2,0,2,Exports,392,Japan,,0,World,,,,,,,,,49,"Printed books, newspapers, pictures and other products of the printing industry; manuscripts, typescripts and plans",,,,,,,0,,25447189,,,0
HS,2020,202006,June 2020,2,0,2,Exports,392,Japan,,0,World,,,,,,,,,54,Man-made filaments,,,,,,,0,,108590378,,,0
HS,2020,202006,June 2020,2,0,2,Exports,392,Japan,,0,World,,,,,,,,,82,"Tools, implements, cutlery, spoons and forks, of base metal; parts thereof, of base metal",,,,,,,0,,242727001,,,0
HS,2020,202006,June 2020,2,0,2,Exports,392,Japan,,0,World,,,,,,,,,81,"Metals; n.e.s., cermets and articles thereof",,,,,,,0,,67202466,,,0
HS,2020,202006,June 2020,2,0,2,Exports,392,Japan,,0,World,,,,,,,,,68,"Stone, plaster, cement, asbestos, mica or similar materials; articles thereof",,,,,,,0,,144057873,,,0
HS,2020,202006,June 2020,2,0,2,Exports,392,Japan,,0,World,,,,,,,,,76,Aluminium and articles thereof,,,,,,,0,,169055999,,,0
HS,2020,202006,June 2020,2,0,2,Exports,392,Japan,,0,World,,,,,,,,,73,Iron or steel articles,,,,,,,0,,630131028,,,0
HS,2020,202006,June 2020,2,0,2,Exports,392,Japan,,0,World,,,,,,,,,71,"Natural, cultured pearls; precious, semi-precious stones; precious metals, metals clad with precious metal, and articles thereof; imitation jewellery; coin",,,,,,,0,,998318839,,,0
HS,2020,202006,June 2020,2,0,2,Exports,392,Japan,,0,World,,,,,,,,,30,Pharmaceutical products,,,,,,,0,,680077706,,,0
HS,2020,202001,January 2020,2,0,2,Exports,392,Japan,,0,World,,,,,,,,,30,Pharmaceutical products,,,,,,,0,,601749831,,,0
HS,2020,202001,January 2020,2,0,2,Exports,392,Japan,,0,World,,,,,,,,,52,Cotton,,,,,,,0,,21881983,,,0
HS,2020,202001,January 2020,2,0,2,Exports,392,Japan,,0,World,,,,,,,,,24,Tobacco and manufactured tobacco substitutes,,,,,,,0,,12765888,,,0
HS,2020,202001,January 2020,2,0,2,Exports,392,Japan,,0,World,,,,,,,,,09,"Coffee, tea, mate and spices",,,,,,,0,,11999954,,,0
HS,2020,202001,January 2020,2,0,2,Exports,392,Japan,,0,World,,,,,,,,,21,Miscellaneous edible preparations,,,,,,,0,,95159448,,,0
HS,2020,202001,January 2020,2,0,2,Exports,392,Japan,,0,World,,,,,,,,,71,"Natural, cultured pearls; precious, semi-precious stones; precious metals, metals clad with precious metal, and articles thereof; imitation jewellery; coin",,,,,,,0,,1291154134,,,0
HS,2020,202001,January 2020,2,0,2,Exports,392,Japan,,0,World,,,,,,,,,73,Iron or steel articles,,,,,,,0,,732168927,,,0
HS,2020,202001,January 2020,2,0,2,Exports,392,Japan,,0,World,,,,,,,,,76,Aluminium and articles thereof,,,,,,,0,,160385073,,,0
HS,2020,202001,January 2020,2,0,2,Exports,392,Japan,,0,World,,,,,,,,,68,"Stone, plaster, cement, asbestos, mica or similar materials; articles thereof",,,,,,,0,,159566450,,,0
HS,2020,202001,January 2020,2,0,2,Exports,392,Japan,,0,World,,,,,,,,,69,Ceramic products,,,,,,,0,,98117003,,,0
HS,2020,202001,January 2020,2,0,2,Exports,392,Japan,,0,World,,,,,,,,,81,"Metals; n.e.s., cermets and articles thereof",,,,,,,0,,80323300,,,0
HS,2020,202001,January 2020,2,0,2,Exports,392,Japan,,0,World,,,,,,,,,82,"Tools, implements, cutlery, spoons and forks, of base metal; parts thereof, of base metal",,,,,,,0,,271039442,,,0
HS,2020,202001,January 2020,2,0,2,Exports,392,Japan,,0,World,,,,,,,,,86,"Railway, tramway locomotives, rolling-stock and parts thereof; railway or tramway track fixtures and fittings and parts thereof; mechanical (including electro-mechanical) traffic signalling equipment of all kinds",,,,,,,0,,48030468,,,0
HS,2020,202001,January 2020,2,0,2,Exports,392,Japan,,0,World,,,,,,,,,78,Lead and articles thereof,,,,,,,0,,7897912,,,0
HS,2020,202001,January 2020,2,0,2,Exports,392,Japan,,0,World,,,,,,,,,79,Zinc and articles thereof,,,,,,,0,,24112942,,,0
HS,2020,202001,January 2020,2,0,2,Exports,392,Japan,,0,World,,,,,,,,,54,Man-made filaments,,,,,,,0,,130273174,,,0
HS,2020,202001,January 2020,2,0,2,Exports,392,Japan,,0,World,,,,,,,,,56,"Wadding, felt and nonwovens, special yarns; twine, cordage, ropes and cables and articles thereof",,,,,,,0,,74924070,,,0
HS,2020,202001,January 2020,2,0,2,Exports,392,Japan,,0,World,,,,,,,,,50,Silk,,,,,,,0,,3042078,,,0
HS,2020,202001,January 2020,2,0,2,Exports,392,Japan,,0,World,,,,,,,,,49,"Printed books, newspapers, pictures and other products of the printing industry; manuscripts, typescripts and plans",,,,,,,0,,21731477,,,0
HS,2020,202001,January 2020,2,0,2,Exports,392,Japan,,0,World,,,,,,,,,47,Pulp of wood or other fibrous cellulosic material; waste and scrap of paper or paperboard,,,,,,,0,,34803061,,,0
HS,2020,202001,January 2020,2,0,2,Exports,392,Japan,,0,World,,,,,,,,,35,Albuminoidal substances; modified starches; glues; enzymes,,,,,,,0,,67257508,,,0
HS,2020,202001,January 2020,2,0,2,Exports,392,Japan,,0,World,,,,,,,,,37,Photographic or cinematographic goods,,,,,,,0,,361707626,,,0
HS,2020,202001,January 2020,2,0,2,Exports,392,Japan,,0,World,,,,,,,,,44,Wood and articles of wood; wood charcoal,,,,,,,0,,17182896,,,0
HS,2020,202001,January 2020,2,0,2,Exports,392,Japan,,0,World,,,,,,,,,40,Rubber and articles thereof,,,,,,,0,,670172157,,,0
HS,2020,202001,January 2020,2,0,2,Exports,392,Japan,,0,World,,,,,,,,,42,"Articles of leather; saddlery and harness; travel goods, handbags and similar containers; articles of animal gut (other than silk-worm gut)",,,,,,,0,,5058771,,,0
HS,2020,202001,January 2020,2,0,2,Exports,392,Japan,,0,World,,,,,,,,,06,"Trees and other plants, live; bulbs, roots and the like; cut flowers and ornamental foliage",,,,,,,0,,5010741,,,0
HS,2020,202001,January 2020,2,0,2,Exports,392,Japan,,0,World,,,,,,,,,95,"Toys, games and sports requisites; parts and accessories thereof",,,,,,,0,,191325110,,,0
HS,2020,202001,January 2020,2,0,2,Exports,392,Japan,,0,World,,,,,,,,,87,"Vehicles; other than railway or tramway rolling stock, and parts and accessories thereof",,,,,,,,,10484844055,,,0
HS,2020,202001,January 2020,2,0,2,Exports,392,Japan,,0,World,,,,,,,,,45,Cork and articles of cork,,,,,,,0,,211530,,,0
HS,2020,202001,January 2020,2,0,2,Exports,392,Japan,,0,World,,,,,,,,,46,"Manufactures of straw, esparto or other plaiting materials; basketware and wickerwork",,,,,,,0,,297415,,,0
HS,2020,202001,January 2020,2,0,2,Exports,392,Japan,,0,World,,,,,,,,,28,"Inorganic chemicals; organic and inorganic compounds of precious metals; of rare earth metals, of radio-active elements and of isotopes",,,,,,,0,,482299430,,,0
HS,2020,202001,January 2020,2,0,2,Exports,392,Japan,,0,World,,,,,,,,,31,Fertilizers,,,,,,,0,,7642606,,,0
HS,2020,202001,January 2020,2,0,2,Exports,392,Japan,,0,World,,,,,,,,,32,"Tanning or dyeing extracts; tannins and their derivatives; dyes, pigments and other colouring matter; paints, varnishes; putty, other mastics; inks",,,,,,,0,,301134146,,,0
HS,2020,202001,January 2020,2,0,2,Exports,392,Japan,,0,World,,,,,,,,,27,"Mineral fuels, mineral oils and products of their distillation; bituminous substances; mineral waxes",,,,,,,0,,1237995755,,,0
HS,2020,202001,January 2020,2,0,2,Exports,392,Japan,,0,World,,,,,,,,,08,"Fruit and nuts, edible; peel of citrus fruit or melons",,,,,,,0,,21034180,,,0
HS,2020,202001,January 2020,2,0,2,Exports,392,Japan,,0,World,,,,,,,,,18,Cocoa and cocoa preparations,,,,,,,0,,5318826,,,0
HS,2020,202001,January 2020,2,0,2,Exports,392,Japan,,0,World,,,,,,,,,10,Cereals,,,,,,,0,,5978588,,,0
HS,2020,202001,January 2020,2,0,2,Exports,392,Japan,,0,World,,,,,,,,,29,Organic chemicals,,,,,,,0,,1401969880,,,0
HS,2020,202001,January 2020,2,0,2,Exports,392,Japan,,0,World,,,,,,,,,88,"Aircraft, spacecraft and parts thereof",,,,,,,0,,344129771,,,0
HS,2020,202001,January 2020,2,0,2,Exports,392,Japan,,0,World,,,,,,,,,39,Plastics and articles thereof,,,,,,,0,,1775148346,,,0
HS,2020,202001,January 2020,2,0,2,Exports,392,Japan,,0,World,,,,,,,,,97,Works of art; collectors' pieces and antiques,,,,,,,0,,16548718,,,0
HS,2020,202001,January 2020,2,0,2,Exports,392,Japan,,0,World,,,,,,,,,15,Animal or vegetable fats and oils and their cleavage products; prepared animal fats; animal or vegetable waxes,,,,,,,0,,13977090,,,0
HS,2020,202001,January 2020,2,0,2,Exports,392,Japan,,0,World,,,,,,,,,25,"Salt; sulphur; earths, stone; plastering materials, lime and cement",,,,,,,0,,49823699,,,0
HS,2020,202001,January 2020,2,0,2,Exports,392,Japan,,0,World,,,,,,,,,17,Sugars and sugar confectionery,,,,,,,0,,7091926,,,0
HS,2020,202001,January 2020,2,0,2,Exports,392,Japan,,0,World,,,,,,,,,07,Vegetables and certain roots and tubers; edible,,,,,,,0,,3322382,,,0
HS,2020,202001,January 2020,2,0,2,Exports,392,Japan,,0,World,,,,,,,,,05,Animal originated products; not elsewhere specified or included,,,,,,,0,,1432943,,,0
HS,2020,202001,January 2020,2,0,2,Exports,392,Japan,,0,World,,,,,,,,,34,"Soap, organic surface-active agents; washing, lubricating, polishing or scouring preparations; artificial or prepared waxes, candles and similar articles, modelling pastes, ""dental waxes"" and dental preparations with a basis of plaster",,,,,,,0,,190593837,,,0
HS,2020,202001,January 2020,2,0,2,Exports,392,Japan,,0,World,,,,,,,,,26,"Ores, slag and ash",,,,,,,0,,14537497,,,0
HS,2020,202001,January 2020,2,0,2,Exports,392,Japan,,0,World,,,,,,,,,33,"Essential oils and resinoids; perfumery, cosmetic or toilet preparations",,,,,,,0,,329864225,,,0
HS,2020,202001,January 2020,2,0,2,Exports,392,Japan,,0,World,,,,,,,,,23,"Food industries, residues and wastes thereof; prepared animal fodder",,,,,,,0,,7401539,,,0
HS,2020,202001,January 2020,2,0,2,Exports,392,Japan,,0,World,,,,,,,,,22,"Beverages, spirits and vinegar",,,,,,,0,,63676398,,,0
HS,2020,202001,January 2020,2,0,2,Exports,392,Japan,,0,World,,,,,,,,,38,Chemical products n.e.s.,,,,,,,0,,756315579,,,0
HS,2020,202001,January 2020,2,0,2,Exports,392,Japan,,0,World,,,,,,,,,36,Explosives; pyrotechnic products; matches; pyrophoric alloys; certain combustible preparations,,,,,,,0,,917071,,,0
HS,2020,202001,January 2020,2,0,2,Exports,392,Japan,,0,World,,,,,,,,,13,"Lac; gums, resins and other vegetable saps and extracts",,,,,,,0,,2115206,,,0
HS,2020,202001,January 2020,2,0,2,Exports,392,Japan,,0,World,,,,,,,,,04,"Dairy produce; birds' eggs; natural honey; edible products of animal origin, not elsewhere specified or included",,,,,,,0,,3177339,,,0
HS,2020,202001,January 2020,2,0,2,Exports,392,Japan,,0,World,,,,,,,,,02,Meat and edible meat offal,,,,,,,0,,13990486,,,0
HS,2020,202001,January 2020,2,0,2,Exports,392,Japan,,0,World,,,,,,,,,48,"Paper and paperboard; articles of paper pulp, of paper or paperboard",,,,,,,0,,177033018,,,0
