HS,2019,201911,November 2019,2,0,2,Exports,348,Hungary,,0,World,,,,,,,,,01,Animals; live,,,,,,,0,,42642544,,,0
HS,2019,201911,November 2019,2,0,2,Exports,348,Hungary,,0,World,,,,,,,,,94,"Furniture; bedding, mattresses, mattress supports, cushions and similar stuffed furnishings; lamps and lighting fittings, n.e.s.; illuminated signs, illuminated name-plates and the like; prefabricated buildings",,,,,,,0,,165970535,,,0
HS,2019,201911,November 2019,2,0,2,Exports,348,Hungary,,0,World,,,,,,,,,96,Miscellaneous manufactured articles,,,,,,,0,,43785937,,,0
HS,2019,201911,November 2019,2,0,2,Exports,348,Hungary,,0,World,,,,,,,,,17,Sugars and sugar confectionery,,,,,,,0,,19479411,,,0
HS,2019,201911,November 2019,2,0,2,Exports,348,Hungary,,0,World,,,,,,,,,34,"Soap, organic surface-active agents; washing, lubricating, polishing or scouring preparations; artificial or prepared waxes, candles and similar articles, modelling pastes, ""dental waxes"" and dental preparations with a basis of plaster",,,,,,,0,,53486486,,,0
HS,2019,201911,November 2019,2,0,2,Exports,348,Hungary,,0,World,,,,,,,,,79,Zinc and articles thereof,,,,,,,0,,2612839,,,0
HS,2019,201911,November 2019,2,0,2,Exports,348,Hungary,,0,World,,,,,,,,,86,"Railway, tramway locomotives, rolling-stock and parts thereof; railway or tramway track fixtures and fittings and parts thereof; mechanical (including electro-mechanical) traffic signalling equipment of all kinds",,,,,,,0,,32212558,,,0
HS,2019,201911,November 2019,2,0,2,Exports,348,Hungary,,0,World,,,,,,,,,78,Lead and articles thereof,,,,,,,0,,648504,,,0
HS,2019,201911,November 2019,2,0,2,Exports,348,Hungary,,0,World,,,,,,,,,54,Man-made filaments,,,,,,,0,,11615859,,,0
HS,2019,201911,November 2019,2,0,2,Exports,348,Hungary,,0,World,,,,,,,,,97,Works of art; collectors' pieces and antiques,,,,,,,0,,410830,,,0
HS,2019,201911,November 2019,2,0,2,Exports,348,Hungary,,0,World,,,,,,,,,37,Photographic or cinematographic goods,,,,,,,0,,4814077,,,0
HS,2019,201911,November 2019,2,0,2,Exports,348,Hungary,,0,World,,,,,,,,,18,Cocoa and cocoa preparations,,,,,,,0,,22907570,,,0
HS,2019,201911,November 2019,2,0,2,Exports,348,Hungary,,0,World,,,,,,,,,11,"Products of the milling industry; malt, starches, inulin, wheat gluten",,,,,,,0,,12587074,,,0
HS,2019,201906,June 2019,2,0,2,Exports,348,Hungary,,0,World,,,,,,,,,11,"Products of the milling industry; malt, starches, inulin, wheat gluten",,,,,,,0,,11893536,,,0
HS,2019,201906,June 2019,2,0,2,Exports,348,Hungary,,0,World,,,,,,,,,12,"Oil seeds and oleaginous fruits; miscellaneous grains, seeds and fruit, industrial or medicinal plants; straw and fodder",,,,,,,0,,48952787,,,0
HS,2019,201906,June 2019,2,0,2,Exports,348,Hungary,,0,World,,,,,,,,,19,"Preparations of cereals, flour, starch or milk; pastrycooks' products",,,,,,,0,,22235599,,,0
HS,2019,201906,June 2019,2,0,2,Exports,348,Hungary,,0,World,,,,,,,,,16,"Meat, fish or crustaceans, molluscs or other aquatic invertebrates; preparations thereof",,,,,,,0,,26941092,,,0
HS,2019,201906,June 2019,2,0,2,Exports,348,Hungary,,0,World,,,,,,,,,96,Miscellaneous manufactured articles,,,,,,,0,,43567865,,,0
HS,2019,201906,June 2019,2,0,2,Exports,348,Hungary,,0,World,,,,,,,,,94,"Furniture; bedding, mattresses, mattress supports, cushions and similar stuffed furnishings; lamps and lighting fittings, n.e.s.; illuminated signs, illuminated name-plates and the like; prefabricated buildings",,,,,,,0,,144228589,,,0
HS,2019,201906,June 2019,2,0,2,Exports,348,Hungary,,0,World,,,,,,,,,80,Tin; articles thereof,,,,,,,0,,2566430,,,0
HS,2019,201906,June 2019,2,0,2,Exports,348,Hungary,,0,World,,,,,,,,,83,Metal; miscellaneous products of base metal,,,,,,,0,,39323643,,,0
HS,2019,201906,June 2019,2,0,2,Exports,348,Hungary,,0,World,,,,,,,,,84,"Nuclear reactors, boilers, machinery and mechanical appliances; parts thereof",,,,,,,0,,1791831359,,,0
HS,2019,201906,June 2019,2,0,2,Exports,348,Hungary,,0,World,,,,,,,,,75,Nickel and articles thereof,,,,,,,0,,228901,,,0
HS,2019,201906,June 2019,2,0,2,Exports,348,Hungary,,0,World,,,,,,,,,74,Copper and articles thereof,,,,,,,0,,20069684,,,0
HS,2019,201906,June 2019,2,0,2,Exports,348,Hungary,,0,World,,,,,,,,,89,"Ships, boats and floating structures",,,,,,,0,,2121166,,,0
HS,2019,201906,June 2019,2,0,2,Exports,348,Hungary,,0,World,,,,,,,,,85,"Electrical machinery and equipment and parts thereof; sound recorders and reproducers; television image and sound recorders and reproducers, parts and accessories of such articles",,,,,,,0,,2170537059,,,0
HS,2019,201906,June 2019,2,0,2,Exports,348,Hungary,,0,World,,,,,,,,,90,"Optical, photographic, cinematographic, measuring, checking, medical or surgical instruments and apparatus; parts and accessories",,,,,,,0,,310014917,,,0
HS,2019,201906,June 2019,2,0,2,Exports,348,Hungary,,0,World,,,,,,,,,92,Musical instruments; parts and accessories of such articles,,,,,,,0,,107319,,,0
HS,2019,201906,June 2019,2,0,2,Exports,348,Hungary,,0,World,,,,,,,,,43,Furskins and artificial fur; manufactures thereof,,,,,,,0,,138985,,,0
HS,2019,201906,June 2019,2,0,2,Exports,348,Hungary,,0,World,,,,,,,,,41,Raw hides and skins (other than furskins) and leather,,,,,,,0,,4418162,,,0
HS,2019,201906,June 2019,2,0,2,Exports,348,Hungary,,0,World,,,,,,,,,51,"Wool, fine or coarse animal hair; horsehair yarn and woven fabric",,,,,,,0,,3383917,,,0
HS,2019,201906,June 2019,2,0,2,Exports,348,Hungary,,0,World,,,,,,,,,53,Vegetable textile fibres; paper yarn and woven fabrics of paper yarn,,,,,,,0,,314815,,,0
HS,2019,201906,June 2019,2,0,2,Exports,348,Hungary,,0,World,,,,,,,,,57,Carpets and other textile floor coverings,,,,,,,0,,1984801,,,0
HS,2019,201906,June 2019,2,0,2,Exports,348,Hungary,,0,World,,,,,,,,,55,Man-made staple fibres,,,,,,,0,,3230146,,,0
HS,2019,201906,June 2019,2,0,2,Exports,348,Hungary,,0,World,,,,,,,,,61,Apparel and clothing accessories; knitted or crocheted,,,,,,,0,,33093010,,,0
HS,2019,201906,June 2019,2,0,2,Exports,348,Hungary,,0,World,,,,,,,,,60,Fabrics; knitted or crocheted,,,,,,,0,,6130926,,,0
HS,2019,201906,June 2019,2,0,2,Exports,348,Hungary,,0,World,,,,,,,,,59,"Textile fabrics; impregnated, coated, covered or laminated; textile articles of a kind suitable for industrial use",,,,,,,0,,9816074,,,0
HS,2019,201906,June 2019,2,0,2,Exports,348,Hungary,,0,World,,,,,,,,,62,Apparel and clothing accessories; not knitted or crocheted,,,,,,,0,,22079048,,,0
HS,2019,201906,June 2019,2,0,2,Exports,348,Hungary,,0,World,,,,,,,,,63,"Textiles, made up articles; sets; worn clothing and worn textile articles; rags",,,,,,,0,,19752745,,,0
HS,2019,201906,June 2019,2,0,2,Exports,348,Hungary,,0,World,,,,,,,,,72,Iron and steel,,,,,,,0,,122232140,,,0
HS,2019,201906,June 2019,2,0,2,Exports,348,Hungary,,0,World,,,,,,,,,70,Glass and glassware,,,,,,,0,,66267098,,,0
HS,2019,201906,June 2019,2,0,2,Exports,348,Hungary,,0,World,,,,,,,,,64,Footwear; gaiters and the like; parts of such articles,,,,,,,0,,51018609,,,0
HS,2019,201906,June 2019,2,0,2,Exports,348,Hungary,,0,World,,,,,,,,,65,Headgear and parts thereof,,,,,,,0,,862530,,,0
HS,2019,201906,June 2019,2,0,2,Exports,348,Hungary,,0,World,,,,,,,,,67,"Feathers and down, prepared; and articles made of feather or of down; artificial flowers; articles of human hair",,,,,,,0,,80456,,,0
HS,2019,201906,June 2019,2,0,2,Exports,348,Hungary,,0,World,,,,,,,,,08,"Fruit and nuts, edible; peel of citrus fruit or melons",,,,,,,0,,14324742,,,0
HS,2019,201906,June 2019,2,0,2,Exports,348,Hungary,,0,World,,,,,,,,,95,"Toys, games and sports requisites; parts and accessories thereof",,,,,,,0,,57116692,,,0
HS,2019,201906,June 2019,2,0,2,Exports,348,Hungary,,0,World,,,,,,,,,06,"Trees and other plants, live; bulbs, roots and the like; cut flowers and ornamental foliage",,,,,,,0,,4200377,,,0
HS,2019,201906,June 2019,2,0,2,Exports,348,Hungary,,0,World,,,,,,,,,97,Works of art; collectors' pieces and antiques,,,,,,,0,,146605,,,0
HS,2019,201906,June 2019,2,0,2,Exports,348,Hungary,,0,World,,,,,,,,,46,"Manufactures of straw, esparto or other plaiting materials; basketware and wickerwork",,,,,,,0,,172406,,,0
HS,2019,201906,June 2019,2,0,2,Exports,348,Hungary,,0,World,,,,,,,,,87,"Vehicles; other than railway or tramway rolling stock, and parts and accessories thereof",,,,,,,0,,1736024226,,,0
HS,2019,201906,June 2019,2,0,2,Exports,348,Hungary,,0,World,,,,,,,,,45,Cork and articles of cork,,,,,,,0,,86825,,,0
HS,2019,201906,June 2019,2,0,2,Exports,348,Hungary,,0,World,,,,,,,,,37,Photographic or cinematographic goods,,,,,,,0,,3923513,,,0
HS,2019,201906,June 2019,2,0,2,Exports,348,Hungary,,0,World,,,,,,,,,28,"Inorganic chemicals; organic and inorganic compounds of precious metals; of rare earth metals, of radio-active elements and of isotopes",,,,,,,0,,44171439,,,0
HS,2019,201906,June 2019,2,0,2,Exports,348,Hungary,,0,World,,,,,,,,,32,"Tanning or dyeing extracts; tannins and their derivatives; dyes, pigments and other colouring matter; paints, varnishes; putty, other mastics; inks",,,,,,,0,,17632606,,,0
HS,2019,201906,June 2019,2,0,2,Exports,348,Hungary,,0,World,,,,,,,,,40,Rubber and articles thereof,,,,,,,0,,214196398,,,0
HS,2019,201906,June 2019,2,0,2,Exports,348,Hungary,,0,World,,,,,,,,,42,"Articles of leather; saddlery and harness; travel goods, handbags and similar containers; articles of animal gut (other than silk-worm gut)",,,,,,,0,,35451198,,,0
HS,2019,201906,June 2019,2,0,2,Exports,348,Hungary,,0,World,,,,,,,,,49,"Printed books, newspapers, pictures and other products of the printing industry; manuscripts, typescripts and plans",,,,,,,0,,16973706,,,0
HS,2019,201906,June 2019,2,0,2,Exports,348,Hungary,,0,World,,,,,,,,,44,Wood and articles of wood; wood charcoal,,,,,,,0,,62544374,,,0
HS,2019,201906,June 2019,2,0,2,Exports,348,Hungary,,0,World,,,,,,,,,34,"Soap, organic surface-active agents; washing, lubricating, polishing or scouring preparations; artificial or prepared waxes, candles and similar articles, modelling pastes, ""dental waxes"" and dental preparations with a basis of plaster",,,,,,,0,,43970333,,,0
HS,2019,201906,June 2019,2,0,2,Exports,348,Hungary,,0,World,,,,,,,,,36,Explosives; pyrotechnic products; matches; pyrophoric alloys; certain combustible preparations,,,,,,,0,,506763,,,0
HS,2019,201906,June 2019,2,0,2,Exports,348,Hungary,,0,World,,,,,,,,,38,Chemical products n.e.s.,,,,,,,0,,56774899,,,0
HS,2019,201906,June 2019,2,0,2,Exports,348,Hungary,,0,World,,,,,,,,,13,"Lac; gums, resins and other vegetable saps and extracts",,,,,,,0,,272752,,,0
HS,2019,201906,June 2019,2,0,2,Exports,348,Hungary,,0,World,,,,,,,,,23,"Food industries, residues and wastes thereof; prepared animal fodder",,,,,,,0,,79952868,,,0
HS,2019,201906,June 2019,2,0,2,Exports,348,Hungary,,0,World,,,,,,,,,22,"Beverages, spirits and vinegar",,,,,,,0,,72021689,,,0
HS,2019,201906,June 2019,2,0,2,Exports,348,Hungary,,0,World,,,,,,,,,33,"Essential oils and resinoids; perfumery, cosmetic or toilet preparations",,,,,,,0,,57682998,,,0
HS,2019,201906,June 2019,2,0,2,Exports,348,Hungary,,0,World,,,,,,,,,15,Animal or vegetable fats and oils and their cleavage products; prepared animal fats; animal or vegetable waxes,,,,,,,0,,51680182,,,0
HS,2019,201906,June 2019,2,0,2,Exports,348,Hungary,,0,World,,,,,,,,,07,Vegetables and certain roots and tubers; edible,,,,,,,0,,21494068,,,0
HS,2019,201906,June 2019,2,0,2,Exports,348,Hungary,,0,World,,,,,,,,,05,Animal originated products; not elsewhere specified or included,,,,,,,0,,13315907,,,0
HS,2019,201906,June 2019,2,0,2,Exports,348,Hungary,,0,World,,,,,,,,,04,"Dairy produce; birds' eggs; natural honey; edible products of animal origin, not elsewhere specified or included",,,,,,,0,,37761313,,,0
HS,2019,201906,June 2019,2,0,2,Exports,348,Hungary,,0,World,,,,,,,,,29,Organic chemicals,,,,,,,0,,119638527,,,0
HS,2019,201906,June 2019,2,0,2,Exports,348,Hungary,,0,World,,,,,,,,,25,"Salt; sulphur; earths, stone; plastering materials, lime and cement",,,,,,,0,,6289276,,,0
HS,2019,201906,June 2019,2,0,2,Exports,348,Hungary,,0,World,,,,,,,,,39,Plastics and articles thereof,,,,,,,0,,364913214,,,0
HS,2019,201906,June 2019,2,0,2,Exports,348,Hungary,,0,World,,,,,,,,,10,Cereals,,,,,,,0,,99824059,,,0
HS,2019,201906,June 2019,2,0,2,Exports,348,Hungary,,0,World,,,,,,,,,54,Man-made filaments,,,,,,,0,,10948321,,,0
HS,2019,201906,June 2019,2,0,2,Exports,348,Hungary,,0,World,,,,,,,,,50,Silk,,,,,,,0,,22335,,,0
HS,2019,201906,June 2019,2,0,2,Exports,348,Hungary,,0,World,,,,,,,,,56,"Wadding, felt and nonwovens, special yarns; twine, cordage, ropes and cables and articles thereof",,,,,,,0,,15298951,,,0
HS,2019,201906,June 2019,2,0,2,Exports,348,Hungary,,0,World,,,,,,,,,69,Ceramic products,,,,,,,0,,36939162,,,0
HS,2019,201906,June 2019,2,0,2,Exports,348,Hungary,,0,World,,,,,,,,,68,"Stone, plaster, cement, asbestos, mica or similar materials; articles thereof",,,,,,,0,,43232911,,,0
HS,2019,201906,June 2019,2,0,2,Exports,348,Hungary,,0,World,,,,,,,,,79,Zinc and articles thereof,,,,,,,0,,2794544,,,0
HS,2019,201906,June 2019,2,0,2,Exports,348,Hungary,,0,World,,,,,,,,,76,Aluminium and articles thereof,,,,,,,0,,129070937,,,0
HS,2019,201906,June 2019,2,0,2,Exports,348,Hungary,,0,World,,,,,,,,,73,Iron or steel articles,,,,,,,0,,143632818,,,0
HS,2019,201906,June 2019,2,0,2,Exports,348,Hungary,,0,World,,,,,,,,,71,"Natural, cultured pearls; precious, semi-precious stones; precious metals, metals clad with precious metal, and articles thereof; imitation jewellery; coin",,,,,,,0,,27725137,,,0
HS,2019,201906,June 2019,2,0,2,Exports,348,Hungary,,0,World,,,,,,,,,09,"Coffee, tea, mate and spices",,,,,,,0,,5085165,,,0
HS,2019,201906,June 2019,2,0,2,Exports,348,Hungary,,0,World,,,,,,,,,81,"Metals; n.e.s., cermets and articles thereof",,,,,,,0,,2407295,,,0
HS,2019,201906,June 2019,2,0,2,Exports,348,Hungary,,0,World,,,,,,,,,82,"Tools, implements, cutlery, spoons and forks, of base metal; parts thereof, of base metal",,,,,,,0,,11460488,,,0
HS,2019,201906,June 2019,2,0,2,Exports,348,Hungary,,0,World,,,,,,,,,21,Miscellaneous edible preparations,,,,,,,0,,58346725,,,0
HS,2019,201906,June 2019,2,0,2,Exports,348,Hungary,,0,World,,,,,,,,,31,Fertilizers,,,,,,,,,5098827,,,0
HS,2019,201906,June 2019,2,0,2,Exports,348,Hungary,,0,World,,,,,,,,,35,Albuminoidal substances; modified starches; glues; enzymes,,,,,,,,,9030388,,,0
HS,2019,201906,June 2019,2,0,2,Exports,348,Hungary,,0,World,,,,,,,,,27,"Mineral fuels, mineral oils and products of their distillation; bituminous substances; mineral waxes",,,,,,,,,289673907,,,0
HS,2019,201906,June 2019,2,0,2,Exports,348,Hungary,,0,World,,,,,,,,,48,"Paper and paperboard; articles of paper pulp, of paper or paperboard",,,,,,,,,73704695,,,0
HS,2019,201906,June 2019,2,0,2,Exports,348,Hungary,,0,World,,,,,,,,,91,Clocks and watches and parts thereof,,,,,,,,,2537823,,,0
HS,2019,201906,June 2019,2,0,2,Exports,348,Hungary,,0,World,,,,,,,,,47,Pulp of wood or other fibrous cellulosic material; waste and scrap of paper or paperboard,,,,,,,0,,3476064,,,0
HS,2019,201906,June 2019,2,0,2,Exports,348,Hungary,,0,World,,,,,,,,,99,Commodities not specified according to kind,,,,,,,0,,28278892,,,0
HS,2019,201906,June 2019,2,0,2,Exports,348,Hungary,,0,World,,,,,,,,,03,"Fish and crustaceans, molluscs and other aquatic invertebrates",,,,,,,0,,421495,,,0
HS,2019,201906,June 2019,2,0,2,Exports,348,Hungary,,0,World,,,,,,,,,02,Meat and edible meat offal,,,,,,,0,,86725176,,,0
HS,2019,201906,June 2019,2,0,2,Exports,348,Hungary,,0,World,,,,,,,,,17,Sugars and sugar confectionery,,,,,,,0,,17175905,,,0
HS,2019,201906,June 2019,2,0,2,Exports,348,Hungary,,0,World,,,,,,,,,14,Vegetable plaiting materials; vegetable products not elsewhere specified or included,,,,,,,0,,2285288,,,0
HS,2019,201906,June 2019,2,0,2,Exports,348,Hungary,,0,World,,,,,,,,,18,Cocoa and cocoa preparations,,,,,,,0,,13727900,,,0
HS,2019,201906,June 2019,2,0,2,Exports,348,Hungary,,0,World,,,,,,,,,20,"Preparations of vegetables, fruit, nuts or other parts of plants",,,,,,,0,,41072828,,,0
HS,2019,201906,June 2019,2,0,2,Exports,348,Hungary,,0,World,,,,,,,,,26,"Ores, slag and ash",,,,,,,0,,539058,,,0
HS,2019,201906,June 2019,2,0,2,Exports,348,Hungary,,0,World,,,,,,,,,78,Lead and articles thereof,,,,,,,0,,498492,,,0
HS,2019,201906,June 2019,2,0,2,Exports,348,Hungary,,0,World,,,,,,,,,86,"Railway, tramway locomotives, rolling-stock and parts thereof; railway or tramway track fixtures and fittings and parts thereof; mechanical (including electro-mechanical) traffic signalling equipment of all kinds",,,,,,,0,,34557581,,,0
HS,2019,201906,June 2019,2,0,2,Exports,348,Hungary,,0,World,,,,,,,,,88,"Aircraft, spacecraft and parts thereof",,,,,,,0,,4872592,,,0
HS,2019,201906,June 2019,2,0,2,Exports,348,Hungary,,0,World,,,,,,,,,93,Arms and ammunition; parts and accessories thereof,,,,,,,0,,5798630,,,0
HS,2019,201906,June 2019,2,0,2,Exports,348,Hungary,,0,World,,,,,,,,,01,Animals; live,,,,,,,0,,37694999,,,0
HS,2019,201902,February 2019,2,0,2,Exports,348,Hungary,,0,World,,,,,,,,,41,Raw hides and skins (other than furskins) and leather,,,,,,,0,,3200438,,,0
HS,2019,201902,February 2019,2,0,2,Exports,348,Hungary,,0,World,,,,,,,,,47,Pulp of wood or other fibrous cellulosic material; waste and scrap of paper or paperboard,,,,,,,0,,4014018,,,0
HS,2019,201902,February 2019,2,0,2,Exports,348,Hungary,,0,World,,,,,,,,,57,Carpets and other textile floor coverings,,,,,,,0,,2438903,,,0
HS,2019,201902,February 2019,2,0,2,Exports,348,Hungary,,0,World,,,,,,,,,02,Meat and edible meat offal,,,,,,,0,,74158348,,,0
HS,2019,201902,February 2019,2,0,2,Exports,348,Hungary,,0,World,,,,,,,,,04,"Dairy produce; birds' eggs; natural honey; edible products of animal origin, not elsewhere specified or included",,,,,,,0,,42018902,,,0
HS,2019,201902,February 2019,2,0,2,Exports,348,Hungary,,0,World,,,,,,,,,13,"Lac; gums, resins and other vegetable saps and extracts",,,,,,,0,,293196,,,0
HS,2019,201902,February 2019,2,0,2,Exports,348,Hungary,,0,World,,,,,,,,,14,Vegetable plaiting materials; vegetable products not elsewhere specified or included,,,,,,,0,,2612543,,,0
HS,2019,201902,February 2019,2,0,2,Exports,348,Hungary,,0,World,,,,,,,,,22,"Beverages, spirits and vinegar",,,,,,,0,,54312833,,,0
HS,2019,201902,February 2019,2,0,2,Exports,348,Hungary,,0,World,,,,,,,,,23,"Food industries, residues and wastes thereof; prepared animal fodder",,,,,,,0,,92043918,,,0
HS,2019,201902,February 2019,2,0,2,Exports,348,Hungary,,0,World,,,,,,,,,26,"Ores, slag and ash",,,,,,,0,,563463,,,0
HS,2019,201902,February 2019,2,0,2,Exports,348,Hungary,,0,World,,,,,,,,,31,Fertilizers,,,,,,,0,,18906804,,,0
HS,2019,201902,February 2019,2,0,2,Exports,348,Hungary,,0,World,,,,,,,,,36,Explosives; pyrotechnic products; matches; pyrophoric alloys; certain combustible preparations,,,,,,,0,,570267,,,0
HS,2019,201902,February 2019,2,0,2,Exports,348,Hungary,,0,World,,,,,,,,,86,"Railway, tramway locomotives, rolling-stock and parts thereof; railway or tramway track fixtures and fittings and parts thereof; mechanical (including electro-mechanical) traffic signalling equipment of all kinds",,,,,,,0,,33987149,,,0
HS,2019,201902,February 2019,2,0,2,Exports,348,Hungary,,0,World,,,,,,,,,99,Commodities not specified according to kind,,,,,,,0,,25093263,,,0
HS,2019,201902,February 2019,2,0,2,Exports,348,Hungary,,0,World,,,,,,,,,78,Lead and articles thereof,,,,,,,0,,393573,,,0
HS,2019,201902,February 2019,2,0,2,Exports,348,Hungary,,0,World,,,,,,,,,01,Animals; live,,,,,,,0,,30315273,,,0
HS,2019,201902,February 2019,2,0,2,Exports,348,Hungary,,0,World,,,,,,,,,37,Photographic or cinematographic goods,,,,,,,0,,4779018,,,0
HS,2019,201902,February 2019,2,0,2,Exports,348,Hungary,,0,World,,,,,,,,,97,Works of art; collectors' pieces and antiques,,,,,,,0,,124317,,,0
HS,2019,201905,May 2019,2,0,2,Exports,348,Hungary,,0,World,,,,,,,,,97,Works of art; collectors' pieces and antiques,,,,,,,0,,81686,,,0
HS,2019,201905,May 2019,2,0,2,Exports,348,Hungary,,0,World,,,,,,,,,01,Animals; live,,,,,,,0,,39159838,,,0
HS,2019,201905,May 2019,2,0,2,Exports,348,Hungary,,0,World,,,,,,,,,80,Tin; articles thereof,,,,,,,0,,2540471,,,0
HS,2019,201905,May 2019,2,0,2,Exports,348,Hungary,,0,World,,,,,,,,,86,"Railway, tramway locomotives, rolling-stock and parts thereof; railway or tramway track fixtures and fittings and parts thereof; mechanical (including electro-mechanical) traffic signalling equipment of all kinds",,,,,,,0,,43450724,,,0
HS,2019,201905,May 2019,2,0,2,Exports,348,Hungary,,0,World,,,,,,,,,88,"Aircraft, spacecraft and parts thereof",,,,,,,0,,5634819,,,0
HS,2019,201905,May 2019,2,0,2,Exports,348,Hungary,,0,World,,,,,,,,,93,Arms and ammunition; parts and accessories thereof,,,,,,,0,,5077050,,,0
HS,2019,201905,May 2019,2,0,2,Exports,348,Hungary,,0,World,,,,,,,,,99,Commodities not specified according to kind,,,,,,,0,,31314114,,,0
HS,2019,201905,May 2019,2,0,2,Exports,348,Hungary,,0,World,,,,,,,,,78,Lead and articles thereof,,,,,,,0,,713861,,,0
HS,2019,201905,May 2019,2,0,2,Exports,348,Hungary,,0,World,,,,,,,,,03,"Fish and crustaceans, molluscs and other aquatic invertebrates",,,,,,,0,,1485081,,,0
HS,2019,201905,May 2019,2,0,2,Exports,348,Hungary,,0,World,,,,,,,,,05,Animal originated products; not elsewhere specified or included,,,,,,,0,,15223313,,,0
HS,2019,201905,May 2019,2,0,2,Exports,348,Hungary,,0,World,,,,,,,,,02,Meat and edible meat offal,,,,,,,0,,94909319,,,0
HS,2019,201905,May 2019,2,0,2,Exports,348,Hungary,,0,World,,,,,,,,,10,Cereals,,,,,,,0,,114684660,,,0
HS,2019,201905,May 2019,2,0,2,Exports,348,Hungary,,0,World,,,,,,,,,13,"Lac; gums, resins and other vegetable saps and extracts",,,,,,,0,,393648,,,0
HS,2019,201905,May 2019,2,0,2,Exports,348,Hungary,,0,World,,,,,,,,,14,Vegetable plaiting materials; vegetable products not elsewhere specified or included,,,,,,,0,,2598734,,,0
HS,2019,201905,May 2019,2,0,2,Exports,348,Hungary,,0,World,,,,,,,,,20,"Preparations of vegetables, fruit, nuts or other parts of plants",,,,,,,0,,46798298,,,0
HS,2019,201905,May 2019,2,0,2,Exports,348,Hungary,,0,World,,,,,,,,,23,"Food industries, residues and wastes thereof; prepared animal fodder",,,,,,,0,,84513109,,,0
HS,2019,201905,May 2019,2,0,2,Exports,348,Hungary,,0,World,,,,,,,,,22,"Beverages, spirits and vinegar",,,,,,,0,,75839703,,,0
HS,2019,201905,May 2019,2,0,2,Exports,348,Hungary,,0,World,,,,,,,,,26,"Ores, slag and ash",,,,,,,0,,710168,,,0
HS,2019,201905,May 2019,2,0,2,Exports,348,Hungary,,0,World,,,,,,,,,31,Fertilizers,,,,,,,0,,10390055,,,0
HS,2019,201905,May 2019,2,0,2,Exports,348,Hungary,,0,World,,,,,,,,,36,Explosives; pyrotechnic products; matches; pyrophoric alloys; certain combustible preparations,,,,,,,0,,619012,,,0
HS,2019,201905,May 2019,2,0,2,Exports,348,Hungary,,0,World,,,,,,,,,41,Raw hides and skins (other than furskins) and leather,,,,,,,0,,3410049,,,0
HS,2019,201905,May 2019,2,0,2,Exports,348,Hungary,,0,World,,,,,,,,,43,Furskins and artificial fur; manufactures thereof,,,,,,,0,,211364,,,0
HS,2019,201905,May 2019,2,0,2,Exports,348,Hungary,,0,World,,,,,,,,,47,Pulp of wood or other fibrous cellulosic material; waste and scrap of paper or paperboard,,,,,,,0,,4681406,,,0
HS,2019,201905,May 2019,2,0,2,Exports,348,Hungary,,0,World,,,,,,,,,57,Carpets and other textile floor coverings,,,,,,,0,,2536197,,,0
HS,2019,201901,January 2019,2,0,2,Exports,348,Hungary,,0,World,,,,,,,,,03,"Fish and crustaceans, molluscs and other aquatic invertebrates",,,,,,,0,,1659925,,,0
HS,2019,201901,January 2019,2,0,2,Exports,348,Hungary,,0,World,,,,,,,,,02,Meat and edible meat offal,,,,,,,0,,72579950,,,0
HS,2019,201901,January 2019,2,0,2,Exports,348,Hungary,,0,World,,,,,,,,,04,"Dairy produce; birds' eggs; natural honey; edible products of animal origin, not elsewhere specified or included",,,,,,,0,,41782506,,,0
HS,2019,201901,January 2019,2,0,2,Exports,348,Hungary,,0,World,,,,,,,,,05,Animal originated products; not elsewhere specified or included,,,,,,,0,,7534870,,,0
HS,2019,201901,January 2019,2,0,2,Exports,348,Hungary,,0,World,,,,,,,,,17,Sugars and sugar confectionery,,,,,,,0,,17310981,,,0
HS,2019,201901,January 2019,2,0,2,Exports,348,Hungary,,0,World,,,,,,,,,13,"Lac; gums, resins and other vegetable saps and extracts",,,,,,,0,,463609,,,0
HS,2019,201901,January 2019,2,0,2,Exports,348,Hungary,,0,World,,,,,,,,,18,Cocoa and cocoa preparations,,,,,,,0,,17522050,,,0
HS,2019,201901,January 2019,2,0,2,Exports,348,Hungary,,0,World,,,,,,,,,23,"Food industries, residues and wastes thereof; prepared animal fodder",,,,,,,0,,91789630,,,0
HS,2019,201901,January 2019,2,0,2,Exports,348,Hungary,,0,World,,,,,,,,,22,"Beverages, spirits and vinegar",,,,,,,0,,66271339,,,0
HS,2019,201901,January 2019,2,0,2,Exports,348,Hungary,,0,World,,,,,,,,,26,"Ores, slag and ash",,,,,,,0,,465571,,,0
HS,2019,201901,January 2019,2,0,2,Exports,348,Hungary,,0,World,,,,,,,,,24,Tobacco and manufactured tobacco substitutes,,,,,,,0,,19110283,,,0
HS,2019,201901,January 2019,2,0,2,Exports,348,Hungary,,0,World,,,,,,,,,31,Fertilizers,,,,,,,0,,13895710,,,0
HS,2019,201901,January 2019,2,0,2,Exports,348,Hungary,,0,World,,,,,,,,,47,Pulp of wood or other fibrous cellulosic material; waste and scrap of paper or paperboard,,,,,,,0,,5719375,,,0
HS,2019,201901,January 2019,2,0,2,Exports,348,Hungary,,0,World,,,,,,,,,57,Carpets and other textile floor coverings,,,,,,,0,,2498687,,,0
HS,2019,201901,January 2019,2,0,2,Exports,348,Hungary,,0,World,,,,,,,,,80,Tin; articles thereof,,,,,,,0,,2835713,,,0
HS,2019,201901,January 2019,2,0,2,Exports,348,Hungary,,0,World,,,,,,,,,78,Lead and articles thereof,,,,,,,0,,443957,,,0
HS,2019,201901,January 2019,2,0,2,Exports,348,Hungary,,0,World,,,,,,,,,93,Arms and ammunition; parts and accessories thereof,,,,,,,0,,3016527,,,0
HS,2019,201901,January 2019,2,0,2,Exports,348,Hungary,,0,World,,,,,,,,,99,Commodities not specified according to kind,,,,,,,0,,22199049,,,0
HS,2019,201901,January 2019,2,0,2,Exports,348,Hungary,,0,World,,,,,,,,,01,Animals; live,,,,,,,0,,29473286,,,0
