HS,2019,201905,May 2019,2,0,2,Exports,724,Spain,,0,World,,,,,,,,,79,Zinc and articles thereof,,,,,,,0,,168999180,,,0
HS,2019,201905,May 2019,2,0,2,Exports,724,Spain,,0,World,,,,,,,,,81,"Metals; n.e.s., cermets and articles thereof",,,,,,,0,,5601667,,,0
HS,2019,201905,May 2019,2,0,2,Exports,724,Spain,,0,World,,,,,,,,,24,Tobacco and manufactured tobacco substitutes,,,,,,,0,,36295708,,,0
HS,2019,201905,May 2019,2,0,2,Exports,724,Spain,,0,World,,,,,,,,,86,"Railway, tramway locomotives, rolling-stock and parts thereof; railway or tramway track fixtures and fittings and parts thereof; mechanical (including electro-mechanical) traffic signalling equipment of all kinds",,,,,,,0,,212593790,,,0
HS,2019,201905,May 2019,2,0,2,Exports,724,Spain,,0,World,,,,,,,,,82,"Tools, implements, cutlery, spoons and forks, of base metal; parts thereof, of base metal",,,,,,,0,,97902309,,,0
HS,2019,201905,May 2019,2,0,2,Exports,724,Spain,,0,World,,,,,,,,,76,Aluminium and articles thereof,,,,,,,0,,358594326,,,0
HS,2019,201905,May 2019,2,0,2,Exports,724,Spain,,0,World,,,,,,,,,83,Metal; miscellaneous products of base metal,,,,,,,0,,143560097,,,0
HS,2019,201905,May 2019,2,0,2,Exports,724,Spain,,0,World,,,,,,,,,80,Tin; articles thereof,,,,,,,0,,8453846,,,0
HS,2019,201905,May 2019,2,0,2,Exports,724,Spain,,0,World,,,,,,,,,91,Clocks and watches and parts thereof,,,,,,,0,,37460115,,,0
HS,2019,201905,May 2019,2,0,2,Exports,724,Spain,,0,World,,,,,,,,,84,"Nuclear reactors, boilers, machinery and mechanical appliances; parts thereof",,,,,,,0,,2319210624,,,0
HS,2019,201906,June 2019,2,0,2,Exports,724,Spain,,0,World,,,,,,,,,51,"Wool, fine or coarse animal hair; horsehair yarn and woven fabric",,,,,,,0,,8501315,,,0
HS,2019,201906,June 2019,2,0,2,Exports,724,Spain,,0,World,,,,,,,,,50,Silk,,,,,,,0,,256529,,,0
HS,2019,201906,June 2019,2,0,2,Exports,724,Spain,,0,World,,,,,,,,,37,Photographic or cinematographic goods,,,,,,,0,,7006118,,,0
HS,2019,201906,June 2019,2,0,2,Exports,724,Spain,,0,World,,,,,,,,,66,"Umbrellas, sun umbrellas, walking-sticks, seat sticks, whips, riding crops; and parts thereof",,,,,,,0,,1852420,,,0
HS,2019,201906,June 2019,2,0,2,Exports,724,Spain,,0,World,,,,,,,,,69,Ceramic products,,,,,,,0,,307254528,,,0
HS,2019,201906,June 2019,2,0,2,Exports,724,Spain,,0,World,,,,,,,,,01,Animals; live,,,,,,,0,,44500053,,,0
HS,2019,201906,June 2019,2,0,2,Exports,724,Spain,,0,World,,,,,,,,,61,Apparel and clothing accessories; knitted or crocheted,,,,,,,0,,330043612,,,0
HS,2019,201906,June 2019,2,0,2,Exports,724,Spain,,0,World,,,,,,,,,06,"Trees and other plants, live; bulbs, roots and the like; cut flowers and ornamental foliage",,,,,,,0,,27746899,,,0
HS,2019,201906,June 2019,2,0,2,Exports,724,Spain,,0,World,,,,,,,,,28,"Inorganic chemicals; organic and inorganic compounds of precious metals; of rare earth metals, of radio-active elements and of isotopes",,,,,,,0,,122030021,,,0
HS,2019,201906,June 2019,2,0,2,Exports,724,Spain,,0,World,,,,,,,,,02,Meat and edible meat offal,,,,,,,0,,579110135,,,0
HS,2019,201906,June 2019,2,0,2,Exports,724,Spain,,0,World,,,,,,,,,04,"Dairy produce; birds' eggs; natural honey; edible products of animal origin, not elsewhere specified or included",,,,,,,0,,136083358,,,0
HS,2019,201906,June 2019,2,0,2,Exports,724,Spain,,0,World,,,,,,,,,38,Chemical products n.e.s.,,,,,,,0,,375925987,,,0
HS,2019,201906,June 2019,2,0,2,Exports,724,Spain,,0,World,,,,,,,,,33,"Essential oils and resinoids; perfumery, cosmetic or toilet preparations",,,,,,,0,,429577127,,,0
HS,2019,201906,June 2019,2,0,2,Exports,724,Spain,,0,World,,,,,,,,,34,"Soap, organic surface-active agents; washing, lubricating, polishing or scouring preparations; artificial or prepared waxes, candles and similar articles, modelling pastes, ""dental waxes"" and dental preparations with a basis of plaster",,,,,,,0,,115854705,,,0
HS,2019,201906,June 2019,2,0,2,Exports,724,Spain,,0,World,,,,,,,,,16,"Meat, fish or crustaceans, molluscs or other aquatic invertebrates; preparations thereof",,,,,,,0,,160414250,,,0
HS,2019,201906,June 2019,2,0,2,Exports,724,Spain,,0,World,,,,,,,,,19,"Preparations of cereals, flour, starch or milk; pastrycooks' products",,,,,,,0,,162502311,,,0
HS,2019,201906,June 2019,2,0,2,Exports,724,Spain,,0,World,,,,,,,,,23,"Food industries, residues and wastes thereof; prepared animal fodder",,,,,,,0,,86816223,,,0
HS,2019,201906,June 2019,2,0,2,Exports,724,Spain,,0,World,,,,,,,,,20,"Preparations of vegetables, fruit, nuts or other parts of plants",,,,,,,0,,278469815,,,0
HS,2019,201906,June 2019,2,0,2,Exports,724,Spain,,0,World,,,,,,,,,08,"Fruit and nuts, edible; peel of citrus fruit or melons",,,,,,,0,,963874662,,,0
HS,2019,201906,June 2019,2,0,2,Exports,724,Spain,,0,World,,,,,,,,,45,Cork and articles of cork,,,,,,,0,,27442955,,,0
HS,2019,201906,June 2019,2,0,2,Exports,724,Spain,,0,World,,,,,,,,,39,Plastics and articles thereof,,,,,,,0,,981095748,,,0
HS,2019,201906,June 2019,2,0,2,Exports,724,Spain,,0,World,,,,,,,,,10,Cereals,,,,,,,0,,36156687,,,0
HS,2019,201906,June 2019,2,0,2,Exports,724,Spain,,0,World,,,,,,,,,15,Animal or vegetable fats and oils and their cleavage products; prepared animal fats; animal or vegetable waxes,,,,,,,0,,375686454,,,0
HS,2019,201906,June 2019,2,0,2,Exports,724,Spain,,0,World,,,,,,,,,29,Organic chemicals,,,,,,,0,,387497044,,,0
HS,2019,201906,June 2019,2,0,2,Exports,724,Spain,,0,World,,,,,,,,,03,"Fish and crustaceans, molluscs and other aquatic invertebrates",,,,,,,0,,260928667,,,0
HS,2019,201906,June 2019,2,0,2,Exports,724,Spain,,0,World,,,,,,,,,41,Raw hides and skins (other than furskins) and leather,,,,,,,0,,52824036,,,0
HS,2019,201906,June 2019,2,0,2,Exports,724,Spain,,0,World,,,,,,,,,43,Furskins and artificial fur; manufactures thereof,,,,,,,0,,9639542,,,0
HS,2019,201906,June 2019,2,0,2,Exports,724,Spain,,0,World,,,,,,,,,48,"Paper and paperboard; articles of paper pulp, of paper or paperboard",,,,,,,0,,321030075,,,0
HS,2019,201906,June 2019,2,0,2,Exports,724,Spain,,0,World,,,,,,,,,35,Albuminoidal substances; modified starches; glues; enzymes,,,,,,,0,,21436269,,,0
HS,2019,201906,June 2019,2,0,2,Exports,724,Spain,,0,World,,,,,,,,,32,"Tanning or dyeing extracts; tannins and their derivatives; dyes, pigments and other colouring matter; paints, varnishes; putty, other mastics; inks",,,,,,,0,,242255919,,,0
HS,2019,201906,June 2019,2,0,2,Exports,724,Spain,,0,World,,,,,,,,,31,Fertilizers,,,,,,,0,,108175642,,,0
HS,2019,201906,June 2019,2,0,2,Exports,724,Spain,,0,World,,,,,,,,,44,Wood and articles of wood; wood charcoal,,,,,,,0,,145210805,,,0
HS,2019,201906,June 2019,2,0,2,Exports,724,Spain,,0,World,,,,,,,,,40,Rubber and articles thereof,,,,,,,0,,340857209,,,0
HS,2019,201906,June 2019,2,0,2,Exports,724,Spain,,0,World,,,,,,,,,30,Pharmaceutical products,,,,,,,0,,1063394829,,,0
HS,2019,201906,June 2019,2,0,2,Exports,724,Spain,,0,World,,,,,,,,,09,"Coffee, tea, mate and spices",,,,,,,0,,46902963,,,0
HS,2019,201906,June 2019,2,0,2,Exports,724,Spain,,0,World,,,,,,,,,21,Miscellaneous edible preparations,,,,,,,0,,160489014,,,0
HS,2019,201906,June 2019,2,0,2,Exports,724,Spain,,0,World,,,,,,,,,52,Cotton,,,,,,,0,,53412850,,,0
HS,2019,201906,June 2019,2,0,2,Exports,724,Spain,,0,World,,,,,,,,,58,"Fabrics; special woven fabrics, tufted textile fabrics, lace, tapestries, trimmings, embroidery",,,,,,,0,,16410832,,,0
HS,2019,201906,June 2019,2,0,2,Exports,724,Spain,,0,World,,,,,,,,,71,"Natural, cultured pearls; precious, semi-precious stones; precious metals, metals clad with precious metal, and articles thereof; imitation jewellery; coin",,,,,,,0,,207868440,,,0
HS,2019,201906,June 2019,2,0,2,Exports,724,Spain,,0,World,,,,,,,,,73,Iron or steel articles,,,,,,,0,,653514780,,,0
HS,2019,201906,June 2019,2,0,2,Exports,724,Spain,,0,World,,,,,,,,,49,"Printed books, newspapers, pictures and other products of the printing industry; manuscripts, typescripts and plans",,,,,,,0,,60768755,,,0
HS,2019,201906,June 2019,2,0,2,Exports,724,Spain,,0,World,,,,,,,,,68,"Stone, plaster, cement, asbestos, mica or similar materials; articles thereof",,,,,,,0,,178884188,,,0
HS,2019,201906,June 2019,2,0,2,Exports,724,Spain,,0,World,,,,,,,,,56,"Wadding, felt and nonwovens, special yarns; twine, cordage, ropes and cables and articles thereof",,,,,,,0,,48278232,,,0
HS,2019,201906,June 2019,2,0,2,Exports,724,Spain,,0,World,,,,,,,,,53,Vegetable textile fibres; paper yarn and woven fabrics of paper yarn,,,,,,,0,,4865876,,,0
HS,2019,201906,June 2019,2,0,2,Exports,724,Spain,,0,World,,,,,,,,,55,Man-made staple fibres,,,,,,,0,,63045219,,,0
HS,2019,201906,June 2019,2,0,2,Exports,724,Spain,,0,World,,,,,,,,,60,Fabrics; knitted or crocheted,,,,,,,0,,32656845,,,0
HS,2019,201906,June 2019,2,0,2,Exports,724,Spain,,0,World,,,,,,,,,59,"Textile fabrics; impregnated, coated, covered or laminated; textile articles of a kind suitable for industrial use",,,,,,,0,,31802536,,,0
HS,2019,201906,June 2019,2,0,2,Exports,724,Spain,,0,World,,,,,,,,,62,Apparel and clothing accessories; not knitted or crocheted,,,,,,,0,,529713872,,,0
HS,2019,201906,June 2019,2,0,2,Exports,724,Spain,,0,World,,,,,,,,,99,Commodities not specified according to kind,,,,,,,0,,2215539031,,,0
HS,2019,201906,June 2019,2,0,2,Exports,724,Spain,,0,World,,,,,,,,,96,Miscellaneous manufactured articles,,,,,,,0,,55025849,,,0
HS,2019,201906,June 2019,2,0,2,Exports,724,Spain,,0,World,,,,,,,,,94,"Furniture; bedding, mattresses, mattress supports, cushions and similar stuffed furnishings; lamps and lighting fittings, n.e.s.; illuminated signs, illuminated name-plates and the like; prefabricated buildings",,,,,,,0,,310678751,,,0
HS,2019,201906,June 2019,2,0,2,Exports,724,Spain,,0,World,,,,,,,,,93,Arms and ammunition; parts and accessories thereof,,,,,,,0,,32401865,,,0
HS,2019,201906,June 2019,2,0,2,Exports,724,Spain,,0,World,,,,,,,,,91,Clocks and watches and parts thereof,,,,,,,0,,28315433,,,0
HS,2019,201906,June 2019,2,0,2,Exports,724,Spain,,0,World,,,,,,,,,92,Musical instruments; parts and accessories of such articles,,,,,,,0,,3880089,,,0
HS,2019,201906,June 2019,2,0,2,Exports,724,Spain,,0,World,,,,,,,,,90,"Optical, photographic, cinematographic, measuring, checking, medical or surgical instruments and apparatus; parts and accessories",,,,,,,0,,293109848,,,0
HS,2019,201906,June 2019,2,0,2,Exports,724,Spain,,0,World,,,,,,,,,84,"Nuclear reactors, boilers, machinery and mechanical appliances; parts thereof",,,,,,,0,,2089405501,,,0
HS,2019,201906,June 2019,2,0,2,Exports,724,Spain,,0,World,,,,,,,,,85,"Electrical machinery and equipment and parts thereof; sound recorders and reproducers; television image and sound recorders and reproducers, parts and accessories of such articles",,,,,,,0,,1442170959,,,0
HS,2019,201906,June 2019,2,0,2,Exports,724,Spain,,0,World,,,,,,,,,80,Tin; articles thereof,,,,,,,0,,8951902,,,0
HS,2019,201906,June 2019,2,0,2,Exports,724,Spain,,0,World,,,,,,,,,83,Metal; miscellaneous products of base metal,,,,,,,0,,126532117,,,0
HS,2019,201906,June 2019,2,0,2,Exports,724,Spain,,0,World,,,,,,,,,74,Copper and articles thereof,,,,,,,0,,217056214,,,0
HS,2019,201906,June 2019,2,0,2,Exports,724,Spain,,0,World,,,,,,,,,87,"Vehicles; other than railway or tramway rolling stock, and parts and accessories thereof",,,,,,,0,,4952291284,,,0
HS,2019,201906,June 2019,2,0,2,Exports,724,Spain,,0,World,,,,,,,,,95,"Toys, games and sports requisites; parts and accessories thereof",,,,,,,0,,147532991,,,0
HS,2019,201906,June 2019,2,0,2,Exports,724,Spain,,0,World,,,,,,,,,76,Aluminium and articles thereof,,,,,,,0,,325068483,,,0
HS,2019,201906,June 2019,2,0,2,Exports,724,Spain,,0,World,,,,,,,,,82,"Tools, implements, cutlery, spoons and forks, of base metal; parts thereof, of base metal",,,,,,,0,,84457707,,,0
HS,2019,201906,June 2019,2,0,2,Exports,724,Spain,,0,World,,,,,,,,,97,Works of art; collectors' pieces and antiques,,,,,,,0,,7790888,,,0
HS,2019,201906,June 2019,2,0,2,Exports,724,Spain,,0,World,,,,,,,,,75,Nickel and articles thereof,,,,,,,0,,4192107,,,0
HS,2019,201906,June 2019,2,0,2,Exports,724,Spain,,0,World,,,,,,,,,81,"Metals; n.e.s., cermets and articles thereof",,,,,,,0,,2990854,,,0
HS,2019,201906,June 2019,2,0,2,Exports,724,Spain,,0,World,,,,,,,,,79,Zinc and articles thereof,,,,,,,0,,166442932,,,0
HS,2019,201906,June 2019,2,0,2,Exports,724,Spain,,0,World,,,,,,,,,78,Lead and articles thereof,,,,,,,0,,3074434,,,0
HS,2019,201906,June 2019,2,0,2,Exports,724,Spain,,0,World,,,,,,,,,86,"Railway, tramway locomotives, rolling-stock and parts thereof; railway or tramway track fixtures and fittings and parts thereof; mechanical (including electro-mechanical) traffic signalling equipment of all kinds",,,,,,,0,,234105732,,,0
HS,2019,201906,June 2019,2,0,2,Exports,724,Spain,,0,World,,,,,,,,,88,"Aircraft, spacecraft and parts thereof",,,,,,,0,,894265211,,,0
HS,2019,201906,June 2019,2,0,2,Exports,724,Spain,,0,World,,,,,,,,,89,"Ships, boats and floating structures",,,,,,,0,,70351407,,,0
HS,2019,201906,June 2019,2,0,2,Exports,724,Spain,,0,World,,,,,,,,,05,Animal originated products; not elsewhere specified or included,,,,,,,0,,28795397,,,0
HS,2019,201906,June 2019,2,0,2,Exports,724,Spain,,0,World,,,,,,,,,11,"Products of the milling industry; malt, starches, inulin, wheat gluten",,,,,,,0,,23234751,,,0
HS,2019,201906,June 2019,2,0,2,Exports,724,Spain,,0,World,,,,,,,,,13,"Lac; gums, resins and other vegetable saps and extracts",,,,,,,0,,48697525,,,0
HS,2019,201906,June 2019,2,0,2,Exports,724,Spain,,0,World,,,,,,,,,14,Vegetable plaiting materials; vegetable products not elsewhere specified or included,,,,,,,0,,757093,,,0
HS,2019,201906,June 2019,2,0,2,Exports,724,Spain,,0,World,,,,,,,,,57,Carpets and other textile floor coverings,,,,,,,0,,10730011,,,0
HS,2019,201903,March 2019,2,0,2,Exports,724,Spain,,0,World,,,,,,,,,66,"Umbrellas, sun umbrellas, walking-sticks, seat sticks, whips, riding crops; and parts thereof",,,,,,,0,,2932407,,,0
HS,2019,201903,March 2019,2,0,2,Exports,724,Spain,,0,World,,,,,,,,,58,"Fabrics; special woven fabrics, tufted textile fabrics, lace, tapestries, trimmings, embroidery",,,,,,,0,,16630687,,,0
HS,2019,201903,March 2019,2,0,2,Exports,724,Spain,,0,World,,,,,,,,,52,Cotton,,,,,,,0,,61265161,,,0
HS,2019,201903,March 2019,2,0,2,Exports,724,Spain,,0,World,,,,,,,,,30,Pharmaceutical products,,,,,,,0,,1055525876,,,0
HS,2019,201903,March 2019,2,0,2,Exports,724,Spain,,0,World,,,,,,,,,09,"Coffee, tea, mate and spices",,,,,,,0,,54199403,,,0
HS,2019,201903,March 2019,2,0,2,Exports,724,Spain,,0,World,,,,,,,,,21,Miscellaneous edible preparations,,,,,,,0,,155444015,,,0
HS,2019,201903,March 2019,2,0,2,Exports,724,Spain,,0,World,,,,,,,,,56,"Wadding, felt and nonwovens, special yarns; twine, cordage, ropes and cables and articles thereof",,,,,,,0,,50924142,,,0
HS,2019,201903,March 2019,2,0,2,Exports,724,Spain,,0,World,,,,,,,,,54,Man-made filaments,,,,,,,0,,72028669,,,0
HS,2019,201903,March 2019,2,0,2,Exports,724,Spain,,0,World,,,,,,,,,49,"Printed books, newspapers, pictures and other products of the printing industry; manuscripts, typescripts and plans",,,,,,,0,,72814731,,,0
HS,2019,201903,March 2019,2,0,2,Exports,724,Spain,,0,World,,,,,,,,,42,"Articles of leather; saddlery and harness; travel goods, handbags and similar containers; articles of animal gut (other than silk-worm gut)",,,,,,,0,,114178490,,,0
HS,2019,201903,March 2019,2,0,2,Exports,724,Spain,,0,World,,,,,,,,,44,Wood and articles of wood; wood charcoal,,,,,,,0,,154510189,,,0
HS,2019,201903,March 2019,2,0,2,Exports,724,Spain,,0,World,,,,,,,,,31,Fertilizers,,,,,,,0,,99428101,,,0
HS,2019,201903,March 2019,2,0,2,Exports,724,Spain,,0,World,,,,,,,,,32,"Tanning or dyeing extracts; tannins and their derivatives; dyes, pigments and other colouring matter; paints, varnishes; putty, other mastics; inks",,,,,,,0,,260750757,,,0
HS,2019,201903,March 2019,2,0,2,Exports,724,Spain,,0,World,,,,,,,,,35,Albuminoidal substances; modified starches; glues; enzymes,,,,,,,0,,21873659,,,0
HS,2019,201903,March 2019,2,0,2,Exports,724,Spain,,0,World,,,,,,,,,57,Carpets and other textile floor coverings,,,,,,,0,,10270730,,,0
HS,2019,201903,March 2019,2,0,2,Exports,724,Spain,,0,World,,,,,,,,,59,"Textile fabrics; impregnated, coated, covered or laminated; textile articles of a kind suitable for industrial use",,,,,,,0,,33367809,,,0
HS,2019,201903,March 2019,2,0,2,Exports,724,Spain,,0,World,,,,,,,,,62,Apparel and clothing accessories; not knitted or crocheted,,,,,,,0,,758692251,,,0
HS,2019,201903,March 2019,2,0,2,Exports,724,Spain,,0,World,,,,,,,,,64,Footwear; gaiters and the like; parts of such articles,,,,,,,0,,325250133,,,0
HS,2019,201903,March 2019,2,0,2,Exports,724,Spain,,0,World,,,,,,,,,55,Man-made staple fibres,,,,,,,0,,73294046,,,0
HS,2019,201903,March 2019,2,0,2,Exports,724,Spain,,0,World,,,,,,,,,48,"Paper and paperboard; articles of paper pulp, of paper or paperboard",,,,,,,0,,347577167,,,0
HS,2019,201903,March 2019,2,0,2,Exports,724,Spain,,0,World,,,,,,,,,51,"Wool, fine or coarse animal hair; horsehair yarn and woven fabric",,,,,,,0,,9422928,,,0
HS,2019,201903,March 2019,2,0,2,Exports,724,Spain,,0,World,,,,,,,,,43,Furskins and artificial fur; manufactures thereof,,,,,,,0,,8649724,,,0
HS,2019,201903,March 2019,2,0,2,Exports,724,Spain,,0,World,,,,,,,,,41,Raw hides and skins (other than furskins) and leather,,,,,,,0,,55209504,,,0
HS,2019,201903,March 2019,2,0,2,Exports,724,Spain,,0,World,,,,,,,,,67,"Feathers and down, prepared; and articles made of feather or of down; artificial flowers; articles of human hair",,,,,,,0,,2042609,,,0
HS,2019,201903,March 2019,2,0,2,Exports,724,Spain,,0,World,,,,,,,,,70,Glass and glassware,,,,,,,0,,125605560,,,0
HS,2019,201903,March 2019,2,0,2,Exports,724,Spain,,0,World,,,,,,,,,19,"Preparations of cereals, flour, starch or milk; pastrycooks' products",,,,,,,0,,165146731,,,0
HS,2019,201903,March 2019,2,0,2,Exports,724,Spain,,0,World,,,,,,,,,16,"Meat, fish or crustaceans, molluscs or other aquatic invertebrates; preparations thereof",,,,,,,0,,143527403,,,0
HS,2019,201903,March 2019,2,0,2,Exports,724,Spain,,0,World,,,,,,,,,20,"Preparations of vegetables, fruit, nuts or other parts of plants",,,,,,,0,,278082332,,,0
HS,2019,201903,March 2019,2,0,2,Exports,724,Spain,,0,World,,,,,,,,,07,Vegetables and certain roots and tubers; edible,,,,,,,0,,893375140,,,0
HS,2019,201903,March 2019,2,0,2,Exports,724,Spain,,0,World,,,,,,,,,04,"Dairy produce; birds' eggs; natural honey; edible products of animal origin, not elsewhere specified or included",,,,,,,0,,147795214,,,0
HS,2019,201903,March 2019,2,0,2,Exports,724,Spain,,0,World,,,,,,,,,34,"Soap, organic surface-active agents; washing, lubricating, polishing or scouring preparations; artificial or prepared waxes, candles and similar articles, modelling pastes, ""dental waxes"" and dental preparations with a basis of plaster",,,,,,,0,,129384627,,,0
HS,2019,201903,March 2019,2,0,2,Exports,724,Spain,,0,World,,,,,,,,,33,"Essential oils and resinoids; perfumery, cosmetic or toilet preparations",,,,,,,0,,465584377,,,0
HS,2019,201903,March 2019,2,0,2,Exports,724,Spain,,0,World,,,,,,,,,38,Chemical products n.e.s.,,,,,,,0,,447382183,,,0
HS,2019,201903,March 2019,2,0,2,Exports,724,Spain,,0,World,,,,,,,,,10,Cereals,,,,,,,0,,47291553,,,0
HS,2019,201903,March 2019,2,0,2,Exports,724,Spain,,0,World,,,,,,,,,29,Organic chemicals,,,,,,,0,,413915932,,,0
HS,2019,201903,March 2019,2,0,2,Exports,724,Spain,,0,World,,,,,,,,,15,Animal or vegetable fats and oils and their cleavage products; prepared animal fats; animal or vegetable waxes,,,,,,,0,,415308923,,,0
HS,2019,201903,March 2019,2,0,2,Exports,724,Spain,,0,World,,,,,,,,,17,Sugars and sugar confectionery,,,,,,,0,,56182222,,,0
HS,2019,201903,March 2019,2,0,2,Exports,724,Spain,,0,World,,,,,,,,,45,Cork and articles of cork,,,,,,,0,,29445115,,,0
HS,2019,201903,March 2019,2,0,2,Exports,724,Spain,,0,World,,,,,,,,,08,"Fruit and nuts, edible; peel of citrus fruit or melons",,,,,,,0,,865870951,,,0
HS,2019,201903,March 2019,2,0,2,Exports,724,Spain,,0,World,,,,,,,,,28,"Inorganic chemicals; organic and inorganic compounds of precious metals; of rare earth metals, of radio-active elements and of isotopes",,,,,,,0,,132415512,,,0
HS,2019,201903,March 2019,2,0,2,Exports,724,Spain,,0,World,,,,,,,,,01,Animals; live,,,,,,,0,,59030458,,,0
HS,2019,201903,March 2019,2,0,2,Exports,724,Spain,,0,World,,,,,,,,,37,Photographic or cinematographic goods,,,,,,,0,,8316193,,,0
HS,2019,201903,March 2019,2,0,2,Exports,724,Spain,,0,World,,,,,,,,,71,"Natural, cultured pearls; precious, semi-precious stones; precious metals, metals clad with precious metal, and articles thereof; imitation jewellery; coin",,,,,,,0,,176306795,,,0
HS,2019,201903,March 2019,2,0,2,Exports,724,Spain,,0,World,,,,,,,,,69,Ceramic products,,,,,,,0,,337505740,,,0
HS,2019,201903,March 2019,2,0,2,Exports,724,Spain,,0,World,,,,,,,,,73,Iron or steel articles,,,,,,,,,623602354,,,0
HS,2019,201903,March 2019,2,0,2,Exports,724,Spain,,0,World,,,,,,,,,68,"Stone, plaster, cement, asbestos, mica or similar materials; articles thereof",,,,,,,,,186882726,,,0
HS,2019,201903,March 2019,2,0,2,Exports,724,Spain,,0,World,,,,,,,,,63,"Textiles, made up articles; sets; worn clothing and worn textile articles; rags",,,,,,,,,62931248,,,0
HS,2019,201903,March 2019,2,0,2,Exports,724,Spain,,0,World,,,,,,,,,72,Iron and steel,,,,,,,,,640970815,,,0
HS,2019,201903,March 2019,2,0,2,Exports,724,Spain,,0,World,,,,,,,,,99,Commodities not specified according to kind,,,,,,,0,,2279975666,,,0
HS,2019,201903,March 2019,2,0,2,Exports,724,Spain,,0,World,,,,,,,,,94,"Furniture; bedding, mattresses, mattress supports, cushions and similar stuffed furnishings; lamps and lighting fittings, n.e.s.; illuminated signs, illuminated name-plates and the like; prefabricated buildings",,,,,,,0,,324177927,,,0
HS,2019,201903,March 2019,2,0,2,Exports,724,Spain,,0,World,,,,,,,,,92,Musical instruments; parts and accessories of such articles,,,,,,,0,,3571097,,,0
HS,2019,201903,March 2019,2,0,2,Exports,724,Spain,,0,World,,,,,,,,,97,Works of art; collectors' pieces and antiques,,,,,,,0,,8064332,,,0
HS,2019,201903,March 2019,2,0,2,Exports,724,Spain,,0,World,,,,,,,,,80,Tin; articles thereof,,,,,,,0,,4041859,,,0
HS,2019,201903,March 2019,2,0,2,Exports,724,Spain,,0,World,,,,,,,,,02,Meat and edible meat offal,,,,,,,0,,582197634,,,0
HS,2019,201903,March 2019,2,0,2,Exports,724,Spain,,0,World,,,,,,,,,03,"Fish and crustaceans, molluscs and other aquatic invertebrates",,,,,,,0,,276716494,,,0
HS,2019,201903,March 2019,2,0,2,Exports,724,Spain,,0,World,,,,,,,,,05,Animal originated products; not elsewhere specified or included,,,,,,,0,,29548927,,,0
HS,2019,201903,March 2019,2,0,2,Exports,724,Spain,,0,World,,,,,,,,,36,Explosives; pyrotechnic products; matches; pyrophoric alloys; certain combustible preparations,,,,,,,0,,14257075,,,0
HS,2019,201903,March 2019,2,0,2,Exports,724,Spain,,0,World,,,,,,,,,50,Silk,,,,,,,0,,298954,,,0
HS,2019,201903,March 2019,2,0,2,Exports,724,Spain,,0,World,,,,,,,,,53,Vegetable textile fibres; paper yarn and woven fabrics of paper yarn,,,,,,,0,,15104941,,,0
HS,2019,201903,March 2019,2,0,2,Exports,724,Spain,,0,World,,,,,,,,,60,Fabrics; knitted or crocheted,,,,,,,0,,35394868,,,0
HS,2019,201903,March 2019,2,0,2,Exports,724,Spain,,0,World,,,,,,,,,65,Headgear and parts thereof,,,,,,,0,,11775642,,,0
HS,2019,201901,January 2019,2,0,2,Exports,724,Spain,,0,World,,,,,,,,,65,Headgear and parts thereof,,,,,,,0,,13708938,,,0
HS,2019,201901,January 2019,2,0,2,Exports,724,Spain,,0,World,,,,,,,,,88,"Aircraft, spacecraft and parts thereof",,,,,,,0,,453760132,,,0
HS,2019,201901,January 2019,2,0,2,Exports,724,Spain,,0,World,,,,,,,,,97,Works of art; collectors' pieces and antiques,,,,,,,0,,10483809,,,0
HS,2019,201901,January 2019,2,0,2,Exports,724,Spain,,0,World,,,,,,,,,89,"Ships, boats and floating structures",,,,,,,0,,35705833,,,0
HS,2019,201901,January 2019,2,0,2,Exports,724,Spain,,0,World,,,,,,,,,67,"Feathers and down, prepared; and articles made of feather or of down; artificial flowers; articles of human hair",,,,,,,0,,1530669,,,0
HS,2019,201901,January 2019,2,0,2,Exports,724,Spain,,0,World,,,,,,,,,99,Commodities not specified according to kind,,,,,,,0,,1559740554,,,0
HS,2019,201901,January 2019,2,0,2,Exports,724,Spain,,0,World,,,,,,,,,15,Animal or vegetable fats and oils and their cleavage products; prepared animal fats; animal or vegetable waxes,,,,,,,,,403787473,,,0
HS,2019,201901,January 2019,2,0,2,Exports,724,Spain,,0,World,,,,,,,,,17,Sugars and sugar confectionery,,,,,,,0,,54066960,,,0
HS,2019,201901,January 2019,2,0,2,Exports,724,Spain,,0,World,,,,,,,,,18,Cocoa and cocoa preparations,,,,,,,0,,54328565,,,0
HS,2019,201901,January 2019,2,0,2,Exports,724,Spain,,0,World,,,,,,,,,19,"Preparations of cereals, flour, starch or milk; pastrycooks' products",,,,,,,0,,166744888,,,0
HS,2019,201901,January 2019,2,0,2,Exports,724,Spain,,0,World,,,,,,,,,94,"Furniture; bedding, mattresses, mattress supports, cushions and similar stuffed furnishings; lamps and lighting fittings, n.e.s.; illuminated signs, illuminated name-plates and the like; prefabricated buildings",,,,,,,0,,293139298,,,0
HS,2019,201901,January 2019,2,0,2,Exports,724,Spain,,0,World,,,,,,,,,92,Musical instruments; parts and accessories of such articles,,,,,,,0,,3112854,,,0
HS,2019,201901,January 2019,2,0,2,Exports,724,Spain,,0,World,,,,,,,,,70,Glass and glassware,,,,,,,0,,131427141,,,0
HS,2019,201901,January 2019,2,0,2,Exports,724,Spain,,0,World,,,,,,,,,57,Carpets and other textile floor coverings,,,,,,,0,,11505636,,,0
HS,2019,201901,January 2019,2,0,2,Exports,724,Spain,,0,World,,,,,,,,,55,Man-made staple fibres,,,,,,,0,,65068780,,,0
HS,2019,201901,January 2019,2,0,2,Exports,724,Spain,,0,World,,,,,,,,,48,"Paper and paperboard; articles of paper pulp, of paper or paperboard",,,,,,,0,,375361360,,,0
