HS,2019,201903,March 2019,2,0,2,Exports,348,Hungary,,0,World,,,,,,,,,96,Miscellaneous manufactured articles,,,,,,,0,,47250531,,,0
HS,2019,201903,March 2019,2,0,2,Exports,348,Hungary,,0,World,,,,,,,,,94,"Furniture; bedding, mattresses, mattress supports, cushions and similar stuffed furnishings; lamps and lighting fittings, n.e.s.; illuminated signs, illuminated name-plates and the like; prefabricated buildings",,,,,,,0,,165986248,,,0
HS,2019,201903,March 2019,2,0,2,Exports,348,Hungary,,0,World,,,,,,,,,93,Arms and ammunition; parts and accessories thereof,,,,,,,0,,4406462,,,0
HS,2019,201903,March 2019,2,0,2,Exports,348,Hungary,,0,World,,,,,,,,,82,"Tools, implements, cutlery, spoons and forks, of base metal; parts thereof, of base metal",,,,,,,0,,13971224,,,0
HS,2019,201903,March 2019,2,0,2,Exports,348,Hungary,,0,World,,,,,,,,,09,"Coffee, tea, mate and spices",,,,,,,0,,6654204,,,0
HS,2019,201903,March 2019,2,0,2,Exports,348,Hungary,,0,World,,,,,,,,,21,Miscellaneous edible preparations,,,,,,,0,,60718893,,,0
HS,2019,201903,March 2019,2,0,2,Exports,348,Hungary,,0,World,,,,,,,,,79,Zinc and articles thereof,,,,,,,0,,2126693,,,0
HS,2019,201903,March 2019,2,0,2,Exports,348,Hungary,,0,World,,,,,,,,,76,Aluminium and articles thereof,,,,,,,0,,136038249,,,0
HS,2019,201903,March 2019,2,0,2,Exports,348,Hungary,,0,World,,,,,,,,,73,Iron or steel articles,,,,,,,0,,144826810,,,0
HS,2019,201903,March 2019,2,0,2,Exports,348,Hungary,,0,World,,,,,,,,,71,"Natural, cultured pearls; precious, semi-precious stones; precious metals, metals clad with precious metal, and articles thereof; imitation jewellery; coin",,,,,,,0,,11056937,,,0
HS,2019,201903,March 2019,2,0,2,Exports,348,Hungary,,0,World,,,,,,,,,68,"Stone, plaster, cement, asbestos, mica or similar materials; articles thereof",,,,,,,0,,43821845,,,0
HS,2019,201903,March 2019,2,0,2,Exports,348,Hungary,,0,World,,,,,,,,,69,Ceramic products,,,,,,,0,,34503636,,,0
HS,2019,201903,March 2019,2,0,2,Exports,348,Hungary,,0,World,,,,,,,,,56,"Wadding, felt and nonwovens, special yarns; twine, cordage, ropes and cables and articles thereof",,,,,,,0,,21255866,,,0
HS,2019,201903,March 2019,2,0,2,Exports,348,Hungary,,0,World,,,,,,,,,50,Silk,,,,,,,0,,3457,,,0
HS,2019,201903,March 2019,2,0,2,Exports,348,Hungary,,0,World,,,,,,,,,54,Man-made filaments,,,,,,,0,,10946456,,,0
HS,2019,201903,March 2019,2,0,2,Exports,348,Hungary,,0,World,,,,,,,,,75,Nickel and articles thereof,,,,,,,,,220314,,,0
HS,2019,201903,March 2019,2,0,2,Exports,348,Hungary,,0,World,,,,,,,,,27,"Mineral fuels, mineral oils and products of their distillation; bituminous substances; mineral waxes",,,,,,,,,258683187,,,0
HS,2019,201912,December 2019,2,0,2,Exports,348,Hungary,,0,World,,,,,,,,,04,"Dairy produce; birds' eggs; natural honey; edible products of animal origin, not elsewhere specified or included",,,,,,,0,,43156740,,,0
HS,2019,201912,December 2019,2,0,2,Exports,348,Hungary,,0,World,,,,,,,,,02,Meat and edible meat offal,,,,,,,0,,105882202,,,0
HS,2019,201912,December 2019,2,0,2,Exports,348,Hungary,,0,World,,,,,,,,,10,Cereals,,,,,,,0,,102380773,,,0
HS,2019,201912,December 2019,2,0,2,Exports,348,Hungary,,0,World,,,,,,,,,13,"Lac; gums, resins and other vegetable saps and extracts",,,,,,,0,,301814,,,0
HS,2019,201912,December 2019,2,0,2,Exports,348,Hungary,,0,World,,,,,,,,,14,Vegetable plaiting materials; vegetable products not elsewhere specified or included,,,,,,,0,,309789,,,0
HS,2019,201912,December 2019,2,0,2,Exports,348,Hungary,,0,World,,,,,,,,,23,"Food industries, residues and wastes thereof; prepared animal fodder",,,,,,,0,,76117728,,,0
HS,2019,201912,December 2019,2,0,2,Exports,348,Hungary,,0,World,,,,,,,,,31,Fertilizers,,,,,,,0,,10173363,,,0
HS,2019,201912,December 2019,2,0,2,Exports,348,Hungary,,0,World,,,,,,,,,36,Explosives; pyrotechnic products; matches; pyrophoric alloys; certain combustible preparations,,,,,,,0,,1635970,,,0
HS,2019,201912,December 2019,2,0,2,Exports,348,Hungary,,0,World,,,,,,,,,86,"Railway, tramway locomotives, rolling-stock and parts thereof; railway or tramway track fixtures and fittings and parts thereof; mechanical (including electro-mechanical) traffic signalling equipment of all kinds",,,,,,,0,,25010322,,,0
HS,2019,201912,December 2019,2,0,2,Exports,348,Hungary,,0,World,,,,,,,,,93,Arms and ammunition; parts and accessories thereof,,,,,,,0,,3464827,,,0
HS,2019,201912,December 2019,2,0,2,Exports,348,Hungary,,0,World,,,,,,,,,89,"Ships, boats and floating structures",,,,,,,0,,795537,,,0
HS,2019,201912,December 2019,2,0,2,Exports,348,Hungary,,0,World,,,,,,,,,99,Commodities not specified according to kind,,,,,,,0,,19866738,,,0
HS,2019,201912,December 2019,2,0,2,Exports,348,Hungary,,0,World,,,,,,,,,47,Pulp of wood or other fibrous cellulosic material; waste and scrap of paper or paperboard,,,,,,,0,,3441583,,,0
HS,2019,201912,December 2019,2,0,2,Exports,348,Hungary,,0,World,,,,,,,,,46,"Manufactures of straw, esparto or other plaiting materials; basketware and wickerwork",,,,,,,0,,80682,,,0
HS,2019,201912,December 2019,2,0,2,Exports,348,Hungary,,0,World,,,,,,,,,97,Works of art; collectors' pieces and antiques,,,,,,,0,,102908,,,0
HS,2019,201912,December 2019,2,0,2,Exports,348,Hungary,,0,World,,,,,,,,,01,Animals; live,,,,,,,0,,46420831,,,0
HS,2019,201912,December 2019,2,0,2,Exports,348,Hungary,,0,World,,,,,,,,,03,"Fish and crustaceans, molluscs and other aquatic invertebrates",,,,,,,0,,2070846,,,0
HS,2019,201912,December 2019,2,0,2,Exports,348,Hungary,,0,World,,,,,,,,,12,"Oil seeds and oleaginous fruits; miscellaneous grains, seeds and fruit, industrial or medicinal plants; straw and fodder",,,,,,,0,,47486594,,,0
HS,2019,201912,December 2019,2,0,2,Exports,348,Hungary,,0,World,,,,,,,,,11,"Products of the milling industry; malt, starches, inulin, wheat gluten",,,,,,,0,,11145651,,,0
HS,2019,201912,December 2019,2,0,2,Exports,348,Hungary,,0,World,,,,,,,,,19,"Preparations of cereals, flour, starch or milk; pastrycooks' products",,,,,,,0,,23480422,,,0
HS,2019,201912,December 2019,2,0,2,Exports,348,Hungary,,0,World,,,,,,,,,16,"Meat, fish or crustaceans, molluscs or other aquatic invertebrates; preparations thereof",,,,,,,0,,33147181,,,0
HS,2019,201912,December 2019,2,0,2,Exports,348,Hungary,,0,World,,,,,,,,,08,"Fruit and nuts, edible; peel of citrus fruit or melons",,,,,,,0,,9046162,,,0
HS,2019,201912,December 2019,2,0,2,Exports,348,Hungary,,0,World,,,,,,,,,06,"Trees and other plants, live; bulbs, roots and the like; cut flowers and ornamental foliage",,,,,,,0,,4882325,,,0
HS,2019,201912,December 2019,2,0,2,Exports,348,Hungary,,0,World,,,,,,,,,18,Cocoa and cocoa preparations,,,,,,,0,,16427354,,,0
HS,2019,201912,December 2019,2,0,2,Exports,348,Hungary,,0,World,,,,,,,,,27,"Mineral fuels, mineral oils and products of their distillation; bituminous substances; mineral waxes",,,,,,,0,,204865519,,,0
HS,2019,201912,December 2019,2,0,2,Exports,348,Hungary,,0,World,,,,,,,,,32,"Tanning or dyeing extracts; tannins and their derivatives; dyes, pigments and other colouring matter; paints, varnishes; putty, other mastics; inks",,,,,,,0,,12698749,,,0
HS,2019,201912,December 2019,2,0,2,Exports,348,Hungary,,0,World,,,,,,,,,28,"Inorganic chemicals; organic and inorganic compounds of precious metals; of rare earth metals, of radio-active elements and of isotopes",,,,,,,0,,39728047,,,0
HS,2019,201912,December 2019,2,0,2,Exports,348,Hungary,,0,World,,,,,,,,,37,Photographic or cinematographic goods,,,,,,,0,,4399058,,,0
HS,2019,201912,December 2019,2,0,2,Exports,348,Hungary,,0,World,,,,,,,,,34,"Soap, organic surface-active agents; washing, lubricating, polishing or scouring preparations; artificial or prepared waxes, candles and similar articles, modelling pastes, ""dental waxes"" and dental preparations with a basis of plaster",,,,,,,0,,42379776,,,0
HS,2019,201912,December 2019,2,0,2,Exports,348,Hungary,,0,World,,,,,,,,,38,Chemical products n.e.s.,,,,,,,0,,91227474,,,0
HS,2019,201912,December 2019,2,0,2,Exports,348,Hungary,,0,World,,,,,,,,,22,"Beverages, spirits and vinegar",,,,,,,0,,70096480,,,0
HS,2019,201912,December 2019,2,0,2,Exports,348,Hungary,,0,World,,,,,,,,,20,"Preparations of vegetables, fruit, nuts or other parts of plants",,,,,,,0,,45898917,,,0
HS,2019,201912,December 2019,2,0,2,Exports,348,Hungary,,0,World,,,,,,,,,33,"Essential oils and resinoids; perfumery, cosmetic or toilet preparations",,,,,,,0,,60681628,,,0
HS,2019,201912,December 2019,2,0,2,Exports,348,Hungary,,0,World,,,,,,,,,26,"Ores, slag and ash",,,,,,,0,,1322102,,,0
HS,2019,201912,December 2019,2,0,2,Exports,348,Hungary,,0,World,,,,,,,,,29,Organic chemicals,,,,,,,0,,130312329,,,0
HS,2019,201912,December 2019,2,0,2,Exports,348,Hungary,,0,World,,,,,,,,,25,"Salt; sulphur; earths, stone; plastering materials, lime and cement",,,,,,,0,,5624197,,,0
HS,2019,201912,December 2019,2,0,2,Exports,348,Hungary,,0,World,,,,,,,,,05,Animal originated products; not elsewhere specified or included,,,,,,,0,,9531111,,,0
HS,2019,201912,December 2019,2,0,2,Exports,348,Hungary,,0,World,,,,,,,,,07,Vegetables and certain roots and tubers; edible,,,,,,,0,,16546658,,,0
HS,2019,201912,December 2019,2,0,2,Exports,348,Hungary,,0,World,,,,,,,,,15,Animal or vegetable fats and oils and their cleavage products; prepared animal fats; animal or vegetable waxes,,,,,,,0,,41377611,,,0
HS,2019,201912,December 2019,2,0,2,Exports,348,Hungary,,0,World,,,,,,,,,17,Sugars and sugar confectionery,,,,,,,0,,15314116,,,0
HS,2019,201912,December 2019,2,0,2,Exports,348,Hungary,,0,World,,,,,,,,,09,"Coffee, tea, mate and spices",,,,,,,0,,6994857,,,0
HS,2019,201912,December 2019,2,0,2,Exports,348,Hungary,,0,World,,,,,,,,,21,Miscellaneous edible preparations,,,,,,,0,,53179470,,,0
HS,2019,201912,December 2019,2,0,2,Exports,348,Hungary,,0,World,,,,,,,,,81,"Metals; n.e.s., cermets and articles thereof",,,,,,,0,,2882131,,,0
HS,2019,201912,December 2019,2,0,2,Exports,348,Hungary,,0,World,,,,,,,,,79,Zinc and articles thereof,,,,,,,0,,2126889,,,0
HS,2019,201912,December 2019,2,0,2,Exports,348,Hungary,,0,World,,,,,,,,,82,"Tools, implements, cutlery, spoons and forks, of base metal; parts thereof, of base metal",,,,,,,0,,15491211,,,0
HS,2019,201912,December 2019,2,0,2,Exports,348,Hungary,,0,World,,,,,,,,,78,Lead and articles thereof,,,,,,,0,,332699,,,0
HS,2019,201912,December 2019,2,0,2,Exports,348,Hungary,,0,World,,,,,,,,,76,Aluminium and articles thereof,,,,,,,0,,69893814,,,0
HS,2019,201912,December 2019,2,0,2,Exports,348,Hungary,,0,World,,,,,,,,,73,Iron or steel articles,,,,,,,0,,103996312,,,0
HS,2019,201912,December 2019,2,0,2,Exports,348,Hungary,,0,World,,,,,,,,,71,"Natural, cultured pearls; precious, semi-precious stones; precious metals, metals clad with precious metal, and articles thereof; imitation jewellery; coin",,,,,,,0,,14383583,,,0
HS,2019,201912,December 2019,2,0,2,Exports,348,Hungary,,0,World,,,,,,,,,69,Ceramic products,,,,,,,0,,30733757,,,0
HS,2019,201912,December 2019,2,0,2,Exports,348,Hungary,,0,World,,,,,,,,,68,"Stone, plaster, cement, asbestos, mica or similar materials; articles thereof",,,,,,,0,,26985660,,,0
HS,2019,201912,December 2019,2,0,2,Exports,348,Hungary,,0,World,,,,,,,,,56,"Wadding, felt and nonwovens, special yarns; twine, cordage, ropes and cables and articles thereof",,,,,,,0,,11246434,,,0
HS,2019,201912,December 2019,2,0,2,Exports,348,Hungary,,0,World,,,,,,,,,50,Silk,,,,,,,,,41812,,,0
HS,2019,201912,December 2019,2,0,2,Exports,348,Hungary,,0,World,,,,,,,,,54,Man-made filaments,,,,,,,0,,7225884,,,0
HS,2019,201912,December 2019,2,0,2,Exports,348,Hungary,,0,World,,,,,,,,,39,Plastics and articles thereof,,,,,,,,,285482775,,,0
HS,2019,201912,December 2019,2,0,2,Exports,348,Hungary,,0,World,,,,,,,,,88,"Aircraft, spacecraft and parts thereof",,,,,,,0,,4091034,,,0
HS,2019,201912,December 2019,2,0,2,Exports,348,Hungary,,0,World,,,,,,,,,35,Albuminoidal substances; modified starches; glues; enzymes,,,,,,,,,8136381,,,0
HS,2019,201912,December 2019,2,0,2,Exports,348,Hungary,,0,World,,,,,,,,,44,Wood and articles of wood; wood charcoal,,,,,,,0,,44777207,,,0
HS,2019,201912,December 2019,2,0,2,Exports,348,Hungary,,0,World,,,,,,,,,49,"Printed books, newspapers, pictures and other products of the printing industry; manuscripts, typescripts and plans",,,,,,,0,,17685245,,,0
HS,2019,201912,December 2019,2,0,2,Exports,348,Hungary,,0,World,,,,,,,,,40,Rubber and articles thereof,,,,,,,0,,133588765,,,0
HS,2019,201912,December 2019,2,0,2,Exports,348,Hungary,,0,World,,,,,,,,,42,"Articles of leather; saddlery and harness; travel goods, handbags and similar containers; articles of animal gut (other than silk-worm gut)",,,,,,,0,,24097003,,,0
HS,2019,201912,December 2019,2,0,2,Exports,348,Hungary,,0,World,,,,,,,,,95,"Toys, games and sports requisites; parts and accessories thereof",,,,,,,0,,38789162,,,0
HS,2019,201912,December 2019,2,0,2,Exports,348,Hungary,,0,World,,,,,,,,,87,"Vehicles; other than railway or tramway rolling stock, and parts and accessories thereof",,,,,,,0,,1427853016,,,0
HS,2019,201912,December 2019,2,0,2,Exports,348,Hungary,,0,World,,,,,,,,,45,Cork and articles of cork,,,,,,,0,,176376,,,0
HS,2019,201912,December 2019,2,0,2,Exports,348,Hungary,,0,World,,,,,,,,,96,Miscellaneous manufactured articles,,,,,,,0,,39997457,,,0
HS,2019,201912,December 2019,2,0,2,Exports,348,Hungary,,0,World,,,,,,,,,94,"Furniture; bedding, mattresses, mattress supports, cushions and similar stuffed furnishings; lamps and lighting fittings, n.e.s.; illuminated signs, illuminated name-plates and the like; prefabricated buildings",,,,,,,0,,109650087,,,0
HS,2019,201912,December 2019,2,0,2,Exports,348,Hungary,,0,World,,,,,,,,,85,"Electrical machinery and equipment and parts thereof; sound recorders and reproducers; television image and sound recorders and reproducers, parts and accessories of such articles",,,,,,,0,,1935733209,,,0
HS,2019,201912,December 2019,2,0,2,Exports,348,Hungary,,0,World,,,,,,,,,90,"Optical, photographic, cinematographic, measuring, checking, medical or surgical instruments and apparatus; parts and accessories",,,,,,,0,,265510805,,,0
HS,2019,201912,December 2019,2,0,2,Exports,348,Hungary,,0,World,,,,,,,,,92,Musical instruments; parts and accessories of such articles,,,,,,,0,,4035718,,,0
HS,2019,201912,December 2019,2,0,2,Exports,348,Hungary,,0,World,,,,,,,,,91,Clocks and watches and parts thereof,,,,,,,,,3400843,,,0
HS,2019,201912,December 2019,2,0,2,Exports,348,Hungary,,0,World,,,,,,,,,75,Nickel and articles thereof,,,,,,,0,,118335,,,0
HS,2019,201912,December 2019,2,0,2,Exports,348,Hungary,,0,World,,,,,,,,,74,Copper and articles thereof,,,,,,,0,,13944780,,,0
HS,2019,201912,December 2019,2,0,2,Exports,348,Hungary,,0,World,,,,,,,,,84,"Nuclear reactors, boilers, machinery and mechanical appliances; parts thereof",,,,,,,0,,1436528959,,,0
HS,2019,201912,December 2019,2,0,2,Exports,348,Hungary,,0,World,,,,,,,,,83,Metal; miscellaneous products of base metal,,,,,,,0,,27263103,,,0
HS,2019,201912,December 2019,2,0,2,Exports,348,Hungary,,0,World,,,,,,,,,80,Tin; articles thereof,,,,,,,0,,1585872,,,0
HS,2019,201912,December 2019,2,0,2,Exports,348,Hungary,,0,World,,,,,,,,,41,Raw hides and skins (other than furskins) and leather,,,,,,,0,,2742864,,,0
HS,2019,201912,December 2019,2,0,2,Exports,348,Hungary,,0,World,,,,,,,,,43,Furskins and artificial fur; manufactures thereof,,,,,,,0,,71971,,,0
HS,2019,201912,December 2019,2,0,2,Exports,348,Hungary,,0,World,,,,,,,,,57,Carpets and other textile floor coverings,,,,,,,0,,1883710,,,0
HS,2019,201912,December 2019,2,0,2,Exports,348,Hungary,,0,World,,,,,,,,,55,Man-made staple fibres,,,,,,,0,,2471608,,,0
HS,2019,201912,December 2019,2,0,2,Exports,348,Hungary,,0,World,,,,,,,,,51,"Wool, fine or coarse animal hair; horsehair yarn and woven fabric",,,,,,,0,,755393,,,0
HS,2019,201912,December 2019,2,0,2,Exports,348,Hungary,,0,World,,,,,,,,,48,"Paper and paperboard; articles of paper pulp, of paper or paperboard",,,,,,,0,,69035830,,,0
HS,2019,201912,December 2019,2,0,2,Exports,348,Hungary,,0,World,,,,,,,,,53,Vegetable textile fibres; paper yarn and woven fabrics of paper yarn,,,,,,,0,,499978,,,0
HS,2019,201912,December 2019,2,0,2,Exports,348,Hungary,,0,World,,,,,,,,,72,Iron and steel,,,,,,,0,,85968480,,,0
HS,2019,201912,December 2019,2,0,2,Exports,348,Hungary,,0,World,,,,,,,,,70,Glass and glassware,,,,,,,0,,50059170,,,0
HS,2019,201912,December 2019,2,0,2,Exports,348,Hungary,,0,World,,,,,,,,,64,Footwear; gaiters and the like; parts of such articles,,,,,,,0,,41138731,,,0
HS,2019,201912,December 2019,2,0,2,Exports,348,Hungary,,0,World,,,,,,,,,65,Headgear and parts thereof,,,,,,,0,,655073,,,0
HS,2019,201912,December 2019,2,0,2,Exports,348,Hungary,,0,World,,,,,,,,,67,"Feathers and down, prepared; and articles made of feather or of down; artificial flowers; articles of human hair",,,,,,,0,,123951,,,0
HS,2019,201912,December 2019,2,0,2,Exports,348,Hungary,,0,World,,,,,,,,,62,Apparel and clothing accessories; not knitted or crocheted,,,,,,,,,21664432,,,0
HS,2019,201912,December 2019,2,0,2,Exports,348,Hungary,,0,World,,,,,,,,,63,"Textiles, made up articles; sets; worn clothing and worn textile articles; rags",,,,,,,0,,14096979,,,0
HS,2019,201912,December 2019,2,0,2,Exports,348,Hungary,,0,World,,,,,,,,,59,"Textile fabrics; impregnated, coated, covered or laminated; textile articles of a kind suitable for industrial use",,,,,,,0,,11615930,,,0
HS,2019,201912,December 2019,2,0,2,Exports,348,Hungary,,0,World,,,,,,,,,60,Fabrics; knitted or crocheted,,,,,,,0,,2224834,,,0
HS,2019,201912,December 2019,2,0,2,Exports,348,Hungary,,0,World,,,,,,,,,61,Apparel and clothing accessories; knitted or crocheted,,,,,,,0,,31564217,,,0
HS,2019,201910,October 2019,2,0,2,Exports,348,Hungary,,0,World,,,,,,,,,97,Works of art; collectors' pieces and antiques,,,,,,,0,,96825,,,0
HS,2019,201910,October 2019,2,0,2,Exports,348,Hungary,,0,World,,,,,,,,,01,Animals; live,,,,,,,0,,41154647,,,0
HS,2019,201910,October 2019,2,0,2,Exports,348,Hungary,,0,World,,,,,,,,,89,"Ships, boats and floating structures",,,,,,,0,,403650,,,0
HS,2019,201910,October 2019,2,0,2,Exports,348,Hungary,,0,World,,,,,,,,,93,Arms and ammunition; parts and accessories thereof,,,,,,,0,,4668908,,,0
HS,2019,201910,October 2019,2,0,2,Exports,348,Hungary,,0,World,,,,,,,,,80,Tin; articles thereof,,,,,,,0,,1608502,,,0
HS,2019,201910,October 2019,2,0,2,Exports,348,Hungary,,0,World,,,,,,,,,78,Lead and articles thereof,,,,,,,0,,753691,,,0
HS,2019,201910,October 2019,2,0,2,Exports,348,Hungary,,0,World,,,,,,,,,99,Commodities not specified according to kind,,,,,,,0,,29407924,,,0
HS,2019,201910,October 2019,2,0,2,Exports,348,Hungary,,0,World,,,,,,,,,03,"Fish and crustaceans, molluscs and other aquatic invertebrates",,,,,,,0,,1519774,,,0
HS,2019,201910,October 2019,2,0,2,Exports,348,Hungary,,0,World,,,,,,,,,04,"Dairy produce; birds' eggs; natural honey; edible products of animal origin, not elsewhere specified or included",,,,,,,0,,51009447,,,0
HS,2019,201910,October 2019,2,0,2,Exports,348,Hungary,,0,World,,,,,,,,,02,Meat and edible meat offal,,,,,,,0,,125273562,,,0
HS,2019,201910,October 2019,2,0,2,Exports,348,Hungary,,0,World,,,,,,,,,16,"Meat, fish or crustaceans, molluscs or other aquatic invertebrates; preparations thereof",,,,,,,0,,36904280,,,0
HS,2019,201910,October 2019,2,0,2,Exports,348,Hungary,,0,World,,,,,,,,,11,"Products of the milling industry; malt, starches, inulin, wheat gluten",,,,,,,0,,13032856,,,0
HS,2019,201910,October 2019,2,0,2,Exports,348,Hungary,,0,World,,,,,,,,,14,Vegetable plaiting materials; vegetable products not elsewhere specified or included,,,,,,,0,,440485,,,0
HS,2019,201910,October 2019,2,0,2,Exports,348,Hungary,,0,World,,,,,,,,,26,"Ores, slag and ash",,,,,,,0,,1425711,,,0
HS,2019,201910,October 2019,2,0,2,Exports,348,Hungary,,0,World,,,,,,,,,22,"Beverages, spirits and vinegar",,,,,,,0,,68095123,,,0
HS,2019,201910,October 2019,2,0,2,Exports,348,Hungary,,0,World,,,,,,,,,23,"Food industries, residues and wastes thereof; prepared animal fodder",,,,,,,0,,98284218,,,0
HS,2019,201910,October 2019,2,0,2,Exports,348,Hungary,,0,World,,,,,,,,,31,Fertilizers,,,,,,,0,,10593478,,,0
HS,2019,201910,October 2019,2,0,2,Exports,348,Hungary,,0,World,,,,,,,,,37,Photographic or cinematographic goods,,,,,,,0,,5430722,,,0
HS,2019,201910,October 2019,2,0,2,Exports,348,Hungary,,0,World,,,,,,,,,36,Explosives; pyrotechnic products; matches; pyrophoric alloys; certain combustible preparations,,,,,,,0,,1599052,,,0
HS,2019,201910,October 2019,2,0,2,Exports,348,Hungary,,0,World,,,,,,,,,41,Raw hides and skins (other than furskins) and leather,,,,,,,0,,3632248,,,0
HS,2019,201910,October 2019,2,0,2,Exports,348,Hungary,,0,World,,,,,,,,,47,Pulp of wood or other fibrous cellulosic material; waste and scrap of paper or paperboard,,,,,,,0,,5966055,,,0
HS,2019,201910,October 2019,2,0,2,Exports,348,Hungary,,0,World,,,,,,,,,57,Carpets and other textile floor coverings,,,,,,,0,,2291177,,,0
HS,2019,201911,November 2019,2,0,2,Exports,348,Hungary,,0,World,,,,,,,,,22,"Beverages, spirits and vinegar",,,,,,,0,,70307794,,,0
HS,2019,201911,November 2019,2,0,2,Exports,348,Hungary,,0,World,,,,,,,,,23,"Food industries, residues and wastes thereof; prepared animal fodder",,,,,,,0,,92486932,,,0
HS,2019,201911,November 2019,2,0,2,Exports,348,Hungary,,0,World,,,,,,,,,13,"Lac; gums, resins and other vegetable saps and extracts",,,,,,,0,,229907,,,0
HS,2019,201911,November 2019,2,0,2,Exports,348,Hungary,,0,World,,,,,,,,,26,"Ores, slag and ash",,,,,,,0,,736739,,,0
HS,2019,201911,November 2019,2,0,2,Exports,348,Hungary,,0,World,,,,,,,,,99,Commodities not specified according to kind,,,,,,,0,,26758756,,,0
HS,2019,201911,November 2019,2,0,2,Exports,348,Hungary,,0,World,,,,,,,,,46,"Manufactures of straw, esparto or other plaiting materials; basketware and wickerwork",,,,,,,0,,151928,,,0
HS,2019,201911,November 2019,2,0,2,Exports,348,Hungary,,0,World,,,,,,,,,06,"Trees and other plants, live; bulbs, roots and the like; cut flowers and ornamental foliage",,,,,,,0,,6480196,,,0
HS,2019,201911,November 2019,2,0,2,Exports,348,Hungary,,0,World,,,,,,,,,14,Vegetable plaiting materials; vegetable products not elsewhere specified or included,,,,,,,0,,442240,,,0
HS,2019,201911,November 2019,2,0,2,Exports,348,Hungary,,0,World,,,,,,,,,31,Fertilizers,,,,,,,0,,12942373,,,0
HS,2019,201911,November 2019,2,0,2,Exports,348,Hungary,,0,World,,,,,,,,,02,Meat and edible meat offal,,,,,,,0,,114368258,,,0
HS,2019,201911,November 2019,2,0,2,Exports,348,Hungary,,0,World,,,,,,,,,47,Pulp of wood or other fibrous cellulosic material; waste and scrap of paper or paperboard,,,,,,,0,,6517621,,,0
HS,2019,201905,May 2019,2,0,2,Exports,348,Hungary,,0,World,,,,,,,,,49,"Printed books, newspapers, pictures and other products of the printing industry; manuscripts, typescripts and plans",,,,,,,0,,17276649,,,0
HS,2019,201905,May 2019,2,0,2,Exports,348,Hungary,,0,World,,,,,,,,,42,"Articles of leather; saddlery and harness; travel goods, handbags and similar containers; articles of animal gut (other than silk-worm gut)",,,,,,,0,,44350135,,,0
HS,2019,201905,May 2019,2,0,2,Exports,348,Hungary,,0,World,,,,,,,,,44,Wood and articles of wood; wood charcoal,,,,,,,0,,69661413,,,0
HS,2019,201905,May 2019,2,0,2,Exports,348,Hungary,,0,World,,,,,,,,,40,Rubber and articles thereof,,,,,,,0,,224000247,,,0
HS,2019,201905,May 2019,2,0,2,Exports,348,Hungary,,0,World,,,,,,,,,32,"Tanning or dyeing extracts; tannins and their derivatives; dyes, pigments and other colouring matter; paints, varnishes; putty, other mastics; inks",,,,,,,0,,19395979,,,0
HS,2019,201905,May 2019,2,0,2,Exports,348,Hungary,,0,World,,,,,,,,,28,"Inorganic chemicals; organic and inorganic compounds of precious metals; of rare earth metals, of radio-active elements and of isotopes",,,,,,,0,,48129383,,,0
HS,2019,201905,May 2019,2,0,2,Exports,348,Hungary,,0,World,,,,,,,,,35,Albuminoidal substances; modified starches; glues; enzymes,,,,,,,0,,8648010,,,0
HS,2019,201905,May 2019,2,0,2,Exports,348,Hungary,,0,World,,,,,,,,,06,"Trees and other plants, live; bulbs, roots and the like; cut flowers and ornamental foliage",,,,,,,0,,5896242,,,0
HS,2019,201905,May 2019,2,0,2,Exports,348,Hungary,,0,World,,,,,,,,,95,"Toys, games and sports requisites; parts and accessories thereof",,,,,,,0,,51769731,,,0
HS,2019,201905,May 2019,2,0,2,Exports,348,Hungary,,0,World,,,,,,,,,08,"Fruit and nuts, edible; peel of citrus fruit or melons",,,,,,,0,,8304125,,,0
HS,2019,201905,May 2019,2,0,2,Exports,348,Hungary,,0,World,,,,,,,,,18,Cocoa and cocoa preparations,,,,,,,0,,16305073,,,0
HS,2019,201905,May 2019,2,0,2,Exports,348,Hungary,,0,World,,,,,,,,,46,"Manufactures of straw, esparto or other plaiting materials; basketware and wickerwork",,,,,,,0,,218676,,,0
HS,2019,201905,May 2019,2,0,2,Exports,348,Hungary,,0,World,,,,,,,,,45,Cork and articles of cork,,,,,,,0,,219475,,,0
HS,2019,201905,May 2019,2,0,2,Exports,348,Hungary,,0,World,,,,,,,,,87,"Vehicles; other than railway or tramway rolling stock, and parts and accessories thereof",,,,,,,0,,1957397868,,,0
HS,2019,201905,May 2019,2,0,2,Exports,348,Hungary,,0,World,,,,,,,,,38,Chemical products n.e.s.,,,,,,,0,,63503914,,,0
HS,2019,201905,May 2019,2,0,2,Exports,348,Hungary,,0,World,,,,,,,,,34,"Soap, organic surface-active agents; washing, lubricating, polishing or scouring preparations; artificial or prepared waxes, candles and similar articles, modelling pastes, ""dental waxes"" and dental preparations with a basis of plaster",,,,,,,0,,54112381,,,0
HS,2019,201905,May 2019,2,0,2,Exports,348,Hungary,,0,World,,,,,,,,,33,"Essential oils and resinoids; perfumery, cosmetic or toilet preparations",,,,,,,0,,68154244,,,0
HS,2019,201905,May 2019,2,0,2,Exports,348,Hungary,,0,World,,,,,,,,,04,"Dairy produce; birds' eggs; natural honey; edible products of animal origin, not elsewhere specified or included",,,,,,,0,,42202640,,,0
