Classification,Year,Period,Period Desc.,Aggregate Level,Is Leaf Code,Trade Flow Code,Trade Flow,Reporter Code,Reporter,Reporter ISO,Partner Code,Partner,Partner ISO,2nd Partner Code,2nd Partner,2nd Partner ISO,Customs Proc. Code,Customs,Mode of Transport Code,Mode of Transport,Commodity Code,Commodity,Qty Unit Code,Qty Unit,Qty,Alt Qty Unit Code,Alt Qty Unit,Alt Qty,Netweight (kg),Gross weight (kg),Trade Value (US$),CIF Trade Value (US$),FOB Trade Value (US$),Flag
HS,2019,201901,January 2019,2,0,2,Exports,616,Poland,,0,World,,,,,,,,,84,"Nuclear reactors, boilers, machinery and mechanical appliances; parts thereof",,,,,,,0,,2876664204,,,0
HS,2019,201901,January 2019,2,0,2,Exports,616,Poland,,0,World,,,,,,,,,83,Metal; miscellaneous products of base metal,,,,,,,0,,186965663,,,0
HS,2019,201901,January 2019,2,0,2,Exports,616,Poland,,0,World,,,,,,,,,80,Tin; articles thereof,,,,,,,0,,10068408,,,0
HS,2019,201901,January 2019,2,0,2,Exports,616,Poland,,0,World,,,,,,,,,75,Nickel and articles thereof,,,,,,,0,,2396778,,,0
HS,2019,201901,January 2019,2,0,2,Exports,616,Poland,,0,World,,,,,,,,,74,Copper and articles thereof,,,,,,,0,,301788973,,,0
HS,2019,201901,January 2019,2,0,2,Exports,616,Poland,,0,World,,,,,,,,,92,Musical instruments; parts and accessories of such articles,,,,,,,0,,3177204,,,0
HS,2019,201901,January 2019,2,0,2,Exports,616,Poland,,0,World,,,,,,,,,91,Clocks and watches and parts thereof,,,,,,,0,,8800977,,,0
HS,2019,201901,January 2019,2,0,2,Exports,616,Poland,,0,World,,,,,,,,,90,"Optical, photographic, cinematographic, measuring, checking, medical or surgical instruments and apparatus; parts and accessories",,,,,,,0,,398829846,,,0
HS,2019,201901,January 2019,2,0,2,Exports,616,Poland,,0,World,,,,,,,,,89,"Ships, boats and floating structures",,,,,,,0,,198288959,,,0
HS,2019,201901,January 2019,2,0,2,Exports,616,Poland,,0,World,,,,,,,,,85,"Electrical machinery and equipment and parts thereof; sound recorders and reproducers; television image and sound recorders and reproducers, parts and accessories of such articles",,,,,,,0,,2235548529,,,0
HS,2019,201901,January 2019,2,0,2,Exports,616,Poland,,0,World,,,,,,,,,99,Commodities not specified according to kind,,,,,,,0,,29715288,,,0
HS,2019,201901,January 2019,2,0,2,Exports,616,Poland,,0,World,,,,,,,,,11,"Products of the milling industry; malt, starches, inulin, wheat gluten",,,,,,,0,,34046245,,,0
HS,2019,201901,January 2019,2,0,2,Exports,616,Poland,,0,World,,,,,,,,,12,"Oil seeds and oleaginous fruits; miscellaneous grains, seeds and fruit, industrial or medicinal plants; straw and fodder",,,,,,,0,,40132904,,,0
HS,2019,201901,January 2019,2,0,2,Exports,616,Poland,,0,World,,,,,,,,,96,Miscellaneous manufactured articles,,,,,,,0,,131693593,,,0
HS,2019,201901,January 2019,2,0,2,Exports,616,Poland,,0,World,,,,,,,,,94,"Furniture; bedding, mattresses, mattress supports, cushions and similar stuffed furnishings; lamps and lighting fittings, n.e.s.; illuminated signs, illuminated name-plates and the like; prefabricated buildings",,,,,,,0,,1272472868,,,0
HS,2019,201901,January 2019,2,0,2,Exports,616,Poland,,0,World,,,,,,,,,93,Arms and ammunition; parts and accessories thereof,,,,,,,0,,1087976,,,0
HS,2019,201901,January 2019,2,0,2,Exports,616,Poland,,0,World,,,,,,,,,20,"Preparations of vegetables, fruit, nuts or other parts of plants",,,,,,,0,,129130380,,,0
HS,2019,201901,January 2019,2,0,2,Exports,616,Poland,,0,World,,,,,,,,,19,"Preparations of cereals, flour, starch or milk; pastrycooks' products",,,,,,,0,,201850615,,,0
HS,2019,201901,January 2019,2,0,2,Exports,616,Poland,,0,World,,,,,,,,,16,"Meat, fish or crustaceans, molluscs or other aquatic invertebrates; preparations thereof",,,,,,,0,,172190132,,,0
HS,2019,201901,January 2019,2,0,2,Exports,616,Poland,,0,World,,,,,,,,,14,Vegetable plaiting materials; vegetable products not elsewhere specified or included,,,,,,,0,,104596,,,0
HS,2019,201901,January 2019,2,0,2,Exports,616,Poland,,0,World,,,,,,,,,72,Iron and steel,,,,,,,0,,431224712,,,0
HS,2019,201901,January 2019,2,0,2,Exports,616,Poland,,0,World,,,,,,,,,70,Glass and glassware,,,,,,,0,,195865412,,,0
HS,2019,201901,January 2019,2,0,2,Exports,616,Poland,,0,World,,,,,,,,,67,"Feathers and down, prepared; and articles made of feather or of down; artificial flowers; articles of human hair",,,,,,,0,,1369242,,,0
HS,2019,201901,January 2019,2,0,2,Exports,616,Poland,,0,World,,,,,,,,,64,Footwear; gaiters and the like; parts of such articles,,,,,,,0,,172265336,,,0
HS,2019,201901,January 2019,2,0,2,Exports,616,Poland,,0,World,,,,,,,,,65,Headgear and parts thereof,,,,,,,0,,13869862,,,0
HS,2019,201901,January 2019,2,0,2,Exports,616,Poland,,0,World,,,,,,,,,63,"Textiles, made up articles; sets; worn clothing and worn textile articles; rags",,,,,,,0,,105058404,,,0
HS,2019,201901,January 2019,2,0,2,Exports,616,Poland,,0,World,,,,,,,,,62,Apparel and clothing accessories; not knitted or crocheted,,,,,,,0,,271229961,,,0
HS,2019,201901,January 2019,2,0,2,Exports,616,Poland,,0,World,,,,,,,,,60,Fabrics; knitted or crocheted,,,,,,,0,,5656315,,,0
HS,2019,201901,January 2019,2,0,2,Exports,616,Poland,,0,World,,,,,,,,,59,"Textile fabrics; impregnated, coated, covered or laminated; textile articles of a kind suitable for industrial use",,,,,,,0,,37956222,,,0
HS,2019,201901,January 2019,2,0,2,Exports,616,Poland,,0,World,,,,,,,,,57,Carpets and other textile floor coverings,,,,,,,0,,26237020,,,0
HS,2019,201901,January 2019,2,0,2,Exports,616,Poland,,0,World,,,,,,,,,55,Man-made staple fibres,,,,,,,0,,9512684,,,0
HS,2019,201901,January 2019,2,0,2,Exports,616,Poland,,0,World,,,,,,,,,53,Vegetable textile fibres; paper yarn and woven fabrics of paper yarn,,,,,,,0,,3558305,,,0
HS,2019,201901,January 2019,2,0,2,Exports,616,Poland,,0,World,,,,,,,,,51,"Wool, fine or coarse animal hair; horsehair yarn and woven fabric",,,,,,,0,,15684428,,,0
HS,2019,201901,January 2019,2,0,2,Exports,616,Poland,,0,World,,,,,,,,,48,"Paper and paperboard; articles of paper pulp, of paper or paperboard",,,,,,,0,,457187024,,,0
HS,2019,201901,January 2019,2,0,2,Exports,616,Poland,,0,World,,,,,,,,,41,Raw hides and skins (other than furskins) and leather,,,,,,,0,,22638208,,,0
HS,2019,201901,January 2019,2,0,2,Exports,616,Poland,,0,World,,,,,,,,,03,"Fish and crustaceans, molluscs and other aquatic invertebrates",,,,,,,0,,151258594,,,0
HS,2019,201901,January 2019,2,0,2,Exports,616,Poland,,0,World,,,,,,,,,01,Animals; live,,,,,,,0,,13176052,,,0
HS,2019,201901,January 2019,2,0,2,Exports,616,Poland,,0,World,,,,,,,,,25,"Salt; sulphur; earths, stone; plastering materials, lime and cement",,,,,,,0,,20473978,,,0
HS,2019,201901,January 2019,2,0,2,Exports,616,Poland,,0,World,,,,,,,,,15,Animal or vegetable fats and oils and their cleavage products; prepared animal fats; animal or vegetable waxes,,,,,,,0,,41193679,,,0
HS,2019,201901,January 2019,2,0,2,Exports,616,Poland,,0,World,,,,,,,,,17,Sugars and sugar confectionery,,,,,,,0,,67428596,,,0
HS,2019,201901,January 2019,2,0,2,Exports,616,Poland,,0,World,,,,,,,,,05,Animal originated products; not elsewhere specified or included,,,,,,,0,,32826785,,,0
HS,2019,201901,January 2019,2,0,2,Exports,616,Poland,,0,World,,,,,,,,,07,Vegetables and certain roots and tubers; edible,,,,,,,0,,119442050,,,0
HS,2019,201901,January 2019,2,0,2,Exports,616,Poland,,0,World,,,,,,,,,97,Works of art; collectors' pieces and antiques,,,,,,,0,,850757,,,0
HS,2019,201901,January 2019,2,0,2,Exports,616,Poland,,0,World,,,,,,,,,39,Plastics and articles thereof,,,,,,,0,,984144986,,,0
HS,2019,201901,January 2019,2,0,2,Exports,616,Poland,,0,World,,,,,,,,,29,Organic chemicals,,,,,,,0,,128688900,,,0
HS,2019,201901,January 2019,2,0,2,Exports,616,Poland,,0,World,,,,,,,,,10,Cereals,,,,,,,0,,52224239,,,0
HS,2019,201901,January 2019,2,0,2,Exports,616,Poland,,0,World,,,,,,,,,88,"Aircraft, spacecraft and parts thereof",,,,,,,0,,70002070,,,0
HS,2019,201901,January 2019,2,0,2,Exports,616,Poland,,0,World,,,,,,,,,36,Explosives; pyrotechnic products; matches; pyrophoric alloys; certain combustible preparations,,,,,,,0,,2988908,,,0
HS,2019,201901,January 2019,2,0,2,Exports,616,Poland,,0,World,,,,,,,,,38,Chemical products n.e.s.,,,,,,,0,,172116732,,,0
HS,2019,201901,January 2019,2,0,2,Exports,616,Poland,,0,World,,,,,,,,,13,"Lac; gums, resins and other vegetable saps and extracts",,,,,,,0,,2451588,,,0
HS,2019,201901,January 2019,2,0,2,Exports,616,Poland,,0,World,,,,,,,,,04,"Dairy produce; birds' eggs; natural honey; edible products of animal origin, not elsewhere specified or included",,,,,,,0,,235079361,,,0
HS,2019,201901,January 2019,2,0,2,Exports,616,Poland,,0,World,,,,,,,,,02,Meat and edible meat offal,,,,,,,0,,489177404,,,0
HS,2019,201901,January 2019,2,0,2,Exports,616,Poland,,0,World,,,,,,,,,34,"Soap, organic surface-active agents; washing, lubricating, polishing or scouring preparations; artificial or prepared waxes, candles and similar articles, modelling pastes, ""dental waxes"" and dental preparations with a basis of plaster",,,,,,,0,,202717386,,,0
HS,2019,201901,January 2019,2,0,2,Exports,616,Poland,,0,World,,,,,,,,,33,"Essential oils and resinoids; perfumery, cosmetic or toilet preparations",,,,,,,0,,323571387,,,0
HS,2019,201901,January 2019,2,0,2,Exports,616,Poland,,0,World,,,,,,,,,26,"Ores, slag and ash",,,,,,,0,,5421231,,,0
HS,2019,201901,January 2019,2,0,2,Exports,616,Poland,,0,World,,,,,,,,,22,"Beverages, spirits and vinegar",,,,,,,0,,66583963,,,0
HS,2019,201901,January 2019,2,0,2,Exports,616,Poland,,0,World,,,,,,,,,23,"Food industries, residues and wastes thereof; prepared animal fodder",,,,,,,0,,138127574,,,0
HS,2019,201901,January 2019,2,0,2,Exports,616,Poland,,0,World,,,,,,,,,95,"Toys, games and sports requisites; parts and accessories thereof",,,,,,,0,,175458652,,,0
HS,2019,201901,January 2019,2,0,2,Exports,616,Poland,,0,World,,,,,,,,,06,"Trees and other plants, live; bulbs, roots and the like; cut flowers and ornamental foliage",,,,,,,0,,13930460,,,0
HS,2019,201901,January 2019,2,0,2,Exports,616,Poland,,0,World,,,,,,,,,45,Cork and articles of cork,,,,,,,0,,683268,,,0
HS,2019,201901,January 2019,2,0,2,Exports,616,Poland,,0,World,,,,,,,,,46,"Manufactures of straw, esparto or other plaiting materials; basketware and wickerwork",,,,,,,0,,3544263,,,0
HS,2019,201901,January 2019,2,0,2,Exports,616,Poland,,0,World,,,,,,,,,87,"Vehicles; other than railway or tramway rolling stock, and parts and accessories thereof",,,,,,,0,,2401330232,,,0
HS,2019,201901,January 2019,2,0,2,Exports,616,Poland,,0,World,,,,,,,,,31,Fertilizers,,,,,,,0,,66862417,,,0
HS,2019,201901,January 2019,2,0,2,Exports,616,Poland,,0,World,,,,,,,,,28,"Inorganic chemicals; organic and inorganic compounds of precious metals; of rare earth metals, of radio-active elements and of isotopes",,,,,,,0,,91115200,,,0
HS,2019,201901,January 2019,2,0,2,Exports,616,Poland,,0,World,,,,,,,,,18,Cocoa and cocoa preparations,,,,,,,0,,166814072,,,0
HS,2019,201901,January 2019,2,0,2,Exports,616,Poland,,0,World,,,,,,,,,27,"Mineral fuels, mineral oils and products of their distillation; bituminous substances; mineral waxes",,,,,,,0,,552313544,,,0
HS,2019,201901,January 2019,2,0,2,Exports,616,Poland,,0,World,,,,,,,,,08,"Fruit and nuts, edible; peel of citrus fruit or melons",,,,,,,0,,101167586,,,0
HS,2019,201901,January 2019,2,0,2,Exports,616,Poland,,0,World,,,,,,,,,54,Man-made filaments,,,,,,,0,,23800420,,,0
HS,2019,201901,January 2019,2,0,2,Exports,616,Poland,,0,World,,,,,,,,,50,Silk,,,,,,,0,,597,,,0
HS,2019,201901,January 2019,2,0,2,Exports,616,Poland,,0,World,,,,,,,,,49,"Printed books, newspapers, pictures and other products of the printing industry; manuscripts, typescripts and plans",,,,,,,0,,178968022,,,0
HS,2019,201901,January 2019,2,0,2,Exports,616,Poland,,0,World,,,,,,,,,47,Pulp of wood or other fibrous cellulosic material; waste and scrap of paper or paperboard,,,,,,,0,,26857643,,,0
HS,2019,201901,January 2019,2,0,2,Exports,616,Poland,,0,World,,,,,,,,,44,Wood and articles of wood; wood charcoal,,,,,,,0,,296888406,,,0
HS,2019,201901,January 2019,2,0,2,Exports,616,Poland,,0,World,,,,,,,,,42,"Articles of leather; saddlery and harness; travel goods, handbags and similar containers; articles of animal gut (other than silk-worm gut)",,,,,,,0,,52463803,,,0
HS,2019,201901,January 2019,2,0,2,Exports,616,Poland,,0,World,,,,,,,,,40,Rubber and articles thereof,,,,,,,0,,450003713,,,0
HS,2019,201901,January 2019,2,0,2,Exports,616,Poland,,0,World,,,,,,,,,37,Photographic or cinematographic goods,,,,,,,0,,2064072,,,0
HS,2019,201901,January 2019,2,0,2,Exports,616,Poland,,0,World,,,,,,,,,35,Albuminoidal substances; modified starches; glues; enzymes,,,,,,,0,,22918936,,,0
HS,2019,201901,January 2019,2,0,2,Exports,616,Poland,,0,World,,,,,,,,,32,"Tanning or dyeing extracts; tannins and their derivatives; dyes, pigments and other colouring matter; paints, varnishes; putty, other mastics; inks",,,,,,,0,,86982720,,,0
HS,2019,201901,January 2019,2,0,2,Exports,616,Poland,,0,World,,,,,,,,,24,Tobacco and manufactured tobacco substitutes,,,,,,,0,,313561824,,,0
HS,2019,201901,January 2019,2,0,2,Exports,616,Poland,,0,World,,,,,,,,,30,Pharmaceutical products,,,,,,,0,,305006551,,,0
HS,2019,201901,January 2019,2,0,2,Exports,616,Poland,,0,World,,,,,,,,,09,"Coffee, tea, mate and spices",,,,,,,0,,52528921,,,0
HS,2019,201901,January 2019,2,0,2,Exports,616,Poland,,0,World,,,,,,,,,21,Miscellaneous edible preparations,,,,,,,0,,192667914,,,0
HS,2019,201901,January 2019,2,0,2,Exports,616,Poland,,0,World,,,,,,,,,86,"Railway, tramway locomotives, rolling-stock and parts thereof; railway or tramway track fixtures and fittings and parts thereof; mechanical (including electro-mechanical) traffic signalling equipment of all kinds",,,,,,,0,,123738831,,,0
HS,2019,201901,January 2019,2,0,2,Exports,616,Poland,,0,World,,,,,,,,,58,"Fabrics; special woven fabrics, tufted textile fabrics, lace, tapestries, trimmings, embroidery",,,,,,,0,,4329749,,,0
HS,2019,201901,January 2019,2,0,2,Exports,616,Poland,,0,World,,,,,,,,,66,"Umbrellas, sun umbrellas, walking-sticks, seat sticks, whips, riding crops; and parts thereof",,,,,,,0,,2236264,,,0
HS,2019,201901,January 2019,2,0,2,Exports,616,Poland,,0,World,,,,,,,,,52,Cotton,,,,,,,0,,4206428,,,0
HS,2019,201901,January 2019,2,0,2,Exports,616,Poland,,0,World,,,,,,,,,82,"Tools, implements, cutlery, spoons and forks, of base metal; parts thereof, of base metal",,,,,,,0,,135083165,,,0
HS,2019,201901,January 2019,2,0,2,Exports,616,Poland,,0,World,,,,,,,,,81,"Metals; n.e.s., cermets and articles thereof",,,,,,,0,,3774840,,,0
HS,2019,201901,January 2019,2,0,2,Exports,616,Poland,,0,World,,,,,,,,,79,Zinc and articles thereof,,,,,,,0,,24432960,,,0
HS,2019,201901,January 2019,2,0,2,Exports,616,Poland,,0,World,,,,,,,,,76,Aluminium and articles thereof,,,,,,,0,,323178511,,,0
HS,2019,201901,January 2019,2,0,2,Exports,616,Poland,,0,World,,,,,,,,,73,Iron or steel articles,,,,,,,0,,682413626,,,0
HS,2019,201901,January 2019,2,0,2,Exports,616,Poland,,0,World,,,,,,,,,71,"Natural, cultured pearls; precious, semi-precious stones; precious metals, metals clad with precious metal, and articles thereof; imitation jewellery; coin",,,,,,,0,,91140915,,,0
HS,2019,201901,January 2019,2,0,2,Exports,616,Poland,,0,World,,,,,,,,,69,Ceramic products,,,,,,,0,,93503197,,,0
HS,2019,201901,January 2019,2,0,2,Exports,616,Poland,,0,World,,,,,,,,,68,"Stone, plaster, cement, asbestos, mica or similar materials; articles thereof",,,,,,,0,,122984877,,,0
HS,2019,201901,January 2019,2,0,2,Exports,616,Poland,,0,World,,,,,,,,,56,"Wadding, felt and nonwovens, special yarns; twine, cordage, ropes and cables and articles thereof",,,,,,,0,,38838366,,,0
HS,2019,201901,January 2019,2,0,2,Exports,616,Poland,,0,World,,,,,,,,,78,Lead and articles thereof,,,,,,,,,15187549,,,0
HS,2019,201901,January 2019,2,0,2,Exports,616,Poland,,0,World,,,,,,,,,43,Furskins and artificial fur; manufactures thereof,,,,,,,,,32552861,,,0
HS,2019,201901,January 2019,2,0,2,Exports,616,Poland,,0,World,,,,,,,,,61,Apparel and clothing accessories; knitted or crocheted,,,,,,,,,246734686,,,0
HS,2019,201908,August 2019,2,0,2,Exports,616,Poland,,0,World,,,,,,,,,68,"Stone, plaster, cement, asbestos, mica or similar materials; articles thereof",,,,,,,0,,127923529,,,0
HS,2019,201908,August 2019,2,0,2,Exports,616,Poland,,0,World,,,,,,,,,56,"Wadding, felt and nonwovens, special yarns; twine, cordage, ropes and cables and articles thereof",,,,,,,0,,36327832,,,0
HS,2019,201908,August 2019,2,0,2,Exports,616,Poland,,0,World,,,,,,,,,69,Ceramic products,,,,,,,0,,79054579,,,0
HS,2019,201908,August 2019,2,0,2,Exports,616,Poland,,0,World,,,,,,,,,58,"Fabrics; special woven fabrics, tufted textile fabrics, lace, tapestries, trimmings, embroidery",,,,,,,0,,4633283,,,0
HS,2019,201908,August 2019,2,0,2,Exports,616,Poland,,0,World,,,,,,,,,52,Cotton,,,,,,,0,,3565693,,,0
HS,2019,201908,August 2019,2,0,2,Exports,616,Poland,,0,World,,,,,,,,,66,"Umbrellas, sun umbrellas, walking-sticks, seat sticks, whips, riding crops; and parts thereof",,,,,,,0,,1949320,,,0
HS,2019,201908,August 2019,2,0,2,Exports,616,Poland,,0,World,,,,,,,,,30,Pharmaceutical products,,,,,,,0,,305632960,,,0
HS,2019,201908,August 2019,2,0,2,Exports,616,Poland,,0,World,,,,,,,,,24,Tobacco and manufactured tobacco substitutes,,,,,,,0,,339698073,,,0
HS,2019,201908,August 2019,2,0,2,Exports,616,Poland,,0,World,,,,,,,,,21,Miscellaneous edible preparations,,,,,,,0,,185061617,,,0
HS,2019,201908,August 2019,2,0,2,Exports,616,Poland,,0,World,,,,,,,,,86,"Railway, tramway locomotives, rolling-stock and parts thereof; railway or tramway track fixtures and fittings and parts thereof; mechanical (including electro-mechanical) traffic signalling equipment of all kinds",,,,,,,0,,143134087,,,0
HS,2019,201908,August 2019,2,0,2,Exports,616,Poland,,0,World,,,,,,,,,09,"Coffee, tea, mate and spices",,,,,,,0,,50538323,,,0
HS,2019,201908,August 2019,2,0,2,Exports,616,Poland,,0,World,,,,,,,,,26,"Ores, slag and ash",,,,,,,0,,5909120,,,0
HS,2019,201908,August 2019,2,0,2,Exports,616,Poland,,0,World,,,,,,,,,23,"Food industries, residues and wastes thereof; prepared animal fodder",,,,,,,0,,133403668,,,0
HS,2019,201908,August 2019,2,0,2,Exports,616,Poland,,0,World,,,,,,,,,22,"Beverages, spirits and vinegar",,,,,,,0,,80224667,,,0
HS,2019,201908,August 2019,2,0,2,Exports,616,Poland,,0,World,,,,,,,,,34,"Soap, organic surface-active agents; washing, lubricating, polishing or scouring preparations; artificial or prepared waxes, candles and similar articles, modelling pastes, ""dental waxes"" and dental preparations with a basis of plaster",,,,,,,0,,212446725,,,0
HS,2019,201908,August 2019,2,0,2,Exports,616,Poland,,0,World,,,,,,,,,33,"Essential oils and resinoids; perfumery, cosmetic or toilet preparations",,,,,,,0,,314816921,,,0
HS,2019,201908,August 2019,2,0,2,Exports,616,Poland,,0,World,,,,,,,,,13,"Lac; gums, resins and other vegetable saps and extracts",,,,,,,0,,2327448,,,0
HS,2019,201908,August 2019,2,0,2,Exports,616,Poland,,0,World,,,,,,,,,38,Chemical products n.e.s.,,,,,,,0,,172133074,,,0
HS,2019,201908,August 2019,2,0,2,Exports,616,Poland,,0,World,,,,,,,,,36,Explosives; pyrotechnic products; matches; pyrophoric alloys; certain combustible preparations,,,,,,,0,,3556906,,,0
HS,2019,201908,August 2019,2,0,2,Exports,616,Poland,,0,World,,,,,,,,,02,Meat and edible meat offal,,,,,,,0,,466865289,,,0
HS,2019,201908,August 2019,2,0,2,Exports,616,Poland,,0,World,,,,,,,,,04,"Dairy produce; birds' eggs; natural honey; edible products of animal origin, not elsewhere specified or included",,,,,,,0,,232162687,,,0
HS,2019,201908,August 2019,2,0,2,Exports,616,Poland,,0,World,,,,,,,,,25,"Salt; sulphur; earths, stone; plastering materials, lime and cement",,,,,,,0,,23806557,,,0
HS,2019,201908,August 2019,2,0,2,Exports,616,Poland,,0,World,,,,,,,,,15,Animal or vegetable fats and oils and their cleavage products; prepared animal fats; animal or vegetable waxes,,,,,,,0,,40982619,,,0
HS,2019,201908,August 2019,2,0,2,Exports,616,Poland,,0,World,,,,,,,,,05,Animal originated products; not elsewhere specified or included,,,,,,,0,,30875575,,,0
HS,2019,201908,August 2019,2,0,2,Exports,616,Poland,,0,World,,,,,,,,,17,Sugars and sugar confectionery,,,,,,,0,,65077817,,,0
HS,2019,201908,August 2019,2,0,2,Exports,616,Poland,,0,World,,,,,,,,,07,Vegetables and certain roots and tubers; edible,,,,,,,0,,114450073,,,0
HS,2019,201908,August 2019,2,0,2,Exports,616,Poland,,0,World,,,,,,,,,10,Cereals,,,,,,,0,,68596947,,,0
HS,2019,201908,August 2019,2,0,2,Exports,616,Poland,,0,World,,,,,,,,,29,Organic chemicals,,,,,,,0,,113117577,,,0
HS,2019,201908,August 2019,2,0,2,Exports,616,Poland,,0,World,,,,,,,,,39,Plastics and articles thereof,,,,,,,0,,926739257,,,0
HS,2019,201908,August 2019,2,0,2,Exports,616,Poland,,0,World,,,,,,,,,06,"Trees and other plants, live; bulbs, roots and the like; cut flowers and ornamental foliage",,,,,,,0,,14383920,,,0
HS,2019,201908,August 2019,2,0,2,Exports,616,Poland,,0,World,,,,,,,,,95,"Toys, games and sports requisites; parts and accessories thereof",,,,,,,0,,223003483,,,0
HS,2019,201908,August 2019,2,0,2,Exports,616,Poland,,0,World,,,,,,,,,46,"Manufactures of straw, esparto or other plaiting materials; basketware and wickerwork",,,,,,,0,,2838888,,,0
HS,2019,201908,August 2019,2,0,2,Exports,616,Poland,,0,World,,,,,,,,,87,"Vehicles; other than railway or tramway rolling stock, and parts and accessories thereof",,,,,,,0,,1834873859,,,0
HS,2019,201908,August 2019,2,0,2,Exports,616,Poland,,0,World,,,,,,,,,45,Cork and articles of cork,,,,,,,0,,680256,,,0
HS,2019,201908,August 2019,2,0,2,Exports,616,Poland,,0,World,,,,,,,,,08,"Fruit and nuts, edible; peel of citrus fruit or melons",,,,,,,0,,127573777,,,0
HS,2019,201908,August 2019,2,0,2,Exports,616,Poland,,0,World,,,,,,,,,27,"Mineral fuels, mineral oils and products of their distillation; bituminous substances; mineral waxes",,,,,,,0,,441705129,,,0
HS,2019,201908,August 2019,2,0,2,Exports,616,Poland,,0,World,,,,,,,,,18,Cocoa and cocoa preparations,,,,,,,0,,178617938,,,0
HS,2019,201908,August 2019,2,0,2,Exports,616,Poland,,0,World,,,,,,,,,28,"Inorganic chemicals; organic and inorganic compounds of precious metals; of rare earth metals, of radio-active elements and of isotopes",,,,,,,0,,81449977,,,0
HS,2019,201908,August 2019,2,0,2,Exports,616,Poland,,0,World,,,,,,,,,31,Fertilizers,,,,,,,0,,60490893,,,0
HS,2019,201908,August 2019,2,0,2,Exports,616,Poland,,0,World,,,,,,,,,54,Man-made filaments,,,,,,,0,,20764831,,,0
HS,2019,201908,August 2019,2,0,2,Exports,616,Poland,,0,World,,,,,,,,,50,Silk,,,,,,,0,,8613,,,0
HS,2019,201908,August 2019,2,0,2,Exports,616,Poland,,0,World,,,,,,,,,44,Wood and articles of wood; wood charcoal,,,,,,,0,,277475870,,,0
HS,2019,201908,August 2019,2,0,2,Exports,616,Poland,,0,World,,,,,,,,,47,Pulp of wood or other fibrous cellulosic material; waste and scrap of paper or paperboard,,,,,,,0,,21616190,,,0
HS,2019,201908,August 2019,2,0,2,Exports,616,Poland,,0,World,,,,,,,,,49,"Printed books, newspapers, pictures and other products of the printing industry; manuscripts, typescripts and plans",,,,,,,0,,183049879,,,0
HS,2019,201908,August 2019,2,0,2,Exports,616,Poland,,0,World,,,,,,,,,32,"Tanning or dyeing extracts; tannins and their derivatives; dyes, pigments and other colouring matter; paints, varnishes; putty, other mastics; inks",,,,,,,0,,94862663,,,0
HS,2019,201908,August 2019,2,0,2,Exports,616,Poland,,0,World,,,,,,,,,37,Photographic or cinematographic goods,,,,,,,0,,2184093,,,0
HS,2019,201908,August 2019,2,0,2,Exports,616,Poland,,0,World,,,,,,,,,35,Albuminoidal substances; modified starches; glues; enzymes,,,,,,,0,,22310293,,,0
HS,2019,201908,August 2019,2,0,2,Exports,616,Poland,,0,World,,,,,,,,,42,"Articles of leather; saddlery and harness; travel goods, handbags and similar containers; articles of animal gut (other than silk-worm gut)",,,,,,,0,,64288563,,,0
HS,2019,201908,August 2019,2,0,2,Exports,616,Poland,,0,World,,,,,,,,,40,Rubber and articles thereof,,,,,,,0,,404404588,,,0
HS,2019,201908,August 2019,2,0,2,Exports,616,Poland,,0,World,,,,,,,,,57,Carpets and other textile floor coverings,,,,,,,0,,15580199,,,0
HS,2019,201908,August 2019,2,0,2,Exports,616,Poland,,0,World,,,,,,,,,55,Man-made staple fibres,,,,,,,0,,6739557,,,0
HS,2019,201908,August 2019,2,0,2,Exports,616,Poland,,0,World,,,,,,,,,53,Vegetable textile fibres; paper yarn and woven fabrics of paper yarn,,,,,,,0,,1877433,,,0
HS,2019,201908,August 2019,2,0,2,Exports,616,Poland,,0,World,,,,,,,,,51,"Wool, fine or coarse animal hair; horsehair yarn and woven fabric",,,,,,,0,,4167931,,,0
HS,2019,201908,August 2019,2,0,2,Exports,616,Poland,,0,World,,,,,,,,,48,"Paper and paperboard; articles of paper pulp, of paper or paperboard",,,,,,,0,,404620223,,,0
HS,2019,201908,August 2019,2,0,2,Exports,616,Poland,,0,World,,,,,,,,,41,Raw hides and skins (other than furskins) and leather,,,,,,,0,,17139160,,,0
HS,2019,201908,August 2019,2,0,2,Exports,616,Poland,,0,World,,,,,,,,,01,Animals; live,,,,,,,0,,13900902,,,0
HS,2019,201908,August 2019,2,0,2,Exports,616,Poland,,0,World,,,,,,,,,03,"Fish and crustaceans, molluscs and other aquatic invertebrates",,,,,,,0,,137522113,,,0
HS,2019,201908,August 2019,2,0,2,Exports,616,Poland,,0,World,,,,,,,,,67,"Feathers and down, prepared; and articles made of feather or of down; artificial flowers; articles of human hair",,,,,,,0,,2113694,,,0
HS,2019,201908,August 2019,2,0,2,Exports,616,Poland,,0,World,,,,,,,,,65,Headgear and parts thereof,,,,,,,0,,14295645,,,0
HS,2019,201908,August 2019,2,0,2,Exports,616,Poland,,0,World,,,,,,,,,64,Footwear; gaiters and the like; parts of such articles,,,,,,,0,,212349773,,,0
HS,2019,201908,August 2019,2,0,2,Exports,616,Poland,,0,World,,,,,,,,,62,Apparel and clothing accessories; not knitted or crocheted,,,,,,,0,,298848271,,,0
