Classification,Year,Period,Period Desc.,Aggregate Level,Is Leaf Code,Trade Flow Code,Trade Flow,Reporter Code,Reporter,Reporter ISO,Partner Code,Partner,Partner ISO,2nd Partner Code,2nd Partner,2nd Partner ISO,Customs Proc. Code,Customs,Mode of Transport Code,Mode of Transport,Commodity Code,Commodity,Qty Unit Code,Qty Unit,Qty,Alt Qty Unit Code,Alt Qty Unit,Alt Qty,Netweight (kg),Gross weight (kg),Trade Value (US$),CIF Trade Value (US$),FOB Trade Value (US$),Flag
HS,2019,201909,September 2019,2,0,2,Exports,724,Spain,,0,World,,,,,,,,,99,Commodities not specified according to kind,,,,,,,0,,1997583152,,,0
HS,2019,201909,September 2019,2,0,2,Exports,724,Spain,,0,World,,,,,,,,,94,"Furniture; bedding, mattresses, mattress supports, cushions and similar stuffed furnishings; lamps and lighting fittings, n.e.s.; illuminated signs, illuminated name-plates and the like; prefabricated buildings",,,,,,,,,320995439,,,0
HS,2019,201909,September 2019,2,0,2,Exports,724,Spain,,0,World,,,,,,,,,61,Apparel and clothing accessories; knitted or crocheted,,,,,,,,,536936081,,,0
HS,2019,201909,September 2019,2,0,2,Exports,724,Spain,,0,World,,,,,,,,,63,"Textiles, made up articles; sets; worn clothing and worn textile articles; rags",,,,,,,0,,58577328,,,0
HS,2019,201911,November 2019,2,0,2,Exports,724,Spain,,0,World,,,,,,,,,75,Nickel and articles thereof,,,,,,,0,,6108000,,,0
HS,2019,201911,November 2019,2,0,2,Exports,724,Spain,,0,World,,,,,,,,,74,Copper and articles thereof,,,,,,,0,,349194692,,,0
HS,2019,201911,November 2019,2,0,2,Exports,724,Spain,,0,World,,,,,,,,,80,Tin; articles thereof,,,,,,,0,,37335757,,,0
HS,2019,201911,November 2019,2,0,2,Exports,724,Spain,,0,World,,,,,,,,,91,Clocks and watches and parts thereof,,,,,,,,,41626700,,,0
HS,2019,201907,July 2019,2,0,2,Exports,724,Spain,,0,World,,,,,,,,,74,Copper and articles thereof,,,,,,,,,234602291,,,0
HS,2019,201907,July 2019,2,0,2,Exports,724,Spain,,0,World,,,,,,,,,76,Aluminium and articles thereof,,,,,,,,,337246709,,,0
HS,2019,201907,July 2019,2,0,2,Exports,724,Spain,,0,World,,,,,,,,,90,"Optical, photographic, cinematographic, measuring, checking, medical or surgical instruments and apparatus; parts and accessories",,,,,,,,,305316459,,,0
HS,2019,201907,July 2019,2,0,2,Exports,724,Spain,,0,World,,,,,,,,,03,"Fish and crustaceans, molluscs and other aquatic invertebrates",,,,,,,0,,305461517,,,0
HS,2019,201907,July 2019,2,0,2,Exports,724,Spain,,0,World,,,,,,,,,04,"Dairy produce; birds' eggs; natural honey; edible products of animal origin, not elsewhere specified or included",,,,,,,0,,139224232,,,0
HS,2019,201907,July 2019,2,0,2,Exports,724,Spain,,0,World,,,,,,,,,05,Animal originated products; not elsewhere specified or included,,,,,,,0,,32522293,,,0
HS,2019,201907,July 2019,2,0,2,Exports,724,Spain,,0,World,,,,,,,,,11,"Products of the milling industry; malt, starches, inulin, wheat gluten",,,,,,,0,,23815824,,,0
HS,2019,201907,July 2019,2,0,2,Exports,724,Spain,,0,World,,,,,,,,,13,"Lac; gums, resins and other vegetable saps and extracts",,,,,,,0,,48712383,,,0
HS,2019,201907,July 2019,2,0,2,Exports,724,Spain,,0,World,,,,,,,,,14,Vegetable plaiting materials; vegetable products not elsewhere specified or included,,,,,,,0,,1207020,,,0
HS,2019,201907,July 2019,2,0,2,Exports,724,Spain,,0,World,,,,,,,,,24,Tobacco and manufactured tobacco substitutes,,,,,,,0,,36981879,,,0
HS,2019,201907,July 2019,2,0,2,Exports,724,Spain,,0,World,,,,,,,,,99,Commodities not specified according to kind,,,,,,,0,,1462579272,,,0
HS,2019,201907,July 2019,2,0,2,Exports,724,Spain,,0,World,,,,,,,,,36,Explosives; pyrotechnic products; matches; pyrophoric alloys; certain combustible preparations,,,,,,,0,,9265096,,,0
HS,2019,201907,July 2019,2,0,2,Exports,724,Spain,,0,World,,,,,,,,,41,Raw hides and skins (other than furskins) and leather,,,,,,,0,,56813365,,,0
HS,2019,201907,July 2019,2,0,2,Exports,724,Spain,,0,World,,,,,,,,,45,Cork and articles of cork,,,,,,,0,,41675829,,,0
HS,2019,201907,July 2019,2,0,2,Exports,724,Spain,,0,World,,,,,,,,,50,Silk,,,,,,,0,,227227,,,0
HS,2019,201907,July 2019,2,0,2,Exports,724,Spain,,0,World,,,,,,,,,51,"Wool, fine or coarse animal hair; horsehair yarn and woven fabric",,,,,,,0,,12553789,,,0
HS,2019,201907,July 2019,2,0,2,Exports,724,Spain,,0,World,,,,,,,,,53,Vegetable textile fibres; paper yarn and woven fabrics of paper yarn,,,,,,,0,,4092522,,,0
HS,2019,201907,July 2019,2,0,2,Exports,724,Spain,,0,World,,,,,,,,,60,Fabrics; knitted or crocheted,,,,,,,0,,39588000,,,0
HS,2019,201907,July 2019,2,0,2,Exports,724,Spain,,0,World,,,,,,,,,65,Headgear and parts thereof,,,,,,,0,,13464381,,,0
HS,2019,201907,July 2019,2,0,2,Exports,724,Spain,,0,World,,,,,,,,,01,Animals; live,,,,,,,0,,96398727,,,0
HS,2019,201907,July 2019,2,0,2,Exports,724,Spain,,0,World,,,,,,,,,37,Photographic or cinematographic goods,,,,,,,0,,7686893,,,0
HS,2019,201907,July 2019,2,0,2,Exports,724,Spain,,0,World,,,,,,,,,73,Iron or steel articles,,,,,,,0,,637988054,,,0
HS,2019,201907,July 2019,2,0,2,Exports,724,Spain,,0,World,,,,,,,,,86,"Railway, tramway locomotives, rolling-stock and parts thereof; railway or tramway track fixtures and fittings and parts thereof; mechanical (including electro-mechanical) traffic signalling equipment of all kinds",,,,,,,0,,171154003,,,0
HS,2019,201907,July 2019,2,0,2,Exports,724,Spain,,0,World,,,,,,,,,82,"Tools, implements, cutlery, spoons and forks, of base metal; parts thereof, of base metal",,,,,,,0,,75152929,,,0
HS,2019,201907,July 2019,2,0,2,Exports,724,Spain,,0,World,,,,,,,,,79,Zinc and articles thereof,,,,,,,0,,118706504,,,0
HS,2019,201907,July 2019,2,0,2,Exports,724,Spain,,0,World,,,,,,,,,96,Miscellaneous manufactured articles,,,,,,,0,,75946685,,,0
HS,2019,201907,July 2019,2,0,2,Exports,724,Spain,,0,World,,,,,,,,,94,"Furniture; bedding, mattresses, mattress supports, cushions and similar stuffed furnishings; lamps and lighting fittings, n.e.s.; illuminated signs, illuminated name-plates and the like; prefabricated buildings",,,,,,,0,,387376455,,,0
HS,2019,201907,July 2019,2,0,2,Exports,724,Spain,,0,World,,,,,,,,,93,Arms and ammunition; parts and accessories thereof,,,,,,,0,,51300107,,,0
HS,2019,201907,July 2019,2,0,2,Exports,724,Spain,,0,World,,,,,,,,,92,Musical instruments; parts and accessories of such articles,,,,,,,0,,3982698,,,0
HS,2019,201907,July 2019,2,0,2,Exports,724,Spain,,0,World,,,,,,,,,91,Clocks and watches and parts thereof,,,,,,,0,,37211355,,,0
HS,2019,201907,July 2019,2,0,2,Exports,724,Spain,,0,World,,,,,,,,,85,"Electrical machinery and equipment and parts thereof; sound recorders and reproducers; television image and sound recorders and reproducers, parts and accessories of such articles",,,,,,,0,,1480427650,,,0
HS,2019,201907,July 2019,2,0,2,Exports,724,Spain,,0,World,,,,,,,,,84,"Nuclear reactors, boilers, machinery and mechanical appliances; parts thereof",,,,,,,0,,2104688360,,,0
HS,2019,201907,July 2019,2,0,2,Exports,724,Spain,,0,World,,,,,,,,,83,Metal; miscellaneous products of base metal,,,,,,,0,,127673906,,,0
HS,2019,201907,July 2019,2,0,2,Exports,724,Spain,,0,World,,,,,,,,,87,"Vehicles; other than railway or tramway rolling stock, and parts and accessories thereof",,,,,,,0,,4652558977,,,0
HS,2019,201907,July 2019,2,0,2,Exports,724,Spain,,0,World,,,,,,,,,95,"Toys, games and sports requisites; parts and accessories thereof",,,,,,,0,,157970468,,,0
HS,2019,201910,October 2019,2,0,2,Exports,724,Spain,,0,World,,,,,,,,,33,"Essential oils and resinoids; perfumery, cosmetic or toilet preparations",,,,,,,0,,522628693,,,0
HS,2019,201910,October 2019,2,0,2,Exports,724,Spain,,0,World,,,,,,,,,34,"Soap, organic surface-active agents; washing, lubricating, polishing or scouring preparations; artificial or prepared waxes, candles and similar articles, modelling pastes, ""dental waxes"" and dental preparations with a basis of plaster",,,,,,,0,,140741499,,,0
HS,2019,201910,October 2019,2,0,2,Exports,724,Spain,,0,World,,,,,,,,,25,"Salt; sulphur; earths, stone; plastering materials, lime and cement",,,,,,,0,,118151266,,,0
HS,2019,201910,October 2019,2,0,2,Exports,724,Spain,,0,World,,,,,,,,,29,Organic chemicals,,,,,,,0,,397734809,,,0
HS,2019,201910,October 2019,2,0,2,Exports,724,Spain,,0,World,,,,,,,,,24,Tobacco and manufactured tobacco substitutes,,,,,,,0,,23052235,,,0
HS,2019,201910,October 2019,2,0,2,Exports,724,Spain,,0,World,,,,,,,,,32,"Tanning or dyeing extracts; tannins and their derivatives; dyes, pigments and other colouring matter; paints, varnishes; putty, other mastics; inks",,,,,,,0,,270594046,,,0
HS,2019,201910,October 2019,2,0,2,Exports,724,Spain,,0,World,,,,,,,,,28,"Inorganic chemicals; organic and inorganic compounds of precious metals; of rare earth metals, of radio-active elements and of isotopes",,,,,,,,,123544266,,,0
HS,2019,201910,October 2019,2,0,2,Exports,724,Spain,,0,World,,,,,,,,,27,"Mineral fuels, mineral oils and products of their distillation; bituminous substances; mineral waxes",,,,,,,,,1752886603,,,0
HS,2019,201910,October 2019,2,0,2,Exports,724,Spain,,0,World,,,,,,,,,35,Albuminoidal substances; modified starches; glues; enzymes,,,,,,,,,26395371,,,0
HS,2019,201910,October 2019,2,0,2,Exports,724,Spain,,0,World,,,,,,,,,26,"Ores, slag and ash",,,,,,,0,,151598562,,,0
HS,2019,201910,October 2019,2,0,2,Exports,724,Spain,,0,World,,,,,,,,,31,Fertilizers,,,,,,,0,,82024242,,,0
HS,2019,201910,October 2019,2,0,2,Exports,724,Spain,,0,World,,,,,,,,,23,"Food industries, residues and wastes thereof; prepared animal fodder",,,,,,,0,,104605243,,,0
HS,2019,201910,October 2019,2,0,2,Exports,724,Spain,,0,World,,,,,,,,,30,Pharmaceutical products,,,,,,,0,,1281819350,,,0
HS,2019,201910,October 2019,2,0,2,Exports,724,Spain,,0,World,,,,,,,,,37,Photographic or cinematographic goods,,,,,,,0,,8126575,,,0
HS,2019,201910,October 2019,2,0,2,Exports,724,Spain,,0,World,,,,,,,,,40,Rubber and articles thereof,,,,,,,0,,385362716,,,0
HS,2019,201910,October 2019,2,0,2,Exports,724,Spain,,0,World,,,,,,,,,38,Chemical products n.e.s.,,,,,,,0,,432383163,,,0
HS,2019,201910,October 2019,2,0,2,Exports,724,Spain,,0,World,,,,,,,,,39,Plastics and articles thereof,,,,,,,0,,1087426607,,,0
HS,2019,201910,October 2019,2,0,2,Exports,724,Spain,,0,World,,,,,,,,,36,Explosives; pyrotechnic products; matches; pyrophoric alloys; certain combustible preparations,,,,,,,0,,9901297,,,0
HS,2019,201910,October 2019,2,0,2,Exports,724,Spain,,0,World,,,,,,,,,41,Raw hides and skins (other than furskins) and leather,,,,,,,0,,68736237,,,0
HS,2019,201910,October 2019,2,0,2,Exports,724,Spain,,0,World,,,,,,,,,44,Wood and articles of wood; wood charcoal,,,,,,,0,,170507215,,,0
HS,2019,201910,October 2019,2,0,2,Exports,724,Spain,,0,World,,,,,,,,,43,Furskins and artificial fur; manufactures thereof,,,,,,,0,,7732881,,,0
HS,2019,201910,October 2019,2,0,2,Exports,724,Spain,,0,World,,,,,,,,,45,Cork and articles of cork,,,,,,,0,,43739125,,,0
HS,2019,201910,October 2019,2,0,2,Exports,724,Spain,,0,World,,,,,,,,,46,"Manufactures of straw, esparto or other plaiting materials; basketware and wickerwork",,,,,,,0,,2100383,,,0
HS,2019,201910,October 2019,2,0,2,Exports,724,Spain,,0,World,,,,,,,,,42,"Articles of leather; saddlery and harness; travel goods, handbags and similar containers; articles of animal gut (other than silk-worm gut)",,,,,,,0,,134017614,,,0
HS,2019,201910,October 2019,2,0,2,Exports,724,Spain,,0,World,,,,,,,,,82,"Tools, implements, cutlery, spoons and forks, of base metal; parts thereof, of base metal",,,,,,,0,,78689406,,,0
HS,2019,201910,October 2019,2,0,2,Exports,724,Spain,,0,World,,,,,,,,,56,"Wadding, felt and nonwovens, special yarns; twine, cordage, ropes and cables and articles thereof",,,,,,,0,,54732901,,,0
HS,2019,201910,October 2019,2,0,2,Exports,724,Spain,,0,World,,,,,,,,,58,"Fabrics; special woven fabrics, tufted textile fabrics, lace, tapestries, trimmings, embroidery",,,,,,,0,,18168546,,,0
HS,2019,201910,October 2019,2,0,2,Exports,724,Spain,,0,World,,,,,,,,,60,Fabrics; knitted or crocheted,,,,,,,0,,45045190,,,0
HS,2019,201910,October 2019,2,0,2,Exports,724,Spain,,0,World,,,,,,,,,89,"Ships, boats and floating structures",,,,,,,0,,66617835,,,0
HS,2019,201910,October 2019,2,0,2,Exports,724,Spain,,0,World,,,,,,,,,86,"Railway, tramway locomotives, rolling-stock and parts thereof; railway or tramway track fixtures and fittings and parts thereof; mechanical (including electro-mechanical) traffic signalling equipment of all kinds",,,,,,,0,,226068639,,,0
HS,2019,201907,July 2019,2,0,2,Exports,724,Spain,,0,World,,,,,,,,,09,"Coffee, tea, mate and spices",,,,,,,0,,52144401,,,0
HS,2019,201907,July 2019,2,0,2,Exports,724,Spain,,0,World,,,,,,,,,21,Miscellaneous edible preparations,,,,,,,0,,179442770,,,0
HS,2019,201907,July 2019,2,0,2,Exports,724,Spain,,0,World,,,,,,,,,58,"Fabrics; special woven fabrics, tufted textile fabrics, lace, tapestries, trimmings, embroidery",,,,,,,0,,13950375,,,0
HS,2019,201907,July 2019,2,0,2,Exports,724,Spain,,0,World,,,,,,,,,66,"Umbrellas, sun umbrellas, walking-sticks, seat sticks, whips, riding crops; and parts thereof",,,,,,,0,,2330574,,,0
HS,2019,201907,July 2019,2,0,2,Exports,724,Spain,,0,World,,,,,,,,,30,Pharmaceutical products,,,,,,,0,,1336251504,,,0
HS,2019,201907,July 2019,2,0,2,Exports,724,Spain,,0,World,,,,,,,,,52,Cotton,,,,,,,0,,62082005,,,0
HS,2019,201907,July 2019,2,0,2,Exports,724,Spain,,0,World,,,,,,,,,71,"Natural, cultured pearls; precious, semi-precious stones; precious metals, metals clad with precious metal, and articles thereof; imitation jewellery; coin",,,,,,,0,,194053427,,,0
HS,2019,201907,July 2019,2,0,2,Exports,724,Spain,,0,World,,,,,,,,,49,"Printed books, newspapers, pictures and other products of the printing industry; manuscripts, typescripts and plans",,,,,,,0,,68585065,,,0
HS,2019,201907,July 2019,2,0,2,Exports,724,Spain,,0,World,,,,,,,,,54,Man-made filaments,,,,,,,0,,70542134,,,0
HS,2019,201907,July 2019,2,0,2,Exports,724,Spain,,0,World,,,,,,,,,68,"Stone, plaster, cement, asbestos, mica or similar materials; articles thereof",,,,,,,0,,194296247,,,0
HS,2019,201907,July 2019,2,0,2,Exports,724,Spain,,0,World,,,,,,,,,56,"Wadding, felt and nonwovens, special yarns; twine, cordage, ropes and cables and articles thereof",,,,,,,0,,51701676,,,0
HS,2019,201907,July 2019,2,0,2,Exports,724,Spain,,0,World,,,,,,,,,47,Pulp of wood or other fibrous cellulosic material; waste and scrap of paper or paperboard,,,,,,,0,,54953656,,,0
HS,2019,201907,July 2019,2,0,2,Exports,724,Spain,,0,World,,,,,,,,,44,Wood and articles of wood; wood charcoal,,,,,,,0,,153945452,,,0
HS,2019,201907,July 2019,2,0,2,Exports,724,Spain,,0,World,,,,,,,,,40,Rubber and articles thereof,,,,,,,0,,340951087,,,0
HS,2019,201907,July 2019,2,0,2,Exports,724,Spain,,0,World,,,,,,,,,42,"Articles of leather; saddlery and harness; travel goods, handbags and similar containers; articles of animal gut (other than silk-worm gut)",,,,,,,0,,138185972,,,0
HS,2019,201907,July 2019,2,0,2,Exports,724,Spain,,0,World,,,,,,,,,31,Fertilizers,,,,,,,0,,83664709,,,0
HS,2019,201907,July 2019,2,0,2,Exports,724,Spain,,0,World,,,,,,,,,32,"Tanning or dyeing extracts; tannins and their derivatives; dyes, pigments and other colouring matter; paints, varnishes; putty, other mastics; inks",,,,,,,0,,272704038,,,0
HS,2019,201907,July 2019,2,0,2,Exports,724,Spain,,0,World,,,,,,,,,35,Albuminoidal substances; modified starches; glues; enzymes,,,,,,,0,,23795980,,,0
HS,2019,201907,July 2019,2,0,2,Exports,724,Spain,,0,World,,,,,,,,,23,"Food industries, residues and wastes thereof; prepared animal fodder",,,,,,,0,,108924336,,,0
HS,2019,201907,July 2019,2,0,2,Exports,724,Spain,,0,World,,,,,,,,,22,"Beverages, spirits and vinegar",,,,,,,0,,472631221,,,0
HS,2019,201907,July 2019,2,0,2,Exports,724,Spain,,0,World,,,,,,,,,20,"Preparations of vegetables, fruit, nuts or other parts of plants",,,,,,,0,,314872945,,,0
HS,2019,201907,July 2019,2,0,2,Exports,724,Spain,,0,World,,,,,,,,,16,"Meat, fish or crustaceans, molluscs or other aquatic invertebrates; preparations thereof",,,,,,,0,,176911010,,,0
HS,2019,201907,July 2019,2,0,2,Exports,724,Spain,,0,World,,,,,,,,,19,"Preparations of cereals, flour, starch or milk; pastrycooks' products",,,,,,,0,,173984943,,,0
HS,2019,201907,July 2019,2,0,2,Exports,724,Spain,,0,World,,,,,,,,,38,Chemical products n.e.s.,,,,,,,0,,429550411,,,0
HS,2019,201907,July 2019,2,0,2,Exports,724,Spain,,0,World,,,,,,,,,33,"Essential oils and resinoids; perfumery, cosmetic or toilet preparations",,,,,,,0,,519977115,,,0
HS,2019,201907,July 2019,2,0,2,Exports,724,Spain,,0,World,,,,,,,,,02,Meat and edible meat offal,,,,,,,0,,629199275,,,0
HS,2019,201907,July 2019,2,0,2,Exports,724,Spain,,0,World,,,,,,,,,07,Vegetables and certain roots and tubers; edible,,,,,,,0,,310237867,,,0
HS,2019,201907,July 2019,2,0,2,Exports,724,Spain,,0,World,,,,,,,,,10,Cereals,,,,,,,0,,43426391,,,0
HS,2019,201907,July 2019,2,0,2,Exports,724,Spain,,0,World,,,,,,,,,39,Plastics and articles thereof,,,,,,,0,,1066251580,,,0
HS,2019,201907,July 2019,2,0,2,Exports,724,Spain,,0,World,,,,,,,,,29,Organic chemicals,,,,,,,0,,403783690,,,0
HS,2019,201907,July 2019,2,0,2,Exports,724,Spain,,0,World,,,,,,,,,15,Animal or vegetable fats and oils and their cleavage products; prepared animal fats; animal or vegetable waxes,,,,,,,0,,423449642,,,0
HS,2019,201907,July 2019,2,0,2,Exports,724,Spain,,0,World,,,,,,,,,17,Sugars and sugar confectionery,,,,,,,0,,68691556,,,0
HS,2019,201907,July 2019,2,0,2,Exports,724,Spain,,0,World,,,,,,,,,18,Cocoa and cocoa preparations,,,,,,,0,,63709743,,,0
HS,2019,201907,July 2019,2,0,2,Exports,724,Spain,,0,World,,,,,,,,,08,"Fruit and nuts, edible; peel of citrus fruit or melons",,,,,,,0,,798663881,,,0
HS,2019,201907,July 2019,2,0,2,Exports,724,Spain,,0,World,,,,,,,,,06,"Trees and other plants, live; bulbs, roots and the like; cut flowers and ornamental foliage",,,,,,,0,,23059086,,,0
HS,2019,201907,July 2019,2,0,2,Exports,724,Spain,,0,World,,,,,,,,,48,"Paper and paperboard; articles of paper pulp, of paper or paperboard",,,,,,,0,,364641954,,,0
HS,2019,201907,July 2019,2,0,2,Exports,724,Spain,,0,World,,,,,,,,,55,Man-made staple fibres,,,,,,,0,,71258706,,,0
HS,2019,201907,July 2019,2,0,2,Exports,724,Spain,,0,World,,,,,,,,,43,Furskins and artificial fur; manufactures thereof,,,,,,,0,,10004590,,,0
HS,2019,201907,July 2019,2,0,2,Exports,724,Spain,,0,World,,,,,,,,,61,Apparel and clothing accessories; knitted or crocheted,,,,,,,0,,461159680,,,0
HS,2019,201907,July 2019,2,0,2,Exports,724,Spain,,0,World,,,,,,,,,57,Carpets and other textile floor coverings,,,,,,,0,,12783660,,,0
HS,2019,201907,July 2019,2,0,2,Exports,724,Spain,,0,World,,,,,,,,,59,"Textile fabrics; impregnated, coated, covered or laminated; textile articles of a kind suitable for industrial use",,,,,,,0,,35174799,,,0
HS,2019,201907,July 2019,2,0,2,Exports,724,Spain,,0,World,,,,,,,,,64,Footwear; gaiters and the like; parts of such articles,,,,,,,0,,300339146,,,0
HS,2019,201907,July 2019,2,0,2,Exports,724,Spain,,0,World,,,,,,,,,63,"Textiles, made up articles; sets; worn clothing and worn textile articles; rags",,,,,,,0,,83723007,,,0
HS,2019,201907,July 2019,2,0,2,Exports,724,Spain,,0,World,,,,,,,,,62,Apparel and clothing accessories; not knitted or crocheted,,,,,,,0,,695295697,,,0
HS,2019,201907,July 2019,2,0,2,Exports,724,Spain,,0,World,,,,,,,,,97,Works of art; collectors' pieces and antiques,,,,,,,,,6781279,,,0
HS,2019,201907,July 2019,2,0,2,Exports,724,Spain,,0,World,,,,,,,,,25,"Salt; sulphur; earths, stone; plastering materials, lime and cement",,,,,,,,,118785223,,,0
HS,2019,201907,July 2019,2,0,2,Exports,724,Spain,,0,World,,,,,,,,,28,"Inorganic chemicals; organic and inorganic compounds of precious metals; of rare earth metals, of radio-active elements and of isotopes",,,,,,,,,145137143,,,0
HS,2019,201907,July 2019,2,0,2,Exports,724,Spain,,0,World,,,,,,,,,27,"Mineral fuels, mineral oils and products of their distillation; bituminous substances; mineral waxes",,,,,,,,,1676769982,,,0
HS,2019,201907,July 2019,2,0,2,Exports,724,Spain,,0,World,,,,,,,,,46,"Manufactures of straw, esparto or other plaiting materials; basketware and wickerwork",,,,,,,,,2487563,,,0
HS,2019,201907,July 2019,2,0,2,Exports,724,Spain,,0,World,,,,,,,,,34,"Soap, organic surface-active agents; washing, lubricating, polishing or scouring preparations; artificial or prepared waxes, candles and similar articles, modelling pastes, ""dental waxes"" and dental preparations with a basis of plaster",,,,,,,,,130401802,,,0
HS,2019,201907,July 2019,2,0,2,Exports,724,Spain,,0,World,,,,,,,,,12,"Oil seeds and oleaginous fruits; miscellaneous grains, seeds and fruit, industrial or medicinal plants; straw and fodder",,,,,,,,,88953976,,,0
HS,2019,201907,July 2019,2,0,2,Exports,724,Spain,,0,World,,,,,,,,,26,"Ores, slag and ash",,,,,,,,,158071863,,,0
HS,2019,201907,July 2019,2,0,2,Exports,724,Spain,,0,World,,,,,,,,,72,Iron and steel,,,,,,,,,556784451,,,0
HS,2019,201907,July 2019,2,0,2,Exports,724,Spain,,0,World,,,,,,,,,70,Glass and glassware,,,,,,,,,136609643,,,0
HS,2019,201907,July 2019,2,0,2,Exports,724,Spain,,0,World,,,,,,,,,67,"Feathers and down, prepared; and articles made of feather or of down; artificial flowers; articles of human hair",,,,,,,,,1311016,,,0
HS,2019,201907,July 2019,2,0,2,Exports,724,Spain,,0,World,,,,,,,,,69,Ceramic products,,,,,,,,,350060825,,,0
HS,2019,201907,July 2019,2,0,2,Exports,724,Spain,,0,World,,,,,,,,,75,Nickel and articles thereof,,,,,,,0,,5586285,,,0
HS,2019,201907,July 2019,2,0,2,Exports,724,Spain,,0,World,,,,,,,,,78,Lead and articles thereof,,,,,,,0,,4359121,,,0
HS,2019,201907,July 2019,2,0,2,Exports,724,Spain,,0,World,,,,,,,,,81,"Metals; n.e.s., cermets and articles thereof",,,,,,,0,,3754252,,,0
HS,2019,201907,July 2019,2,0,2,Exports,724,Spain,,0,World,,,,,,,,,80,Tin; articles thereof,,,,,,,0,,2484138,,,0
HS,2019,201907,July 2019,2,0,2,Exports,724,Spain,,0,World,,,,,,,,,88,"Aircraft, spacecraft and parts thereof",,,,,,,0,,755315581,,,0
HS,2019,201907,July 2019,2,0,2,Exports,724,Spain,,0,World,,,,,,,,,89,"Ships, boats and floating structures",,,,,,,0,,75781126,,,0
HS,2019,201904,April 2019,2,0,2,Exports,724,Spain,,0,World,,,,,,,,,36,Explosives; pyrotechnic products; matches; pyrophoric alloys; certain combustible preparations,,,,,,,0,,7576532,,,0
HS,2019,201904,April 2019,2,0,2,Exports,724,Spain,,0,World,,,,,,,,,38,Chemical products n.e.s.,,,,,,,0,,441220577,,,0
HS,2019,201904,April 2019,2,0,2,Exports,724,Spain,,0,World,,,,,,,,,34,"Soap, organic surface-active agents; washing, lubricating, polishing or scouring preparations; artificial or prepared waxes, candles and similar articles, modelling pastes, ""dental waxes"" and dental preparations with a basis of plaster",,,,,,,0,,115776513,,,0
HS,2019,201904,April 2019,2,0,2,Exports,724,Spain,,0,World,,,,,,,,,33,"Essential oils and resinoids; perfumery, cosmetic or toilet preparations",,,,,,,0,,424364917,,,0
HS,2019,201904,April 2019,2,0,2,Exports,724,Spain,,0,World,,,,,,,,,02,Meat and edible meat offal,,,,,,,0,,627541570,,,0
HS,2019,201904,April 2019,2,0,2,Exports,724,Spain,,0,World,,,,,,,,,07,Vegetables and certain roots and tubers; edible,,,,,,,0,,717600443,,,0
HS,2019,201904,April 2019,2,0,2,Exports,724,Spain,,0,World,,,,,,,,,04,"Dairy produce; birds' eggs; natural honey; edible products of animal origin, not elsewhere specified or included",,,,,,,0,,139521797,,,0
HS,2019,201904,April 2019,2,0,2,Exports,724,Spain,,0,World,,,,,,,,,11,"Products of the milling industry; malt, starches, inulin, wheat gluten",,,,,,,0,,23370730,,,0
HS,2019,201904,April 2019,2,0,2,Exports,724,Spain,,0,World,,,,,,,,,19,"Preparations of cereals, flour, starch or milk; pastrycooks' products",,,,,,,0,,167382027,,,0
HS,2019,201904,April 2019,2,0,2,Exports,724,Spain,,0,World,,,,,,,,,22,"Beverages, spirits and vinegar",,,,,,,0,,373102790,,,0
HS,2019,201904,April 2019,2,0,2,Exports,724,Spain,,0,World,,,,,,,,,20,"Preparations of vegetables, fruit, nuts or other parts of plants",,,,,,,0,,274897594,,,0
HS,2019,201904,April 2019,2,0,2,Exports,724,Spain,,0,World,,,,,,,,,23,"Food industries, residues and wastes thereof; prepared animal fodder",,,,,,,0,,94147350,,,0
HS,2019,201904,April 2019,2,0,2,Exports,724,Spain,,0,World,,,,,,,,,18,Cocoa and cocoa preparations,,,,,,,0,,51884827,,,0
HS,2019,201904,April 2019,2,0,2,Exports,724,Spain,,0,World,,,,,,,,,39,Plastics and articles thereof,,,,,,,0,,1052943377,,,0
HS,2019,201904,April 2019,2,0,2,Exports,724,Spain,,0,World,,,,,,,,,29,Organic chemicals,,,,,,,0,,395195736,,,0
HS,2019,201904,April 2019,2,0,2,Exports,724,Spain,,0,World,,,,,,,,,15,Animal or vegetable fats and oils and their cleavage products; prepared animal fats; animal or vegetable waxes,,,,,,,0,,372778060,,,0
HS,2019,201904,April 2019,2,0,2,Exports,724,Spain,,0,World,,,,,,,,,17,Sugars and sugar confectionery,,,,,,,0,,54542585,,,0
HS,2019,201904,April 2019,2,0,2,Exports,724,Spain,,0,World,,,,,,,,,03,"Fish and crustaceans, molluscs and other aquatic invertebrates",,,,,,,0,,275286784,,,0
HS,2019,201904,April 2019,2,0,2,Exports,724,Spain,,0,World,,,,,,,,,21,Miscellaneous edible preparations,,,,,,,0,,152326360,,,0
HS,2019,201904,April 2019,2,0,2,Exports,724,Spain,,0,World,,,,,,,,,09,"Coffee, tea, mate and spices",,,,,,,0,,45698659,,,0
HS,2019,201904,April 2019,2,0,2,Exports,724,Spain,,0,World,,,,,,,,,30,Pharmaceutical products,,,,,,,0,,1029353359,,,0
HS,2019,201904,April 2019,2,0,2,Exports,724,Spain,,0,World,,,,,,,,,32,"Tanning or dyeing extracts; tannins and their derivatives; dyes, pigments and other colouring matter; paints, varnishes; putty, other mastics; inks",,,,,,,0,,257337393,,,0
HS,2019,201904,April 2019,2,0,2,Exports,724,Spain,,0,World,,,,,,,,,35,Albuminoidal substances; modified starches; glues; enzymes,,,,,,,0,,23773163,,,0
HS,2019,201904,April 2019,2,0,2,Exports,724,Spain,,0,World,,,,,,,,,44,Wood and articles of wood; wood charcoal,,,,,,,0,,141774592,,,0
