HS,2019,201902,February 2019,2,0,2,Exports,616,Poland,,0,World,,,,,,,,,51,"Wool, fine or coarse animal hair; horsehair yarn and woven fabric",,,,,,,0,,11803622,,,0
HS,2019,201902,February 2019,2,0,2,Exports,616,Poland,,0,World,,,,,,,,,53,Vegetable textile fibres; paper yarn and woven fabrics of paper yarn,,,,,,,0,,3170284,,,0
HS,2019,201902,February 2019,2,0,2,Exports,616,Poland,,0,World,,,,,,,,,55,Man-made staple fibres,,,,,,,0,,11207066,,,0
HS,2019,201902,February 2019,2,0,2,Exports,616,Poland,,0,World,,,,,,,,,59,"Textile fabrics; impregnated, coated, covered or laminated; textile articles of a kind suitable for industrial use",,,,,,,0,,35746021,,,0
HS,2019,201902,February 2019,2,0,2,Exports,616,Poland,,0,World,,,,,,,,,57,Carpets and other textile floor coverings,,,,,,,0,,20818327,,,0
HS,2019,201902,February 2019,2,0,2,Exports,616,Poland,,0,World,,,,,,,,,72,Iron and steel,,,,,,,0,,432192655,,,0
HS,2019,201902,February 2019,2,0,2,Exports,616,Poland,,0,World,,,,,,,,,70,Glass and glassware,,,,,,,0,,187350433,,,0
HS,2019,201902,February 2019,2,0,2,Exports,616,Poland,,0,World,,,,,,,,,65,Headgear and parts thereof,,,,,,,0,,14477066,,,0
HS,2019,201902,February 2019,2,0,2,Exports,616,Poland,,0,World,,,,,,,,,64,Footwear; gaiters and the like; parts of such articles,,,,,,,0,,179239666,,,0
HS,2019,201902,February 2019,2,0,2,Exports,616,Poland,,0,World,,,,,,,,,67,"Feathers and down, prepared; and articles made of feather or of down; artificial flowers; articles of human hair",,,,,,,0,,1739837,,,0
HS,2019,201902,February 2019,2,0,2,Exports,616,Poland,,0,World,,,,,,,,,61,Apparel and clothing accessories; knitted or crocheted,,,,,,,0,,214779830,,,0
HS,2019,201902,February 2019,2,0,2,Exports,616,Poland,,0,World,,,,,,,,,60,Fabrics; knitted or crocheted,,,,,,,0,,5348510,,,0
HS,2019,201902,February 2019,2,0,2,Exports,616,Poland,,0,World,,,,,,,,,62,Apparel and clothing accessories; not knitted or crocheted,,,,,,,0,,256777641,,,0
HS,2019,201902,February 2019,2,0,2,Exports,616,Poland,,0,World,,,,,,,,,63,"Textiles, made up articles; sets; worn clothing and worn textile articles; rags",,,,,,,0,,106914640,,,0
HS,2019,201902,February 2019,2,0,2,Exports,616,Poland,,0,World,,,,,,,,,99,Commodities not specified according to kind,,,,,,,0,,38216918,,,0
HS,2019,201902,February 2019,2,0,2,Exports,616,Poland,,0,World,,,,,,,,,12,"Oil seeds and oleaginous fruits; miscellaneous grains, seeds and fruit, industrial or medicinal plants; straw and fodder",,,,,,,0,,32895818,,,0
HS,2019,201902,February 2019,2,0,2,Exports,616,Poland,,0,World,,,,,,,,,11,"Products of the milling industry; malt, starches, inulin, wheat gluten",,,,,,,0,,32539683,,,0
HS,2019,201902,February 2019,2,0,2,Exports,616,Poland,,0,World,,,,,,,,,96,Miscellaneous manufactured articles,,,,,,,0,,126462044,,,0
HS,2019,201902,February 2019,2,0,2,Exports,616,Poland,,0,World,,,,,,,,,94,"Furniture; bedding, mattresses, mattress supports, cushions and similar stuffed furnishings; lamps and lighting fittings, n.e.s.; illuminated signs, illuminated name-plates and the like; prefabricated buildings",,,,,,,0,,1249130953,,,0
HS,2019,201902,February 2019,2,0,2,Exports,616,Poland,,0,World,,,,,,,,,93,Arms and ammunition; parts and accessories thereof,,,,,,,0,,9836984,,,0
HS,2019,201902,February 2019,2,0,2,Exports,616,Poland,,0,World,,,,,,,,,16,"Meat, fish or crustaceans, molluscs or other aquatic invertebrates; preparations thereof",,,,,,,0,,159095395,,,0
HS,2019,201902,February 2019,2,0,2,Exports,616,Poland,,0,World,,,,,,,,,14,Vegetable plaiting materials; vegetable products not elsewhere specified or included,,,,,,,0,,241948,,,0
HS,2019,201902,February 2019,2,0,2,Exports,616,Poland,,0,World,,,,,,,,,20,"Preparations of vegetables, fruit, nuts or other parts of plants",,,,,,,0,,125144157,,,0
HS,2019,201902,February 2019,2,0,2,Exports,616,Poland,,0,World,,,,,,,,,19,"Preparations of cereals, flour, starch or milk; pastrycooks' products",,,,,,,0,,207576024,,,0
HS,2019,201902,February 2019,2,0,2,Exports,616,Poland,,0,World,,,,,,,,,75,Nickel and articles thereof,,,,,,,0,,2383852,,,0
HS,2019,201902,February 2019,2,0,2,Exports,616,Poland,,0,World,,,,,,,,,74,Copper and articles thereof,,,,,,,0,,348497570,,,0
HS,2019,201902,February 2019,2,0,2,Exports,616,Poland,,0,World,,,,,,,,,80,Tin; articles thereof,,,,,,,0,,12610934,,,0
HS,2019,201902,February 2019,2,0,2,Exports,616,Poland,,0,World,,,,,,,,,84,"Nuclear reactors, boilers, machinery and mechanical appliances; parts thereof",,,,,,,0,,2810963916,,,0
HS,2019,201902,February 2019,2,0,2,Exports,616,Poland,,0,World,,,,,,,,,83,Metal; miscellaneous products of base metal,,,,,,,0,,184147518,,,0
HS,2019,201902,February 2019,2,0,2,Exports,616,Poland,,0,World,,,,,,,,,90,"Optical, photographic, cinematographic, measuring, checking, medical or surgical instruments and apparatus; parts and accessories",,,,,,,0,,362045792,,,0
HS,2019,201902,February 2019,2,0,2,Exports,616,Poland,,0,World,,,,,,,,,89,"Ships, boats and floating structures",,,,,,,0,,273511393,,,0
HS,2019,201902,February 2019,2,0,2,Exports,616,Poland,,0,World,,,,,,,,,85,"Electrical machinery and equipment and parts thereof; sound recorders and reproducers; television image and sound recorders and reproducers, parts and accessories of such articles",,,,,,,0,,2017321725,,,0
HS,2019,201902,February 2019,2,0,2,Exports,616,Poland,,0,World,,,,,,,,,92,Musical instruments; parts and accessories of such articles,,,,,,,0,,2677521,,,0
HS,2019,201902,February 2019,2,0,2,Exports,616,Poland,,0,World,,,,,,,,,91,Clocks and watches and parts thereof,,,,,,,0,,7145748,,,0
HS,2019,201902,February 2019,2,0,2,Exports,616,Poland,,0,World,,,,,,,,,23,"Food industries, residues and wastes thereof; prepared animal fodder",,,,,,,0,,129577440,,,0
HS,2019,201902,February 2019,2,0,2,Exports,616,Poland,,0,World,,,,,,,,,22,"Beverages, spirits and vinegar",,,,,,,0,,66889048,,,0
HS,2019,201902,February 2019,2,0,2,Exports,616,Poland,,0,World,,,,,,,,,26,"Ores, slag and ash",,,,,,,0,,11317349,,,0
HS,2019,201902,February 2019,2,0,2,Exports,616,Poland,,0,World,,,,,,,,,33,"Essential oils and resinoids; perfumery, cosmetic or toilet preparations",,,,,,,0,,320413686,,,0
HS,2019,201902,February 2019,2,0,2,Exports,616,Poland,,0,World,,,,,,,,,34,"Soap, organic surface-active agents; washing, lubricating, polishing or scouring preparations; artificial or prepared waxes, candles and similar articles, modelling pastes, ""dental waxes"" and dental preparations with a basis of plaster",,,,,,,0,,189198539,,,0
HS,2019,201902,February 2019,2,0,2,Exports,616,Poland,,0,World,,,,,,,,,02,Meat and edible meat offal,,,,,,,0,,443988421,,,0
HS,2019,201902,February 2019,2,0,2,Exports,616,Poland,,0,World,,,,,,,,,04,"Dairy produce; birds' eggs; natural honey; edible products of animal origin, not elsewhere specified or included",,,,,,,0,,229138559,,,0
HS,2019,201902,February 2019,2,0,2,Exports,616,Poland,,0,World,,,,,,,,,38,Chemical products n.e.s.,,,,,,,0,,217526255,,,0
HS,2019,201902,February 2019,2,0,2,Exports,616,Poland,,0,World,,,,,,,,,36,Explosives; pyrotechnic products; matches; pyrophoric alloys; certain combustible preparations,,,,,,,0,,3560384,,,0
HS,2019,201902,February 2019,2,0,2,Exports,616,Poland,,0,World,,,,,,,,,13,"Lac; gums, resins and other vegetable saps and extracts",,,,,,,0,,1844501,,,0
HS,2019,201902,February 2019,2,0,2,Exports,616,Poland,,0,World,,,,,,,,,07,Vegetables and certain roots and tubers; edible,,,,,,,0,,114799204,,,0
HS,2019,201902,February 2019,2,0,2,Exports,616,Poland,,0,World,,,,,,,,,05,Animal originated products; not elsewhere specified or included,,,,,,,0,,35535682,,,0
HS,2019,201902,February 2019,2,0,2,Exports,616,Poland,,0,World,,,,,,,,,17,Sugars and sugar confectionery,,,,,,,0,,66032614,,,0
HS,2019,201902,February 2019,2,0,2,Exports,616,Poland,,0,World,,,,,,,,,15,Animal or vegetable fats and oils and their cleavage products; prepared animal fats; animal or vegetable waxes,,,,,,,0,,45315492,,,0
HS,2019,201902,February 2019,2,0,2,Exports,616,Poland,,0,World,,,,,,,,,97,Works of art; collectors' pieces and antiques,,,,,,,0,,1108648,,,0
HS,2019,201902,February 2019,2,0,2,Exports,616,Poland,,0,World,,,,,,,,,39,Plastics and articles thereof,,,,,,,0,,969514381,,,0
HS,2019,201902,February 2019,2,0,2,Exports,616,Poland,,0,World,,,,,,,,,29,Organic chemicals,,,,,,,0,,117174296,,,0
HS,2019,201902,February 2019,2,0,2,Exports,616,Poland,,0,World,,,,,,,,,10,Cereals,,,,,,,0,,75659347,,,0
HS,2019,201902,February 2019,2,0,2,Exports,616,Poland,,0,World,,,,,,,,,88,"Aircraft, spacecraft and parts thereof",,,,,,,0,,84948432,,,0
HS,2019,201902,February 2019,2,0,2,Exports,616,Poland,,0,World,,,,,,,,,49,"Printed books, newspapers, pictures and other products of the printing industry; manuscripts, typescripts and plans",,,,,,,0,,169709093,,,0
HS,2019,201902,February 2019,2,0,2,Exports,616,Poland,,0,World,,,,,,,,,47,Pulp of wood or other fibrous cellulosic material; waste and scrap of paper or paperboard,,,,,,,0,,24229562,,,0
HS,2019,201902,February 2019,2,0,2,Exports,616,Poland,,0,World,,,,,,,,,44,Wood and articles of wood; wood charcoal,,,,,,,0,,284797500,,,0
HS,2019,201902,February 2019,2,0,2,Exports,616,Poland,,0,World,,,,,,,,,50,Silk,,,,,,,0,,6454,,,0
HS,2019,201902,February 2019,2,0,2,Exports,616,Poland,,0,World,,,,,,,,,54,Man-made filaments,,,,,,,0,,23052117,,,0
HS,2019,201902,February 2019,2,0,2,Exports,616,Poland,,0,World,,,,,,,,,42,"Articles of leather; saddlery and harness; travel goods, handbags and similar containers; articles of animal gut (other than silk-worm gut)",,,,,,,0,,48799707,,,0
HS,2019,201902,February 2019,2,0,2,Exports,616,Poland,,0,World,,,,,,,,,40,Rubber and articles thereof,,,,,,,0,,448395871,,,0
HS,2019,201902,February 2019,2,0,2,Exports,616,Poland,,0,World,,,,,,,,,37,Photographic or cinematographic goods,,,,,,,0,,1982269,,,0
HS,2019,201902,February 2019,2,0,2,Exports,616,Poland,,0,World,,,,,,,,,35,Albuminoidal substances; modified starches; glues; enzymes,,,,,,,0,,20577139,,,0
HS,2019,201902,February 2019,2,0,2,Exports,616,Poland,,0,World,,,,,,,,,32,"Tanning or dyeing extracts; tannins and their derivatives; dyes, pigments and other colouring matter; paints, varnishes; putty, other mastics; inks",,,,,,,0,,91616426,,,0
HS,2019,201902,February 2019,2,0,2,Exports,616,Poland,,0,World,,,,,,,,,27,"Mineral fuels, mineral oils and products of their distillation; bituminous substances; mineral waxes",,,,,,,0,,564126322,,,0
HS,2019,201902,February 2019,2,0,2,Exports,616,Poland,,0,World,,,,,,,,,18,Cocoa and cocoa preparations,,,,,,,0,,146739569,,,0
HS,2019,201902,February 2019,2,0,2,Exports,616,Poland,,0,World,,,,,,,,,08,"Fruit and nuts, edible; peel of citrus fruit or melons",,,,,,,0,,103937272,,,0
HS,2019,201902,February 2019,2,0,2,Exports,616,Poland,,0,World,,,,,,,,,28,"Inorganic chemicals; organic and inorganic compounds of precious metals; of rare earth metals, of radio-active elements and of isotopes",,,,,,,0,,98387703,,,0
HS,2019,201902,February 2019,2,0,2,Exports,616,Poland,,0,World,,,,,,,,,31,Fertilizers,,,,,,,0,,66307620,,,0
HS,2019,201902,February 2019,2,0,2,Exports,616,Poland,,0,World,,,,,,,,,45,Cork and articles of cork,,,,,,,0,,477037,,,0
HS,2019,201902,February 2019,2,0,2,Exports,616,Poland,,0,World,,,,,,,,,46,"Manufactures of straw, esparto or other plaiting materials; basketware and wickerwork",,,,,,,0,,3766633,,,0
HS,2019,201902,February 2019,2,0,2,Exports,616,Poland,,0,World,,,,,,,,,87,"Vehicles; other than railway or tramway rolling stock, and parts and accessories thereof",,,,,,,0,,2591886984,,,0
HS,2019,201902,February 2019,2,0,2,Exports,616,Poland,,0,World,,,,,,,,,95,"Toys, games and sports requisites; parts and accessories thereof",,,,,,,0,,171627980,,,0
HS,2019,201902,February 2019,2,0,2,Exports,616,Poland,,0,World,,,,,,,,,06,"Trees and other plants, live; bulbs, roots and the like; cut flowers and ornamental foliage",,,,,,,0,,23966083,,,0
HS,2019,201904,April 2019,2,0,2,Exports,616,Poland,,0,World,,,,,,,,,66,"Umbrellas, sun umbrellas, walking-sticks, seat sticks, whips, riding crops; and parts thereof",,,,,,,,,4204661,,,0
HS,2019,201904,April 2019,2,0,2,Exports,616,Poland,,0,World,,,,,,,,,43,Furskins and artificial fur; manufactures thereof,,,,,,,,,34168484,,,0
HS,2019,201904,April 2019,2,0,2,Exports,616,Poland,,0,World,,,,,,,,,70,Glass and glassware,,,,,,,,,186112057,,,0
HS,2019,201904,April 2019,2,0,2,Exports,616,Poland,,0,World,,,,,,,,,29,Organic chemicals,,,,,,,,,129766341,,,0
HS,2019,201910,October 2019,2,0,2,Exports,616,Poland,,0,World,,,,,,,,,43,Furskins and artificial fur; manufactures thereof,,,,,,,,,3262344,,,0
HS,2019,201904,April 2019,2,0,2,Exports,616,Poland,,0,World,,,,,,,,,48,"Paper and paperboard; articles of paper pulp, of paper or paperboard",,,,,,,0,,427012362,,,0
HS,2019,201904,April 2019,2,0,2,Exports,616,Poland,,0,World,,,,,,,,,41,Raw hides and skins (other than furskins) and leather,,,,,,,0,,25151892,,,0
HS,2019,201904,April 2019,2,0,2,Exports,616,Poland,,0,World,,,,,,,,,01,Animals; live,,,,,,,0,,14147728,,,0
HS,2019,201904,April 2019,2,0,2,Exports,616,Poland,,0,World,,,,,,,,,03,"Fish and crustaceans, molluscs and other aquatic invertebrates",,,,,,,0,,166613138,,,0
HS,2019,201904,April 2019,2,0,2,Exports,616,Poland,,0,World,,,,,,,,,51,"Wool, fine or coarse animal hair; horsehair yarn and woven fabric",,,,,,,0,,13397583,,,0
HS,2019,201904,April 2019,2,0,2,Exports,616,Poland,,0,World,,,,,,,,,59,"Textile fabrics; impregnated, coated, covered or laminated; textile articles of a kind suitable for industrial use",,,,,,,0,,36801197,,,0
HS,2019,201904,April 2019,2,0,2,Exports,616,Poland,,0,World,,,,,,,,,16,"Meat, fish or crustaceans, molluscs or other aquatic invertebrates; preparations thereof",,,,,,,0,,172719764,,,0
HS,2019,201904,April 2019,2,0,2,Exports,616,Poland,,0,World,,,,,,,,,14,Vegetable plaiting materials; vegetable products not elsewhere specified or included,,,,,,,0,,274140,,,0
HS,2019,201904,April 2019,2,0,2,Exports,616,Poland,,0,World,,,,,,,,,12,"Oil seeds and oleaginous fruits; miscellaneous grains, seeds and fruit, industrial or medicinal plants; straw and fodder",,,,,,,0,,39376066,,,0
HS,2019,201904,April 2019,2,0,2,Exports,616,Poland,,0,World,,,,,,,,,19,"Preparations of cereals, flour, starch or milk; pastrycooks' products",,,,,,,0,,215417227,,,0
HS,2019,201904,April 2019,2,0,2,Exports,616,Poland,,0,World,,,,,,,,,20,"Preparations of vegetables, fruit, nuts or other parts of plants",,,,,,,0,,132392863,,,0
HS,2019,201904,April 2019,2,0,2,Exports,616,Poland,,0,World,,,,,,,,,99,Commodities not specified according to kind,,,,,,,0,,39825042,,,0
HS,2019,201904,April 2019,2,0,2,Exports,616,Poland,,0,World,,,,,,,,,11,"Products of the milling industry; malt, starches, inulin, wheat gluten",,,,,,,0,,29598271,,,0
HS,2019,201904,April 2019,2,0,2,Exports,616,Poland,,0,World,,,,,,,,,96,Miscellaneous manufactured articles,,,,,,,0,,126696792,,,0
HS,2019,201904,April 2019,2,0,2,Exports,616,Poland,,0,World,,,,,,,,,94,"Furniture; bedding, mattresses, mattress supports, cushions and similar stuffed furnishings; lamps and lighting fittings, n.e.s.; illuminated signs, illuminated name-plates and the like; prefabricated buildings",,,,,,,0,,1254038356,,,0
HS,2019,201904,April 2019,2,0,2,Exports,616,Poland,,0,World,,,,,,,,,84,"Nuclear reactors, boilers, machinery and mechanical appliances; parts thereof",,,,,,,0,,2924120200,,,0
HS,2019,201904,April 2019,2,0,2,Exports,616,Poland,,0,World,,,,,,,,,90,"Optical, photographic, cinematographic, measuring, checking, medical or surgical instruments and apparatus; parts and accessories",,,,,,,0,,411867025,,,0
HS,2019,201904,April 2019,2,0,2,Exports,616,Poland,,0,World,,,,,,,,,85,"Electrical machinery and equipment and parts thereof; sound recorders and reproducers; television image and sound recorders and reproducers, parts and accessories of such articles",,,,,,,0,,2077209150,,,0
HS,2019,201904,April 2019,2,0,2,Exports,616,Poland,,0,World,,,,,,,,,92,Musical instruments; parts and accessories of such articles,,,,,,,0,,2856942,,,0
HS,2019,201904,April 2019,2,0,2,Exports,616,Poland,,0,World,,,,,,,,,10,Cereals,,,,,,,0,,46948222,,,0
HS,2019,201904,April 2019,2,0,2,Exports,616,Poland,,0,World,,,,,,,,,97,Works of art; collectors' pieces and antiques,,,,,,,0,,703488,,,0
HS,2019,201904,April 2019,2,0,2,Exports,616,Poland,,0,World,,,,,,,,,39,Plastics and articles thereof,,,,,,,0,,1041316453,,,0
HS,2019,201904,April 2019,2,0,2,Exports,616,Poland,,0,World,,,,,,,,,15,Animal or vegetable fats and oils and their cleavage products; prepared animal fats; animal or vegetable waxes,,,,,,,0,,40425023,,,0
HS,2019,201904,April 2019,2,0,2,Exports,616,Poland,,0,World,,,,,,,,,25,"Salt; sulphur; earths, stone; plastering materials, lime and cement",,,,,,,0,,24586186,,,0
HS,2019,201904,April 2019,2,0,2,Exports,616,Poland,,0,World,,,,,,,,,17,Sugars and sugar confectionery,,,,,,,0,,62018156,,,0
HS,2019,201904,April 2019,2,0,2,Exports,616,Poland,,0,World,,,,,,,,,07,Vegetables and certain roots and tubers; edible,,,,,,,0,,112586588,,,0
HS,2019,201904,April 2019,2,0,2,Exports,616,Poland,,0,World,,,,,,,,,05,Animal originated products; not elsewhere specified or included,,,,,,,0,,37290849,,,0
HS,2019,201904,April 2019,2,0,2,Exports,616,Poland,,0,World,,,,,,,,,23,"Food industries, residues and wastes thereof; prepared animal fodder",,,,,,,0,,136220588,,,0
HS,2019,201904,April 2019,2,0,2,Exports,616,Poland,,0,World,,,,,,,,,22,"Beverages, spirits and vinegar",,,,,,,0,,78805552,,,0
HS,2019,201904,April 2019,2,0,2,Exports,616,Poland,,0,World,,,,,,,,,26,"Ores, slag and ash",,,,,,,0,,6819227,,,0
HS,2019,201904,April 2019,2,0,2,Exports,616,Poland,,0,World,,,,,,,,,34,"Soap, organic surface-active agents; washing, lubricating, polishing or scouring preparations; artificial or prepared waxes, candles and similar articles, modelling pastes, ""dental waxes"" and dental preparations with a basis of plaster",,,,,,,0,,196716528,,,0
HS,2019,201904,April 2019,2,0,2,Exports,616,Poland,,0,World,,,,,,,,,33,"Essential oils and resinoids; perfumery, cosmetic or toilet preparations",,,,,,,0,,314787925,,,0
HS,2019,201904,April 2019,2,0,2,Exports,616,Poland,,0,World,,,,,,,,,04,"Dairy produce; birds' eggs; natural honey; edible products of animal origin, not elsewhere specified or included",,,,,,,0,,247009295,,,0
HS,2019,201904,April 2019,2,0,2,Exports,616,Poland,,0,World,,,,,,,,,02,Meat and edible meat offal,,,,,,,0,,488714906,,,0
HS,2019,201904,April 2019,2,0,2,Exports,616,Poland,,0,World,,,,,,,,,36,Explosives; pyrotechnic products; matches; pyrophoric alloys; certain combustible preparations,,,,,,,0,,4253374,,,0
HS,2019,201904,April 2019,2,0,2,Exports,616,Poland,,0,World,,,,,,,,,38,Chemical products n.e.s.,,,,,,,0,,240404692,,,0
HS,2019,201904,April 2019,2,0,2,Exports,616,Poland,,0,World,,,,,,,,,13,"Lac; gums, resins and other vegetable saps and extracts",,,,,,,0,,2557283,,,0
HS,2019,201904,April 2019,2,0,2,Exports,616,Poland,,0,World,,,,,,,,,37,Photographic or cinematographic goods,,,,,,,0,,2403006,,,0
HS,2019,201904,April 2019,2,0,2,Exports,616,Poland,,0,World,,,,,,,,,35,Albuminoidal substances; modified starches; glues; enzymes,,,,,,,0,,25230038,,,0
HS,2019,201904,April 2019,2,0,2,Exports,616,Poland,,0,World,,,,,,,,,32,"Tanning or dyeing extracts; tannins and their derivatives; dyes, pigments and other colouring matter; paints, varnishes; putty, other mastics; inks",,,,,,,0,,108527145,,,0
HS,2019,201904,April 2019,2,0,2,Exports,616,Poland,,0,World,,,,,,,,,40,Rubber and articles thereof,,,,,,,0,,437073974,,,0
HS,2019,201904,April 2019,2,0,2,Exports,616,Poland,,0,World,,,,,,,,,42,"Articles of leather; saddlery and harness; travel goods, handbags and similar containers; articles of animal gut (other than silk-worm gut)",,,,,,,0,,55102766,,,0
HS,2019,201904,April 2019,2,0,2,Exports,616,Poland,,0,World,,,,,,,,,47,Pulp of wood or other fibrous cellulosic material; waste and scrap of paper or paperboard,,,,,,,0,,23817073,,,0
HS,2019,201904,April 2019,2,0,2,Exports,616,Poland,,0,World,,,,,,,,,44,Wood and articles of wood; wood charcoal,,,,,,,0,,311958915,,,0
HS,2019,201904,April 2019,2,0,2,Exports,616,Poland,,0,World,,,,,,,,,49,"Printed books, newspapers, pictures and other products of the printing industry; manuscripts, typescripts and plans",,,,,,,0,,169259829,,,0
HS,2019,201904,April 2019,2,0,2,Exports,616,Poland,,0,World,,,,,,,,,50,Silk,,,,,,,0,,17308,,,0
HS,2019,201904,April 2019,2,0,2,Exports,616,Poland,,0,World,,,,,,,,,06,"Trees and other plants, live; bulbs, roots and the like; cut flowers and ornamental foliage",,,,,,,0,,28189940,,,0
HS,2019,201904,April 2019,2,0,2,Exports,616,Poland,,0,World,,,,,,,,,95,"Toys, games and sports requisites; parts and accessories thereof",,,,,,,0,,157551365,,,0
HS,2019,201904,April 2019,2,0,2,Exports,616,Poland,,0,World,,,,,,,,,45,Cork and articles of cork,,,,,,,0,,574702,,,0
HS,2019,201904,April 2019,2,0,2,Exports,616,Poland,,0,World,,,,,,,,,46,"Manufactures of straw, esparto or other plaiting materials; basketware and wickerwork",,,,,,,0,,4176219,,,0
HS,2019,201904,April 2019,2,0,2,Exports,616,Poland,,0,World,,,,,,,,,08,"Fruit and nuts, edible; peel of citrus fruit or melons",,,,,,,0,,104234040,,,0
HS,2019,201904,April 2019,2,0,2,Exports,616,Poland,,0,World,,,,,,,,,27,"Mineral fuels, mineral oils and products of their distillation; bituminous substances; mineral waxes",,,,,,,0,,526620462,,,0
HS,2019,201904,April 2019,2,0,2,Exports,616,Poland,,0,World,,,,,,,,,18,Cocoa and cocoa preparations,,,,,,,0,,142736590,,,0
HS,2019,201904,April 2019,2,0,2,Exports,616,Poland,,0,World,,,,,,,,,28,"Inorganic chemicals; organic and inorganic compounds of precious metals; of rare earth metals, of radio-active elements and of isotopes",,,,,,,0,,93251126,,,0
HS,2019,201904,April 2019,2,0,2,Exports,616,Poland,,0,World,,,,,,,,,31,Fertilizers,,,,,,,0,,73743382,,,0
HS,2019,201904,April 2019,2,0,2,Exports,616,Poland,,0,World,,,,,,,,,24,Tobacco and manufactured tobacco substitutes,,,,,,,0,,388613313,,,0
HS,2019,201904,April 2019,2,0,2,Exports,616,Poland,,0,World,,,,,,,,,30,Pharmaceutical products,,,,,,,0,,307359532,,,0
HS,2019,201904,April 2019,2,0,2,Exports,616,Poland,,0,World,,,,,,,,,21,Miscellaneous edible preparations,,,,,,,0,,205223747,,,0
HS,2019,201904,April 2019,2,0,2,Exports,616,Poland,,0,World,,,,,,,,,09,"Coffee, tea, mate and spices",,,,,,,0,,53929514,,,0
HS,2019,201904,April 2019,2,0,2,Exports,616,Poland,,0,World,,,,,,,,,86,"Railway, tramway locomotives, rolling-stock and parts thereof; railway or tramway track fixtures and fittings and parts thereof; mechanical (including electro-mechanical) traffic signalling equipment of all kinds",,,,,,,0,,108693978,,,0
HS,2019,201904,April 2019,2,0,2,Exports,616,Poland,,0,World,,,,,,,,,69,Ceramic products,,,,,,,0,,85169182,,,0
HS,2019,201904,April 2019,2,0,2,Exports,616,Poland,,0,World,,,,,,,,,68,"Stone, plaster, cement, asbestos, mica or similar materials; articles thereof",,,,,,,0,,137161782,,,0
HS,2019,201904,April 2019,2,0,2,Exports,616,Poland,,0,World,,,,,,,,,56,"Wadding, felt and nonwovens, special yarns; twine, cordage, ropes and cables and articles thereof",,,,,,,0,,40756520,,,0
HS,2019,201904,April 2019,2,0,2,Exports,616,Poland,,0,World,,,,,,,,,71,"Natural, cultured pearls; precious, semi-precious stones; precious metals, metals clad with precious metal, and articles thereof; imitation jewellery; coin",,,,,,,0,,101356219,,,0
HS,2019,201904,April 2019,2,0,2,Exports,616,Poland,,0,World,,,,,,,,,73,Iron or steel articles,,,,,,,0,,766370350,,,0
HS,2019,201904,April 2019,2,0,2,Exports,616,Poland,,0,World,,,,,,,,,79,Zinc and articles thereof,,,,,,,0,,28095032,,,0
HS,2019,201904,April 2019,2,0,2,Exports,616,Poland,,0,World,,,,,,,,,78,Lead and articles thereof,,,,,,,0,,14733021,,,0
HS,2019,201904,April 2019,2,0,2,Exports,616,Poland,,0,World,,,,,,,,,76,Aluminium and articles thereof,,,,,,,0,,319785207,,,0
HS,2019,201904,April 2019,2,0,2,Exports,616,Poland,,0,World,,,,,,,,,82,"Tools, implements, cutlery, spoons and forks, of base metal; parts thereof, of base metal",,,,,,,0,,163696512,,,0
HS,2019,201904,April 2019,2,0,2,Exports,616,Poland,,0,World,,,,,,,,,81,"Metals; n.e.s., cermets and articles thereof",,,,,,,0,,3793062,,,0
HS,2019,201904,April 2019,2,0,2,Exports,616,Poland,,0,World,,,,,,,,,52,Cotton,,,,,,,0,,3919218,,,0
HS,2019,201904,April 2019,2,0,2,Exports,616,Poland,,0,World,,,,,,,,,58,"Fabrics; special woven fabrics, tufted textile fabrics, lace, tapestries, trimmings, embroidery",,,,,,,0,,5080773,,,0
HS,2019,201904,April 2019,2,0,2,Exports,616,Poland,,0,World,,,,,,,,,87,"Vehicles; other than railway or tramway rolling stock, and parts and accessories thereof",,,,,,,0,,2724105037,,,0
HS,2019,201904,April 2019,2,0,2,Exports,616,Poland,,0,World,,,,,,,,,54,Man-made filaments,,,,,,,0,,23965758,,,0
HS,2019,201904,April 2019,2,0,2,Exports,616,Poland,,0,World,,,,,,,,,88,"Aircraft, spacecraft and parts thereof",,,,,,,0,,88763824,,,0
HS,2019,201904,April 2019,2,0,2,Exports,616,Poland,,0,World,,,,,,,,,91,Clocks and watches and parts thereof,,,,,,,0,,7370594,,,0
HS,2019,201904,April 2019,2,0,2,Exports,616,Poland,,0,World,,,,,,,,,89,"Ships, boats and floating structures",,,,,,,0,,218875251,,,0
HS,2019,201904,April 2019,2,0,2,Exports,616,Poland,,0,World,,,,,,,,,83,Metal; miscellaneous products of base metal,,,,,,,0,,198681345,,,0
HS,2019,201904,April 2019,2,0,2,Exports,616,Poland,,0,World,,,,,,,,,74,Copper and articles thereof,,,,,,,0,,307796605,,,0
HS,2019,201904,April 2019,2,0,2,Exports,616,Poland,,0,World,,,,,,,,,75,Nickel and articles thereof,,,,,,,0,,2577567,,,0
HS,2019,201904,April 2019,2,0,2,Exports,616,Poland,,0,World,,,,,,,,,80,Tin; articles thereof,,,,,,,0,,8118466,,,0
HS,2019,201904,April 2019,2,0,2,Exports,616,Poland,,0,World,,,,,,,,,93,Arms and ammunition; parts and accessories thereof,,,,,,,0,,13402978,,,0
