HS,2019,201911,November 2019,2,0,2,Exports,724,Spain,,0,World,,,,,,,,,12,"Oil seeds and oleaginous fruits; miscellaneous grains, seeds and fruit, industrial or medicinal plants; straw and fodder",,,,,,,,,62008921,,,0
HS,2019,201911,November 2019,2,0,2,Exports,724,Spain,,0,World,,,,,,,,,11,"Products of the milling industry; malt, starches, inulin, wheat gluten",,,,,,,,,29094209,,,0
HS,2019,201911,November 2019,2,0,2,Exports,724,Spain,,0,World,,,,,,,,,08,"Fruit and nuts, edible; peel of citrus fruit or melons",,,,,,,,,899386138,,,0
HS,2019,201911,November 2019,2,0,2,Exports,724,Spain,,0,World,,,,,,,,,06,"Trees and other plants, live; bulbs, roots and the like; cut flowers and ornamental foliage",,,,,,,0,,36472230,,,0
HS,2019,201911,November 2019,2,0,2,Exports,724,Spain,,0,World,,,,,,,,,15,Animal or vegetable fats and oils and their cleavage products; prepared animal fats; animal or vegetable waxes,,,,,,,0,,356346306,,,0
HS,2019,201911,November 2019,2,0,2,Exports,724,Spain,,0,World,,,,,,,,,16,"Meat, fish or crustaceans, molluscs or other aquatic invertebrates; preparations thereof",,,,,,,0,,145445495,,,0
HS,2019,201911,November 2019,2,0,2,Exports,724,Spain,,0,World,,,,,,,,,20,"Preparations of vegetables, fruit, nuts or other parts of plants",,,,,,,0,,274444171,,,0
HS,2019,201911,November 2019,2,0,2,Exports,724,Spain,,0,World,,,,,,,,,21,Miscellaneous edible preparations,,,,,,,0,,142916594,,,0
HS,2019,201911,November 2019,2,0,2,Exports,724,Spain,,0,World,,,,,,,,,22,"Beverages, spirits and vinegar",,,,,,,0,,432767602,,,0
HS,2019,201911,November 2019,2,0,2,Exports,724,Spain,,0,World,,,,,,,,,01,Animals; live,,,,,,,0,,70375652,,,0
HS,2019,201911,November 2019,2,0,2,Exports,724,Spain,,0,World,,,,,,,,,02,Meat and edible meat offal,,,,,,,0,,882370760,,,0
HS,2019,201911,November 2019,2,0,2,Exports,724,Spain,,0,World,,,,,,,,,03,"Fish and crustaceans, molluscs and other aquatic invertebrates",,,,,,,0,,296062560,,,0
HS,2019,201911,November 2019,2,0,2,Exports,724,Spain,,0,World,,,,,,,,,05,Animal originated products; not elsewhere specified or included,,,,,,,0,,36661582,,,0
HS,2019,201911,November 2019,2,0,2,Exports,724,Spain,,0,World,,,,,,,,,04,"Dairy produce; birds' eggs; natural honey; edible products of animal origin, not elsewhere specified or included",,,,,,,0,,134392220,,,0
HS,2019,201911,November 2019,2,0,2,Exports,724,Spain,,0,World,,,,,,,,,07,Vegetables and certain roots and tubers; edible,,,,,,,0,,713485068,,,0
HS,2019,201911,November 2019,2,0,2,Exports,724,Spain,,0,World,,,,,,,,,63,"Textiles, made up articles; sets; worn clothing and worn textile articles; rags",,,,,,,0,,57644395,,,0
HS,2019,201911,November 2019,2,0,2,Exports,724,Spain,,0,World,,,,,,,,,65,Headgear and parts thereof,,,,,,,0,,13282603,,,0
HS,2019,201911,November 2019,2,0,2,Exports,724,Spain,,0,World,,,,,,,,,70,Glass and glassware,,,,,,,0,,120001012,,,0
HS,2019,201911,November 2019,2,0,2,Exports,724,Spain,,0,World,,,,,,,,,73,Iron or steel articles,,,,,,,0,,588931995,,,0
HS,2019,201911,November 2019,2,0,2,Exports,724,Spain,,0,World,,,,,,,,,69,Ceramic products,,,,,,,0,,296775681,,,0
HS,2019,201911,November 2019,2,0,2,Exports,724,Spain,,0,World,,,,,,,,,66,"Umbrellas, sun umbrellas, walking-sticks, seat sticks, whips, riding crops; and parts thereof",,,,,,,0,,2013742,,,0
HS,2019,201906,June 2019,2,0,2,Exports,724,Spain,,0,World,,,,,,,,,36,Explosives; pyrotechnic products; matches; pyrophoric alloys; certain combustible preparations,,,,,,,0,,10462762,,,0
HS,2019,201906,June 2019,2,0,2,Exports,724,Spain,,0,World,,,,,,,,,24,Tobacco and manufactured tobacco substitutes,,,,,,,0,,30399614,,,0
HS,2019,201904,April 2019,2,0,2,Exports,724,Spain,,0,World,,,,,,,,,65,Headgear and parts thereof,,,,,,,0,,10960959,,,0
HS,2019,201904,April 2019,2,0,2,Exports,724,Spain,,0,World,,,,,,,,,24,Tobacco and manufactured tobacco substitutes,,,,,,,0,,20477141,,,0
HS,2019,201904,April 2019,2,0,2,Exports,724,Spain,,0,World,,,,,,,,,50,Silk,,,,,,,0,,167702,,,0
HS,2019,201904,April 2019,2,0,2,Exports,724,Spain,,0,World,,,,,,,,,51,"Wool, fine or coarse animal hair; horsehair yarn and woven fabric",,,,,,,0,,6137918,,,0
HS,2019,201904,April 2019,2,0,2,Exports,724,Spain,,0,World,,,,,,,,,53,Vegetable textile fibres; paper yarn and woven fabrics of paper yarn,,,,,,,0,,13614366,,,0
HS,2019,201901,January 2019,2,0,2,Exports,724,Spain,,0,World,,,,,,,,,39,Plastics and articles thereof,,,,,,,0,,1114566361,,,0
HS,2019,201901,January 2019,2,0,2,Exports,724,Spain,,0,World,,,,,,,,,45,Cork and articles of cork,,,,,,,0,,27950117,,,0
HS,2019,201901,January 2019,2,0,2,Exports,724,Spain,,0,World,,,,,,,,,47,Pulp of wood or other fibrous cellulosic material; waste and scrap of paper or paperboard,,,,,,,,,64548689,,,0
HS,2019,201901,January 2019,2,0,2,Exports,724,Spain,,0,World,,,,,,,,,27,"Mineral fuels, mineral oils and products of their distillation; bituminous substances; mineral waxes",,,,,,,,,1260576722,,,0
HS,2019,201901,January 2019,2,0,2,Exports,724,Spain,,0,World,,,,,,,,,05,Animal originated products; not elsewhere specified or included,,,,,,,,,31847491,,,0
HS,2019,201901,January 2019,2,0,2,Exports,724,Spain,,0,World,,,,,,,,,23,"Food industries, residues and wastes thereof; prepared animal fodder",,,,,,,,,128611873,,,0
HS,2019,201901,January 2019,2,0,2,Exports,724,Spain,,0,World,,,,,,,,,26,"Ores, slag and ash",,,,,,,,,298872331,,,0
HS,2019,201901,January 2019,2,0,2,Exports,724,Spain,,0,World,,,,,,,,,07,Vegetables and certain roots and tubers; edible,,,,,,,0,,1018985299,,,0
HS,2019,201901,January 2019,2,0,2,Exports,724,Spain,,0,World,,,,,,,,,04,"Dairy produce; birds' eggs; natural honey; edible products of animal origin, not elsewhere specified or included",,,,,,,0,,134663004,,,0
HS,2019,201901,January 2019,2,0,2,Exports,724,Spain,,0,World,,,,,,,,,33,"Essential oils and resinoids; perfumery, cosmetic or toilet preparations",,,,,,,0,,429430375,,,0
HS,2019,201901,January 2019,2,0,2,Exports,724,Spain,,0,World,,,,,,,,,34,"Soap, organic surface-active agents; washing, lubricating, polishing or scouring preparations; artificial or prepared waxes, candles and similar articles, modelling pastes, ""dental waxes"" and dental preparations with a basis of plaster",,,,,,,0,,122753406,,,0
HS,2019,201901,January 2019,2,0,2,Exports,724,Spain,,0,World,,,,,,,,,08,"Fruit and nuts, edible; peel of citrus fruit or melons",,,,,,,0,,757326579,,,0
HS,2019,201901,January 2019,2,0,2,Exports,724,Spain,,0,World,,,,,,,,,06,"Trees and other plants, live; bulbs, roots and the like; cut flowers and ornamental foliage",,,,,,,0,,25009587,,,0
HS,2019,201901,January 2019,2,0,2,Exports,724,Spain,,0,World,,,,,,,,,49,"Printed books, newspapers, pictures and other products of the printing industry; manuscripts, typescripts and plans",,,,,,,0,,71074581,,,0
HS,2019,201901,January 2019,2,0,2,Exports,724,Spain,,0,World,,,,,,,,,54,Man-made filaments,,,,,,,0,,66329622,,,0
HS,2019,201901,January 2019,2,0,2,Exports,724,Spain,,0,World,,,,,,,,,52,Cotton,,,,,,,0,,54445539,,,0
HS,2019,201901,January 2019,2,0,2,Exports,724,Spain,,0,World,,,,,,,,,21,Miscellaneous edible preparations,,,,,,,0,,135024348,,,0
HS,2019,201901,January 2019,2,0,2,Exports,724,Spain,,0,World,,,,,,,,,25,"Salt; sulphur; earths, stone; plastering materials, lime and cement",,,,,,,0,,107745844,,,0
HS,2019,201901,January 2019,2,0,2,Exports,724,Spain,,0,World,,,,,,,,,22,"Beverages, spirits and vinegar",,,,,,,0,,369238331,,,0
HS,2019,201901,January 2019,2,0,2,Exports,724,Spain,,0,World,,,,,,,,,20,"Preparations of vegetables, fruit, nuts or other parts of plants",,,,,,,0,,268093589,,,0
HS,2019,201911,November 2019,2,0,2,Exports,724,Spain,,0,World,,,,,,,,,67,"Feathers and down, prepared; and articles made of feather or of down; artificial flowers; articles of human hair",,,,,,,0,,1452366,,,0
HS,2019,201911,November 2019,2,0,2,Exports,724,Spain,,0,World,,,,,,,,,62,Apparel and clothing accessories; not knitted or crocheted,,,,,,,0,,729743855,,,0
HS,2019,201901,January 2019,2,0,2,Exports,724,Spain,,0,World,,,,,,,,,02,Meat and edible meat offal,,,,,,,0,,557302563,,,0
HS,2019,201901,January 2019,2,0,2,Exports,724,Spain,,0,World,,,,,,,,,35,Albuminoidal substances; modified starches; glues; enzymes,,,,,,,0,,24751469,,,0
HS,2019,201901,January 2019,2,0,2,Exports,724,Spain,,0,World,,,,,,,,,03,"Fish and crustaceans, molluscs and other aquatic invertebrates",,,,,,,0,,251697981,,,0
HS,2019,201901,January 2019,2,0,2,Exports,724,Spain,,0,World,,,,,,,,,01,Animals; live,,,,,,,0,,51623733,,,0
HS,2019,201901,January 2019,2,0,2,Exports,724,Spain,,0,World,,,,,,,,,86,"Railway, tramway locomotives, rolling-stock and parts thereof; railway or tramway track fixtures and fittings and parts thereof; mechanical (including electro-mechanical) traffic signalling equipment of all kinds",,,,,,,0,,168516285,,,0
HS,2019,201901,January 2019,2,0,2,Exports,724,Spain,,0,World,,,,,,,,,79,Zinc and articles thereof,,,,,,,0,,127978874,,,0
HS,2019,201901,January 2019,2,0,2,Exports,724,Spain,,0,World,,,,,,,,,78,Lead and articles thereof,,,,,,,0,,3185758,,,0
HS,2019,201901,January 2019,2,0,2,Exports,724,Spain,,0,World,,,,,,,,,81,"Metals; n.e.s., cermets and articles thereof",,,,,,,0,,4006236,,,0
HS,2019,201901,January 2019,2,0,2,Exports,724,Spain,,0,World,,,,,,,,,80,Tin; articles thereof,,,,,,,0,,2194102,,,0
HS,2019,201901,January 2019,2,0,2,Exports,724,Spain,,0,World,,,,,,,,,95,"Toys, games and sports requisites; parts and accessories thereof",,,,,,,0,,120683093,,,0
HS,2019,201901,January 2019,2,0,2,Exports,724,Spain,,0,World,,,,,,,,,82,"Tools, implements, cutlery, spoons and forks, of base metal; parts thereof, of base metal",,,,,,,0,,89568251,,,0
HS,2019,201901,January 2019,2,0,2,Exports,724,Spain,,0,World,,,,,,,,,87,"Vehicles; other than railway or tramway rolling stock, and parts and accessories thereof",,,,,,,0,,4354997206,,,0
HS,2019,201901,January 2019,2,0,2,Exports,724,Spain,,0,World,,,,,,,,,85,"Electrical machinery and equipment and parts thereof; sound recorders and reproducers; television image and sound recorders and reproducers, parts and accessories of such articles",,,,,,,0,,1479710387,,,0
HS,2019,201901,January 2019,2,0,2,Exports,724,Spain,,0,World,,,,,,,,,84,"Nuclear reactors, boilers, machinery and mechanical appliances; parts thereof",,,,,,,0,,1963820554,,,0
HS,2019,201901,January 2019,2,0,2,Exports,724,Spain,,0,World,,,,,,,,,75,Nickel and articles thereof,,,,,,,0,,5042823,,,0
HS,2019,201901,January 2019,2,0,2,Exports,724,Spain,,0,World,,,,,,,,,74,Copper and articles thereof,,,,,,,0,,300013115,,,0
HS,2019,201901,January 2019,2,0,2,Exports,724,Spain,,0,World,,,,,,,,,96,Miscellaneous manufactured articles,,,,,,,0,,63551171,,,0
HS,2019,201901,January 2019,2,0,2,Exports,724,Spain,,0,World,,,,,,,,,90,"Optical, photographic, cinematographic, measuring, checking, medical or surgical instruments and apparatus; parts and accessories",,,,,,,0,,258612719,,,0
HS,2019,201901,January 2019,2,0,2,Exports,724,Spain,,0,World,,,,,,,,,30,Pharmaceutical products,,,,,,,0,,960983226,,,0
HS,2019,201901,January 2019,2,0,2,Exports,724,Spain,,0,World,,,,,,,,,66,"Umbrellas, sun umbrellas, walking-sticks, seat sticks, whips, riding crops; and parts thereof",,,,,,,0,,3002783,,,0
HS,2019,201901,January 2019,2,0,2,Exports,724,Spain,,0,World,,,,,,,,,68,"Stone, plaster, cement, asbestos, mica or similar materials; articles thereof",,,,,,,0,,173472149,,,0
HS,2019,201901,January 2019,2,0,2,Exports,724,Spain,,0,World,,,,,,,,,76,Aluminium and articles thereof,,,,,,,0,,344016567,,,0
HS,2019,201905,May 2019,2,0,2,Exports,724,Spain,,0,World,,,,,,,,,66,"Umbrellas, sun umbrellas, walking-sticks, seat sticks, whips, riding crops; and parts thereof",,,,,,,0,,2455815,,,0
HS,2019,201905,May 2019,2,0,2,Exports,724,Spain,,0,World,,,,,,,,,01,Animals; live,,,,,,,0,,75585237,,,0
HS,2019,201905,May 2019,2,0,2,Exports,724,Spain,,0,World,,,,,,,,,03,"Fish and crustaceans, molluscs and other aquatic invertebrates",,,,,,,0,,308590405,,,0
HS,2019,201905,May 2019,2,0,2,Exports,724,Spain,,0,World,,,,,,,,,43,Furskins and artificial fur; manufactures thereof,,,,,,,0,,10427610,,,0
HS,2019,201905,May 2019,2,0,2,Exports,724,Spain,,0,World,,,,,,,,,41,Raw hides and skins (other than furskins) and leather,,,,,,,0,,69820475,,,0
HS,2019,201905,May 2019,2,0,2,Exports,724,Spain,,0,World,,,,,,,,,55,Man-made staple fibres,,,,,,,0,,69423820,,,0
HS,2019,201905,May 2019,2,0,2,Exports,724,Spain,,0,World,,,,,,,,,51,"Wool, fine or coarse animal hair; horsehair yarn and woven fabric",,,,,,,0,,7490978,,,0
HS,2019,201905,May 2019,2,0,2,Exports,724,Spain,,0,World,,,,,,,,,48,"Paper and paperboard; articles of paper pulp, of paper or paperboard",,,,,,,0,,354716846,,,0
HS,2019,201905,May 2019,2,0,2,Exports,724,Spain,,0,World,,,,,,,,,60,Fabrics; knitted or crocheted,,,,,,,0,,31475299,,,0
HS,2019,201905,May 2019,2,0,2,Exports,724,Spain,,0,World,,,,,,,,,57,Carpets and other textile floor coverings,,,,,,,0,,10709341,,,0
HS,2019,201905,May 2019,2,0,2,Exports,724,Spain,,0,World,,,,,,,,,08,"Fruit and nuts, edible; peel of citrus fruit or melons",,,,,,,0,,1083723123,,,0
HS,2019,201905,May 2019,2,0,2,Exports,724,Spain,,0,World,,,,,,,,,25,"Salt; sulphur; earths, stone; plastering materials, lime and cement",,,,,,,0,,112375390,,,0
HS,2019,201905,May 2019,2,0,2,Exports,724,Spain,,0,World,,,,,,,,,29,Organic chemicals,,,,,,,0,,412628481,,,0
HS,2019,201905,May 2019,2,0,2,Exports,724,Spain,,0,World,,,,,,,,,15,Animal or vegetable fats and oils and their cleavage products; prepared animal fats; animal or vegetable waxes,,,,,,,0,,399916230,,,0
HS,2019,201905,May 2019,2,0,2,Exports,724,Spain,,0,World,,,,,,,,,10,Cereals,,,,,,,0,,26644000,,,0
HS,2019,201905,May 2019,2,0,2,Exports,724,Spain,,0,World,,,,,,,,,02,Meat and edible meat offal,,,,,,,0,,681909295,,,0
HS,2019,201905,May 2019,2,0,2,Exports,724,Spain,,0,World,,,,,,,,,13,"Lac; gums, resins and other vegetable saps and extracts",,,,,,,0,,45294874,,,0
HS,2019,201905,May 2019,2,0,2,Exports,724,Spain,,0,World,,,,,,,,,07,Vegetables and certain roots and tubers; edible,,,,,,,0,,551733589,,,0
HS,2019,201905,May 2019,2,0,2,Exports,724,Spain,,0,World,,,,,,,,,04,"Dairy produce; birds' eggs; natural honey; edible products of animal origin, not elsewhere specified or included",,,,,,,0,,139354803,,,0
HS,2019,201905,May 2019,2,0,2,Exports,724,Spain,,0,World,,,,,,,,,34,"Soap, organic surface-active agents; washing, lubricating, polishing or scouring preparations; artificial or prepared waxes, candles and similar articles, modelling pastes, ""dental waxes"" and dental preparations with a basis of plaster",,,,,,,0,,132466892,,,0
HS,2019,201905,May 2019,2,0,2,Exports,724,Spain,,0,World,,,,,,,,,33,"Essential oils and resinoids; perfumery, cosmetic or toilet preparations",,,,,,,0,,450814768,,,0
HS,2019,201905,May 2019,2,0,2,Exports,724,Spain,,0,World,,,,,,,,,38,Chemical products n.e.s.,,,,,,,0,,425477036,,,0
HS,2019,201905,May 2019,2,0,2,Exports,724,Spain,,0,World,,,,,,,,,22,"Beverages, spirits and vinegar",,,,,,,0,,427640160,,,0
HS,2019,201905,May 2019,2,0,2,Exports,724,Spain,,0,World,,,,,,,,,23,"Food industries, residues and wastes thereof; prepared animal fodder",,,,,,,0,,103221784,,,0
HS,2019,201905,May 2019,2,0,2,Exports,724,Spain,,0,World,,,,,,,,,16,"Meat, fish or crustaceans, molluscs or other aquatic invertebrates; preparations thereof",,,,,,,0,,165716833,,,0
HS,2019,201905,May 2019,2,0,2,Exports,724,Spain,,0,World,,,,,,,,,19,"Preparations of cereals, flour, starch or milk; pastrycooks' products",,,,,,,0,,180389108,,,0
HS,2019,201905,May 2019,2,0,2,Exports,724,Spain,,0,World,,,,,,,,,11,"Products of the milling industry; malt, starches, inulin, wheat gluten",,,,,,,0,,24544187,,,0
HS,2019,201905,May 2019,2,0,2,Exports,724,Spain,,0,World,,,,,,,,,58,"Fabrics; special woven fabrics, tufted textile fabrics, lace, tapestries, trimmings, embroidery",,,,,,,0,,15967762,,,0
HS,2019,201905,May 2019,2,0,2,Exports,724,Spain,,0,World,,,,,,,,,30,Pharmaceutical products,,,,,,,0,,1058074438,,,0
HS,2019,201905,May 2019,2,0,2,Exports,724,Spain,,0,World,,,,,,,,,52,Cotton,,,,,,,0,,58856780,,,0
HS,2019,201905,May 2019,2,0,2,Exports,724,Spain,,0,World,,,,,,,,,09,"Coffee, tea, mate and spices",,,,,,,0,,52392945,,,0
HS,2019,201905,May 2019,2,0,2,Exports,724,Spain,,0,World,,,,,,,,,21,Miscellaneous edible preparations,,,,,,,0,,178779707,,,0
HS,2019,201905,May 2019,2,0,2,Exports,724,Spain,,0,World,,,,,,,,,56,"Wadding, felt and nonwovens, special yarns; twine, cordage, ropes and cables and articles thereof",,,,,,,0,,52792175,,,0
HS,2019,201905,May 2019,2,0,2,Exports,724,Spain,,0,World,,,,,,,,,49,"Printed books, newspapers, pictures and other products of the printing industry; manuscripts, typescripts and plans",,,,,,,0,,58341290,,,0
HS,2019,201905,May 2019,2,0,2,Exports,724,Spain,,0,World,,,,,,,,,35,Albuminoidal substances; modified starches; glues; enzymes,,,,,,,0,,21933999,,,0
HS,2019,201905,May 2019,2,0,2,Exports,724,Spain,,0,World,,,,,,,,,32,"Tanning or dyeing extracts; tannins and their derivatives; dyes, pigments and other colouring matter; paints, varnishes; putty, other mastics; inks",,,,,,,0,,283060041,,,0
HS,2019,201905,May 2019,2,0,2,Exports,724,Spain,,0,World,,,,,,,,,37,Photographic or cinematographic goods,,,,,,,0,,7392840,,,0
HS,2019,201905,May 2019,2,0,2,Exports,724,Spain,,0,World,,,,,,,,,68,"Stone, plaster, cement, asbestos, mica or similar materials; articles thereof",,,,,,,0,,199719460,,,0
HS,2019,201905,May 2019,2,0,2,Exports,724,Spain,,0,World,,,,,,,,,71,"Natural, cultured pearls; precious, semi-precious stones; precious metals, metals clad with precious metal, and articles thereof; imitation jewellery; coin",,,,,,,0,,140822063,,,0
HS,2019,201905,May 2019,2,0,2,Exports,724,Spain,,0,World,,,,,,,,,06,"Trees and other plants, live; bulbs, roots and the like; cut flowers and ornamental foliage",,,,,,,0,,50277595,,,0
HS,2019,201905,May 2019,2,0,2,Exports,724,Spain,,0,World,,,,,,,,,61,Apparel and clothing accessories; knitted or crocheted,,,,,,,0,,387989740,,,0
HS,2019,201905,May 2019,2,0,2,Exports,724,Spain,,0,World,,,,,,,,,62,Apparel and clothing accessories; not knitted or crocheted,,,,,,,0,,708310368,,,0
HS,2019,201905,May 2019,2,0,2,Exports,724,Spain,,0,World,,,,,,,,,63,"Textiles, made up articles; sets; worn clothing and worn textile articles; rags",,,,,,,0,,70876739,,,0
HS,2019,201905,May 2019,2,0,2,Exports,724,Spain,,0,World,,,,,,,,,65,Headgear and parts thereof,,,,,,,0,,10743558,,,0
HS,2019,201905,May 2019,2,0,2,Exports,724,Spain,,0,World,,,,,,,,,64,Footwear; gaiters and the like; parts of such articles,,,,,,,0,,233414899,,,0
HS,2019,201905,May 2019,2,0,2,Exports,724,Spain,,0,World,,,,,,,,,67,"Feathers and down, prepared; and articles made of feather or of down; artificial flowers; articles of human hair",,,,,,,0,,1311995,,,0
HS,2019,201905,May 2019,2,0,2,Exports,724,Spain,,0,World,,,,,,,,,70,Glass and glassware,,,,,,,0,,138686877,,,0
HS,2019,201904,April 2019,2,0,2,Exports,724,Spain,,0,World,,,,,,,,,67,"Feathers and down, prepared; and articles made of feather or of down; artificial flowers; articles of human hair",,,,,,,0,,967327,,,0
HS,2019,201904,April 2019,2,0,2,Exports,724,Spain,,0,World,,,,,,,,,37,Photographic or cinematographic goods,,,,,,,0,,7506352,,,0
HS,2019,201904,April 2019,2,0,2,Exports,724,Spain,,0,World,,,,,,,,,46,"Manufactures of straw, esparto or other plaiting materials; basketware and wickerwork",,,,,,,0,,4581424,,,0
HS,2019,201904,April 2019,2,0,2,Exports,724,Spain,,0,World,,,,,,,,,60,Fabrics; knitted or crocheted,,,,,,,0,,35030162,,,0
HS,2019,201904,April 2019,2,0,2,Exports,724,Spain,,0,World,,,,,,,,,13,"Lac; gums, resins and other vegetable saps and extracts",,,,,,,0,,40855855,,,0
HS,2019,201904,April 2019,2,0,2,Exports,724,Spain,,0,World,,,,,,,,,14,Vegetable plaiting materials; vegetable products not elsewhere specified or included,,,,,,,0,,1030658,,,0
HS,2019,201904,April 2019,2,0,2,Exports,724,Spain,,0,World,,,,,,,,,16,"Meat, fish or crustaceans, molluscs or other aquatic invertebrates; preparations thereof",,,,,,,0,,150473654,,,0
HS,2019,201904,April 2019,2,0,2,Exports,724,Spain,,0,World,,,,,,,,,99,Commodities not specified according to kind,,,,,,,0,,562380875,,,0
HS,2019,201904,April 2019,2,0,2,Exports,724,Spain,,0,World,,,,,,,,,96,Miscellaneous manufactured articles,,,,,,,0,,59469479,,,0
HS,2019,201904,April 2019,2,0,2,Exports,724,Spain,,0,World,,,,,,,,,94,"Furniture; bedding, mattresses, mattress supports, cushions and similar stuffed furnishings; lamps and lighting fittings, n.e.s.; illuminated signs, illuminated name-plates and the like; prefabricated buildings",,,,,,,0,,304098679,,,0
HS,2019,201904,April 2019,2,0,2,Exports,724,Spain,,0,World,,,,,,,,,90,"Optical, photographic, cinematographic, measuring, checking, medical or surgical instruments and apparatus; parts and accessories",,,,,,,0,,270045804,,,0
HS,2019,201904,April 2019,2,0,2,Exports,724,Spain,,0,World,,,,,,,,,89,"Ships, boats and floating structures",,,,,,,0,,54783904,,,0
HS,2019,201904,April 2019,2,0,2,Exports,724,Spain,,0,World,,,,,,,,,92,Musical instruments; parts and accessories of such articles,,,,,,,0,,3996547,,,0
HS,2019,201904,April 2019,2,0,2,Exports,724,Spain,,0,World,,,,,,,,,91,Clocks and watches and parts thereof,,,,,,,0,,26163149,,,0
HS,2019,201904,April 2019,2,0,2,Exports,724,Spain,,0,World,,,,,,,,,74,Copper and articles thereof,,,,,,,0,,264089287,,,0
HS,2019,201904,April 2019,2,0,2,Exports,724,Spain,,0,World,,,,,,,,,84,"Nuclear reactors, boilers, machinery and mechanical appliances; parts thereof",,,,,,,0,,1859426792,,,0
HS,2019,201904,April 2019,2,0,2,Exports,724,Spain,,0,World,,,,,,,,,85,"Electrical machinery and equipment and parts thereof; sound recorders and reproducers; television image and sound recorders and reproducers, parts and accessories of such articles",,,,,,,0,,1417363563,,,0
HS,2019,201904,April 2019,2,0,2,Exports,724,Spain,,0,World,,,,,,,,,80,Tin; articles thereof,,,,,,,0,,13181483,,,0
HS,2019,201904,April 2019,2,0,2,Exports,724,Spain,,0,World,,,,,,,,,83,Metal; miscellaneous products of base metal,,,,,,,0,,124997822,,,0
HS,2019,201904,April 2019,2,0,2,Exports,724,Spain,,0,World,,,,,,,,,87,"Vehicles; other than railway or tramway rolling stock, and parts and accessories thereof",,,,,,,0,,4357361089,,,0
HS,2019,201904,April 2019,2,0,2,Exports,724,Spain,,0,World,,,,,,,,,95,"Toys, games and sports requisites; parts and accessories thereof",,,,,,,0,,122707490,,,0
HS,2019,201904,April 2019,2,0,2,Exports,724,Spain,,0,World,,,,,,,,,76,Aluminium and articles thereof,,,,,,,0,,339735854,,,0
HS,2019,201904,April 2019,2,0,2,Exports,724,Spain,,0,World,,,,,,,,,82,"Tools, implements, cutlery, spoons and forks, of base metal; parts thereof, of base metal",,,,,,,0,,99697668,,,0
HS,2019,201904,April 2019,2,0,2,Exports,724,Spain,,0,World,,,,,,,,,78,Lead and articles thereof,,,,,,,0,,2859504,,,0
HS,2019,201904,April 2019,2,0,2,Exports,724,Spain,,0,World,,,,,,,,,97,Works of art; collectors' pieces and antiques,,,,,,,0,,10050580,,,0
HS,2019,201904,April 2019,2,0,2,Exports,724,Spain,,0,World,,,,,,,,,75,Nickel and articles thereof,,,,,,,0,,3608768,,,0
HS,2019,201904,April 2019,2,0,2,Exports,724,Spain,,0,World,,,,,,,,,79,Zinc and articles thereof,,,,,,,0,,171235518,,,0
HS,2019,201904,April 2019,2,0,2,Exports,724,Spain,,0,World,,,,,,,,,81,"Metals; n.e.s., cermets and articles thereof",,,,,,,0,,5079764,,,0
HS,2019,201904,April 2019,2,0,2,Exports,724,Spain,,0,World,,,,,,,,,86,"Railway, tramway locomotives, rolling-stock and parts thereof; railway or tramway track fixtures and fittings and parts thereof; mechanical (including electro-mechanical) traffic signalling equipment of all kinds",,,,,,,0,,296122143,,,0
HS,2019,201904,April 2019,2,0,2,Exports,724,Spain,,0,World,,,,,,,,,88,"Aircraft, spacecraft and parts thereof",,,,,,,0,,667808604,,,0
HS,2019,201904,April 2019,2,0,2,Exports,724,Spain,,0,World,,,,,,,,,93,Arms and ammunition; parts and accessories thereof,,,,,,,0,,40622382,,,0
HS,2019,201904,April 2019,2,0,2,Exports,724,Spain,,0,World,,,,,,,,,41,Raw hides and skins (other than furskins) and leather,,,,,,,0,,58234565,,,0
HS,2019,201905,May 2019,2,0,2,Exports,724,Spain,,0,World,,,,,,,,,87,"Vehicles; other than railway or tramway rolling stock, and parts and accessories thereof",,,,,,,,,5146190880,,,0
HS,2019,201905,May 2019,2,0,2,Exports,724,Spain,,0,World,,,,,,,,,78,Lead and articles thereof,,,,,,,,,5877867,,,0
HS,2019,201905,May 2019,2,0,2,Exports,724,Spain,,0,World,,,,,,,,,94,"Furniture; bedding, mattresses, mattress supports, cushions and similar stuffed furnishings; lamps and lighting fittings, n.e.s.; illuminated signs, illuminated name-plates and the like; prefabricated buildings",,,,,,,,,343455529,,,0
HS,2019,201905,May 2019,2,0,2,Exports,724,Spain,,0,World,,,,,,,,,36,Explosives; pyrotechnic products; matches; pyrophoric alloys; certain combustible preparations,,,,,,,0,,10047765,,,0
HS,2019,201905,May 2019,2,0,2,Exports,724,Spain,,0,World,,,,,,,,,45,Cork and articles of cork,,,,,,,0,,27731886,,,0
HS,2019,201905,May 2019,2,0,2,Exports,724,Spain,,0,World,,,,,,,,,50,Silk,,,,,,,0,,215287,,,0
HS,2019,201905,May 2019,2,0,2,Exports,724,Spain,,0,World,,,,,,,,,53,Vegetable textile fibres; paper yarn and woven fabrics of paper yarn,,,,,,,0,,6315819,,,0
HS,2019,201905,May 2019,2,0,2,Exports,724,Spain,,0,World,,,,,,,,,59,"Textile fabrics; impregnated, coated, covered or laminated; textile articles of a kind suitable for industrial use",,,,,,,0,,35612127,,,0
HS,2019,201905,May 2019,2,0,2,Exports,724,Spain,,0,World,,,,,,,,,97,Works of art; collectors' pieces and antiques,,,,,,,0,,10341510,,,0
HS,2019,201905,May 2019,2,0,2,Exports,724,Spain,,0,World,,,,,,,,,99,Commodities not specified according to kind,,,,,,,0,,1435864287,,,0
HS,2019,201905,May 2019,2,0,2,Exports,724,Spain,,0,World,,,,,,,,,75,Nickel and articles thereof,,,,,,,0,,5034047,,,0
